attendance,clarityColor,easyColor,helpColor,helpCount,id,notHelpCount,onlineClass,quality,rClarity,rClass,rComments,rDate,rEasy,rEasyString,rErrorMsg,rHelpful,rInterest,rOverall,rOverallString,rStatus,rTextBookUse,rTimestamp,rWouldTakeAgain,sId,takenForCredit,teacher,teacherGrade,teacherRatingTags,unUsefulGrouping,usefulGrouping
Not Mandatory,average,average,average,0,35911047,0,online,average,3,GEG2320,"Geomatics requires a lot of technical work on the computer, the TA is awful because he/she didn&#39;t answer questions of the students outside of the lab session. This course is easy to pass but super hard to get a good grade (you will know that when you get a clue about the grading system of the course. ",03/07/2022,3.0,3.0,,3,N/A,3.0,3.0,1,N/A,1646667834000,Yes,0,Yes,,A+,[],people,people
Not Mandatory,good,good,good,0,35627231,0,online,awesome,5,GEG3105,"Awesome prof. He is always available to answer your questions. He is very knowledgeable and has a lot of experience with regards to remote sensing. The labs can be though, especially in a study from home environment but if you put the work in, it is very rewarding to see what you can accomplish in a semester. He gives you clear guidelines for exams",12/22/2021,4.0,4.0,,5,N/A,5.0,5.0,1,No,1640139020000,Yes,1452,Yes,,A-,"['Accessible outside class', 'Gives good feedback', 'Clear grading criteria']",people,people
Not Mandatory,average,good,average,0,35294945,0,online,poor,2,GEG2320,"It's not really prof Knudby's fault that his class is so boring, it's geomatics afterall. He seems like a nice enough guy, but the labs are worth so little and take upwards of 10 hours to complete (each). The TA for my class was pretty bad, and didn't answer any of my questions. This is a HARD class, don't take unless manditory!",11/23/2021,4.0,4.0,,2,N/A,2.0,2.0,1,No,1637710455000,No,1452,Yes,,N/A,['Lots of homework'],people,people
N/A,average,average,average,1,31976555,1,,poor,2,GEG2320,Not the most confident guy and he makes his lectures super boring. He more or less admitted the assignment was misguided. Have not learned much.,05/30/2019,3.0,3.0,,2,N/A,2.0,2.0,1,No,1559238731000,No,1452,Yes,,N/A,[],person,person
Not Mandatory,good,average,good,1,31450203,1,,awesome,5,GEG2320,Anders was one of the nicest professors that I've ever had. He was helpful when trying to figure out the tough labs and was very approachable to ask questions during/after class. He is very passionate about what he teaches and has a lot of insight on different topics to enhance the learning experience. I would definitely take another class of his!,03/19/2019,3.0,3.0,,5,N/A,5.0,5.0,3,No,1552959141000,Yes,1452,Yes,,A+,"['Caring', 'Amazing lectures ', 'Accessible outside class']",person,person
