attendance,clarityColor,easyColor,helpColor,helpCount,id,notHelpCount,onlineClass,quality,rClarity,rClass,rComments,rDate,rEasy,rEasyString,rErrorMsg,rHelpful,rInterest,rOverall,rOverallString,rStatus,rTextBookUse,rTimestamp,rWouldTakeAgain,sId,takenForCredit,teacher,teacherGrade,teacherRatingTags,unUsefulGrouping,usefulGrouping
Mandatory,poor,good,poor,0,35297711,0,online,awful,1,ADM3723,"Randomly started adding 1 question quizzes at the end of his classes with no warning for other students that couldn't be there. Does not give you clear instructions on your group project (especially the survey), just says you're doing it wrong. He's the toughest grader I've ever had in my 3 years of uni here, he makes me wanna drop out so bad",11/24/2021,5.0,5.0,,1,N/A,1.0,1.0,1,Yes,1637775116000,No,1452,Yes,,Not sure yet,"['Tough grader', 'Group projects']",people,people
Mandatory,poor,good,poor,0,35297686,0,online,awful,1,ADM3726,"This prof has zero respect for his students, he will absolutely attack you during final presentations and you have to sit there and take it. His instructions for the group presentation are so unclear, he can't practice what he preaches either. Save your time; take this course in English or something cuz he will demolish your spirit and confidence.",11/24/2021,5.0,5.0,,1,N/A,1.0,1.0,1,Yes,1637774792000,No,1452,Yes,,Not sure yet,"['Group projects', 'Tough grader', 'Graded by few things']",people,people
Mandatory,poor,good,poor,0,35297658,0,,awful,1,ADM3726,Midterm is easy. Very few instructions for projects but he has high expectations. He said insanely rude comments to people about their presentations in front of the whole class. Would not recommend this class if you respect yourself.,11/24/2021,4.0,4.0,,1,N/A,1.0,1.0,1,No,1637774349000,No,1452,Yes,,N/A,"['Tough grader', 'Group projects', 'Graded by few things']",people,people
Mandatory,poor,good,poor,0,35297580,0,,awful,1,ADM3726,"While he mainly reads his powerpoint with his stupid bird chirping in the background, he expects so much but doesn't tell you what he wants. The group project is so unclear it hurts. He tells you what he what to do but doesn't explain how and what he expects. Then insults you in front of the whole class. He's degrading but the midterms were easy.",11/24/2021,4.0,4.0,,1,N/A,1.0,1.0,1,No,1637772695000,No,1452,Yes,,Not sure yet,"['Group projects', 'Participation matters', 'Tough grader']",people,people
N/A,average,average,average,0,34438287,0,online,average,3,ADM3722,"He's almost always late to his class and he seems to read the power point as he presents it (not prepared). His class have a important lack of dynamism, but he gives good examples. If your looking for a class where you can only read the power point to pass, it's great, but if you need motivation and dynamisme, that's not the one.",03/15/2021,3.0,3.0,,3,N/A,3.0,3.0,1,Yes,1615814837000,No,1452,Yes,,N/A,"['Group projects', 'EXTRA CREDIT', 'Accessible outside class']",people,people
Not Mandatory,average,average,average,0,34243029,0,,poor,2,ADM3726,Overall a very lazy prof. He puts no effort in his teaching making the classes super boring. The midterms were super easy and the group project was graded pretty subjectively. The final was so hard it was like nothing we had ever seen in the course. Dont take this prof.,01/06/2021,3.0,3.0,,2,N/A,2.0,2.0,1,No,1609910569000,No,1452,Yes,,Not sure yet,[],people,people
Not Mandatory,average,average,average,0,33512196,0,,poor,2,ADM3723,"Nice lectures, but i feel like the professor does not want people to pass",07/16/2020,3.0,3.0,,2,N/A,2.0,2.0,1,No,1594921162000,No,1452,Yes,,A-,"['Group projects', 'Amazing lectures ']",people,people
