attendance,clarityColor,easyColor,helpColor,helpCount,id,notHelpCount,onlineClass,quality,rClarity,rClass,rComments,rDate,rEasy,rEasyString,rErrorMsg,rHelpful,rInterest,rOverall,rOverallString,rStatus,rTextBookUse,rTimestamp,rWouldTakeAgain,sId,takenForCredit,teacher,teacherGrade,teacherRatingTags,unUsefulGrouping,usefulGrouping
N/A,poor,good,average,0,24687322,0,,poor,1,PSY3777,Never again!!!!!!,04/28/2015,4.0,4.0,,3,It's my life,2.0,2.0,1,Yes,1430231164000,N/A,1452,Yes,,N/A,"['Tough grader', 'Lots of homework']",people,people
N/A,poor,good,average,0,24623380,0,,average,1,PSY3777,"Elle est très gentille comme personne et elle va t'aider si tu as besoin d'aide. Toutefois, elle a des attentes qui sont irréalistes face à ces étudiants. Comment un prof qui nous enseigne comment le cerveau fonctionne va nous demander d'apprendre autant que ça? ",04/19/2015,5.0,5.0,,4,Really into it,2.5,2.5,1,Yes,1429452748000,N/A,1452,Yes,,Not sure yet,"['Caring', 'Get ready to read', 'Tough grader']",people,people
N/A,poor,good,poor,0,24623366,0,,poor,1,PSY3777,Worse psychology class in four years. I will never take a class with her again. AVOID IT!! I repeat AVOID IT!!,04/19/2015,5.0,5.0,,2,Sorta interested,1.5,1.5,1,Yes,1429452481000,N/A,1452,Yes,,N/A,"['Get ready to read', 'Lecture heavy']",people,people
Mandatory,poor,good,poor,0,24621748,0,,awful,1,PSY3777,Horrible. Just a terrible experience. Would not recommend.,04/18/2015,5.0,5.0,,1,Sorta interested,1.0,1.0,1,Yes,1429390954000,N/A,1452,Yes,,A+,['Get ready to read'],people,people
Not Mandatory,average,good,average,0,24588847,0,,average,3,PSYY3777,I loved cognition before I took her class.,04/13/2015,5.0,5.0,,2,Meh,2.5,2.5,1,Yes,1428958017000,N/A,1452,Yes,,A+,"['Lecture heavy', 'Tough grader']",people,people
N/A,average,good,average,0,24564426,0,,poor,2,PSY,"She's really nice as a person. However, as a teacher she's not really good. The mid-term had 5 chapters, the final exam 7 chapters and 3 presentations. In total, at least 250 pages of readings in the book AND everything is on the exam. ",04/08/2015,5.0,5.0,,2,Sorta interested,2.0,2.0,1,Yes,1428520272000,N/A,1452,Yes,,A+,"['Tough grader', 'Get ready to read', 'Amazing lectures ']",people,people
N/A,poor,good,poor,0,24552501,0,,poor,1,PSYY3777,"Something I don't understand. She teaches a course that informs us the limits of the brain and cognition. Therefore, she hopes that we learn ten million things for exams. I am in 3rd year and is the worst teacher I've had.  ",04/06/2015,5.0,5.0,,2,Low,1.5,1.5,1,Yes,1428359967000,N/A,1452,Yes,,N/A,[],people,people
