attendance,clarityColor,easyColor,helpColor,helpCount,id,notHelpCount,onlineClass,quality,rClarity,rClass,rComments,rDate,rEasy,rEasyString,rErrorMsg,rHelpful,rInterest,rOverall,rOverallString,rStatus,rTextBookUse,rTimestamp,rWouldTakeAgain,sId,takenForCredit,teacher,teacherGrade,teacherRatingTags,unUsefulGrouping,usefulGroupingMandatory,average,good,good,8,25545280,0,,good,3,BIO3124,"great man, tough tests/material. Studying hard doesnt necessarily mean you'll do as well as you like. Sometimes even if you think you understand, when you get your marks back you'll realize you dont. ",12/03/2015,5.0,5.0,,5,Sorta interested,4.0,4.0,1,No,1449187026000,N/A,1452,Yes,,Not sure yet,"['Gives good feedback', 'Tough grader']",people,people
Mandatory,average,good,average,4,25541255,0,,average,3,BIO3124,"Basso is a decent lecturer but his midterms dont reflect class material. Studied for over a week for both midterms and still averaging a 76 in the course. Very annoying considering that much effort should be reflected in grades. If you go to him for help he is always willing to, but 80% of what he says are jokes and him just trying to be relatable.",12/03/2015,5.0,5.0,,3,Sorta interested,3.0,3.0,1,No,1449163141000,N/A,1452,Yes,,B+,"['Caring', 'Tough grader']",people,people
Mandatory,good,good,good,3,25197328,0,,awesome,4,BIO3151,"While there's a little disorganization (near the end), John makes sure his students don't pay for it. On tests and assignments, questions are either straightforward or impossible... until he explains his train of thought and works through it with you. Listen to what he says and there are no surprises. A real gem of a prof and mentor.",09/18/2015,4.0,4.0,,5,It's my life,4.5,4.5,1,No,1442594961000,N/A,1452,Yes,,A+,"['Inspirational', 'Caring', 'Respected']",people,people
Mandatory,average,average,average,4,24915529,0,,good,3,BIO3151,"Jon's the biggest boss on campus. All about understanding the concepts, so throw away your quick memorization regurgitation routine because that won't help you in his class. Wants you to genuinely understand the material and is always willing to help at any time of the day. If he's in and his door is open, go in and seek help!",05/28/2015,3.0,3.0,,4,Really into it,3.5,3.5,1,No,1432848347000,N/A,1452,Yes,,A+,"['Caring', 'Inspirational']",people,people
Mandatory,good,good,good,1,24407821,0,,awesome,4,BPS3151,"He's the most helpful prof at UOttawa. Assignments look tough at first but once you start to figure out the theory, the material is easy. Go to his office for help because he answers any question and doesn't make you feel dumb about it. Overall a great person. ",02/24/2015,4.0,4.0,,5,Really into it,4.5,4.5,1,No,1424775879000,N/A,1452,Yes,,N/A,"['Respected', 'Inspirational', 'Gives good feedback']",people,person
N/A,average,good,good,2,24294010,0,,good,3,BIO3525,"Aide extrêmement ses étudiants. Allez à son bureau poser vos questions ça vaut la peine!! Prof très intelligent et admet ses erreurs quand il en fait. Examen sous forme de scartch card donc facile d'obtenir des points. Questions d'exam difficiles, il faut être bien préparé.",01/15/2015,4.0,4.0,,5,Really into it,4.0,4.0,1,No,1421344991000,N/A,1452,Yes,,N/A,"['Respected', 'Gives good feedback']",people,people
Mandatory,good,good,good,2,23994485,0,,awesome,4,BIO3524,"Great person who cares about his students. Exams can be a tad challenging, but he likes to recycle some questions from the previous exams and assignments. Best advice I can offer to ace this class is to read your notes after classend of the week and discuss with him. If you ask a question that's on the exam, he will implicitly tell you it's on...",12/08/2014,4.0,4.0,,5,Sorta interested,4.5,4.5,1,No,1418080976000,N/A,1452,Yes,,A-,"['Lots of homework', 'Respected', 'Tough grader']",people,people
N/A,good,average,good,0,23646964,0,,awesome,4,BIO3524,Real interesting class and very helpful prof.,10/11/2014,3.0,3.0,,5,It's my life,4.5,4.5,1,No,1413032421000,N/A,1452,N/A,,Not sure yet,['Caring'],people,people
Mandatory,good,average,good,0,23031370,0,,awesome,5,BPS3151,"Great prof, amazing human being.",04/13/2014,2.0,2.0,,5,It's my life,5.0,5.0,1,No,1397412932000,N/A,1452,N/A,,N/A,[],people,people
N/A,good,average,good,3,21947097,0,,awesome,5,MED101,"Never took one of his classes since I am not in science; so I cannot comment on his teaching. Heard about him through a third party. I was amazed that he actually took the time to speak with me. He`s helping me with every aspect of my med application and his help is invaluable! If you can, get to know him.",07/05/2013,3.0,3.0,,5,It's my life,5.0,5.0,1,No,1373033055000,N/A,1452,N/A,,N/A,[],people,people
N/A,good,average,good,0,21668306,0,,awesome,5,MICROBIO,"Easily, THE best professor that I have ever had. I'm proud to consider him a friend and a true teacher. He's a great man, I wish him the best. If you're in his class, make sure you go to his office for questions/clarifications",05/03/2013,2.0,2.0,,5,It's my life,5.0,5.0,1,Yes,1367593861000,N/A,1452,N/A,,N/A,[],people,people
N/A,good,average,good,1,21616962,0,,awesome,4,BIO3551,"John Basso is not just a prof, he's a life coach. Warning, his exams can be a bit challenging. Go see him, ask him questions, practice! Very nice, caring, doesn't forget his students and his door is open for any inquiry whether it is a question about this week's homework, a mock med school interview or a life issue.",04/27/2013,3.0,3.0,,5,Really into it,4.5,4.5,1,No,1367052389000,N/A,1452,N/A,,N/A,[],people,person
N/A,good,average,good,0,21301952,0,,awesome,5,BIO3126,Great professor. Great person. One of the best at the university. You can consult him about any of your life issues.,01/28/2013,3.0,3.0,,5,It's my life,5.0,5.0,1,No,1359384272000,N/A,1452,N/A,,N/A,[],people,people
N/A,good,average,good,0,20915912,0,,awesome,5,BIO3524,"Great prof, very enthusiastic and involved. Very few profs can keep my attention during the entire class period like he can. I'd highly recommend choosing him as a prof for any class that it's an option.",11/29/2012,3.0,3.0,,5,Sorta interested,5.0,5.0,1,No,1354219288000,N/A,1452,N/A,,N/A,[],people,people
N/A,good,average,good,0,20741465,0,,awesome,4,BIO3524,"Take his course or not, you have to get to know him. He will help you with anything and I mean anything. Just wish I had met him at the beginning of my university years. His courses are amongst the most useful and interesting, but not necessarily the easiest.",10/26/2012,3.0,3.0,,5,Sorta interested,4.5,4.5,1,No,1351244498000,N/A,1452,N/A,,N/A,[],people,people
N/A,average,good,average,1,20574678,0,,average,2,BIO3151,"he's pretty much insane. the class average at the final was 45%, his weekly quizzes make no sense, and the ta's have no idea what's going on. if you have to take this course, take it in french as it is his 1st language and he's much better at wording exam questions in french. in english, he will confuse you into a 45 class average. he's nice though",08/14/2012,5.0,5.0,,4,Low,3.0,3.0,1,No,1344972274000,N/A,1452,N/A,,N/A,[],people,person
N/A,good,average,good,0,19026561,0,,awesome,4,BIO3151,Best prof ever!,09/27/2011,3.0,3.0,,5,Really into it,4.5,4.5,1,Yes,1317134946000,N/A,1452,N/A,,N/A,[],people,people
N/A,good,average,good,0,18701498,0,,awesome,5,BIO3,Best prof ever! This is how university should be!!! If you are reading this DO NOT RETIRE keep teaching!!!,06/05/2011,3.0,3.0,,5,Sorta interested,5.0,5.0,1,No,1307307408000,N/A,1452,N/A,,N/A,[],people,people
N/A,good,good,good,0,18689130,0,,awesome,5,BIO3524,BY FAR the best prof i've ever had. Love him to death. As long as you put in the time and go see him you'll do good.,06/01/2011,4.0,4.0,,5,Low,5.0,5.0,1,No,1306960104000,N/A,1452,N/A,,N/A,[],people,people
N/A,good,good,good,0,18289528,0,,awesome,5,BIO3523,by FAR my favourite prof at U of O. If you put in the work and go see him you'll do good.,03/19/2011,5.0,5.0,,5,It's my life,5.0,5.0,1,No,1300547011000,N/A,1452,N/A,,N/A,[],people,people
N/A,average,poor,good,0,16701640,0,,good,3,BIO3524,"Not always perfectly organized or crystal clear. Before you understand how he work the course is extremely hard. After, EXTREMELY easy, but you have to put in a lot of time. In the end, if you go see him, and you work hard, you'll learn more than you ever did in other classes. His teaching methods seem not excellent, but actually are...",01/09/2010,1.0,1.0,,5,It's my life,4.0,4.0,1,No,1263061008000,N/A,1452,N/A,,N/A,[],people,people
N/A,good,poor,good,0,16202886,0,,awesome,5,BIO3523,Probably the best prof i have ever had. Deff been an extremely positive influence. Take any class you can with him.,09/23/2009,1.0,1.0,,5,It's my life,5.0,5.0,1,No,1253750183000,N/A,1452,N/A,,N/A,[],people,people
N/A,average,good,average,0,15717496,0,,average,2,BIO3151,Poor teaching method.,04/27/2009,5.0,5.0,,3,Really into it,2.5,2.5,1,No,1240861687000,N/A,1452,N/A,,N/A,[],people,people
N/A,poor,good,average,1,15524237,0,,average,1,BIO3107,"Always there if you need help. But not for the light of heart, can be rude.",03/11/2009,5.0,5.0,,4,Low,2.5,2.5,1,No,1236792131000,N/A,1452,N/A,,N/A,[],people,person
N/A,good,good,good,0,15312079,0,,awesome,4,BPS3501,John Basso is hands down one of the best teachers in the facultly of science at uOttawa,01/04/2009,4.0,4.0,,5,It's my life,4.5,4.5,1,No,1231040561000,N/A,1452,N/A,,N/A,[],people,people
N/A,good,average,good,0,14814150,0,,awesome,5,BIO3126,The best microbiology and molecular biology professor at Ottwa U.,09/13/2008,3.0,3.0,,5,It's my life,5.0,5.0,1,Yes,1221303231000,N/A,1452,N/A,,N/A,[],people,people
N/A,good,good,good,1,13416045,0,,awesome,4,MICRO1,He's pretty good he doesn't do any research so he puts alot into his classes. Very helpful if you go see him,08/17/2007,4.0,4.0,,5,Sorta interested,4.5,4.5,1,No,1187378574000,N/A,1452,N/A,,N/A,[],people,person
N/A,good,average,good,0,12790297,0,,awesome,5,BIO3126,Very devoted prof and WILL find a way to make you understand and takes the time and cares if you get the concept or not. Not an easy class but if you talk to him if you are struggling and put the same effort he puts into you... not hard to get a good mark.,01/18/2007,3.0,3.0,,5,It's my life,5.0,5.0,1,No,1169118902000,N/A,1452,N/A,,N/A,[],people,people
N/A,good,poor,good,0,12494268,0,,awesome,5,BPS3501,He's the best teacher I've ever had. Very helpful.,11/30/2006,1.0,1.0,,5,It's my life,5.0,5.0,1,No,1164871181000,N/A,1452,N/A,,N/A,[],people,people
N/A,good,average,good,0,11315947,0,,awesome,4,BIO35243526,"He's extremely devoted to his students, available to answer your questions. I have great respect for John and he's my favourite prof at Ottawa U so far :)",01/06/2006,3.0,3.0,,5,Really into it,4.5,4.5,1,N/A,1136569449000,N/A,1452,N/A,,N/A,[],people,people
N/A,good,average,good,0,11304695,0,,awesome,5,BIO3524,John's the best! And don't believe what you hear... there are no &quot;trick questions&quot;!,01/04/2006,3.0,3.0,,5,Really into it,5.0,5.0,1,N/A,1136415024000,N/A,1452,N/A,,N/A,[],people,people
N/A,good,average,good,0,11278738,0,,awesome,5,BIO3524,"Very helpfull/clear/devoted teacher.First science class in university that actually required me to THINK/REASON as opposed to regurgitate,(John's style of exam question)Not hard per say but there is a lot of matter to learn. Encourages class participation,extremely available out of class, can't wait to take other classes he teaches.",12/30/2005,3.0,3.0,,5,Low,5.0,5.0,1,N/A,1135938718000,N/A,1452,N/A,,N/A,[],people,people
N/A,good,good,good,0,11249867,0,,awesome,5,BPS3501,Great teacher but hard class. You have to be able to understand or else u won't do well,12/23/2005,5.0,5.0,,5,Sorta interested,5.0,5.0,1,N/A,1135347483000,N/A,1452,N/A,,N/A,[],people,people
N/A,good,average,good,0,11122668,0,,awesome,5,BPS3501,"He is amazing! He explains very well, and is EXTREMELY devoted to his students. He is also always up for a conversation on just about anything (outside of class), whether it's explaining genomics or debating the theory of evolution.",12/12/2005,3.0,3.0,,5,It's my life,5.0,5.0,1,N/A,1134347422000,N/A,1452,N/A,,N/A,[],people,people
N/A,good,poor,good,0,10879590,0,,awesome,5,BIO3150,The best professor on the face of the planet!,11/10/2005,1.0,1.0,,5,Sorta interested,5.0,5.0,1,N/A,1131659803000,N/A,1452,N/A,,N/A,[],people,people
N/A,good,average,good,0,10566220,0,,awesome,5,BIO3151,Greatest respect for Dr. Basso.  He's the best prof i've had at U of O.  Very helpful!,10/08/2005,3.0,3.0,,5,Really into it,5.0,5.0,1,N/A,1128780065000,N/A,1452,N/A,,N/A,[],people,people
N/A,good,poor,good,0,4005113,0,,awesome,5,ALLHISCLASSES,Greatest prof ever,06/16/2005,1.0,1.0,,5,It's my life,5.0,5.0,1,N/A,1118941399000,N/A,1452,N/A,,N/A,[],people,people
N/A,good,good,good,0,3513091,0,,awesome,5,BIO3126,All bark no bite,03/28/2005,4.0,4.0,,5,Meh,5.0,5.0,1,N/A,1112023184000,N/A,1452,N/A,,N/A,[],people,people
N/A,good,poor,good,0,3356816,1,,awesome,5,BIO3524,"John is a fantastic teacher.  Helpful in every possible way...no question is a dumb question to him, and takes his time to clearly explain what's going on.  Also gives you numerous hints about what's gonna be on the mid terms.",02/14/2005,1.0,1.0,,5,Sorta interested,5.0,5.0,1,N/A,1108420919000,N/A,1452,N/A,,N/A,[],person,people
N/A,good,average,good,0,2942165,0,,awesome,5,MICANDBIO,"John Rocks!! best prof. very approachable, very helpful, knows your name!! what more do you want",12/08/2004,2.0,2.0,,5,Really into it,5.0,5.0,1,N/A,1102464411000,N/A,1452,N/A,,N/A,[],people,people
N/A,good,average,good,0,2832275,0,,awesome,5,BIO3551,"Johnny rocks.  You could not get a better, more caring, more helpful teacher.  I've moved on, but I still make a point to go visit him. . . he's just that kind of guy.  Best prof I've ever had.",11/24/2004,3.0,3.0,,5,Really into it,5.0,5.0,1,N/A,1101320730000,N/A,1452,N/A,,N/A,[],people,people
N/A,good,good,good,0,2642492,0,,awesome,5,BIO3551,he's the best,11/03/2004,4.0,4.0,,5,It's my life,5.0,5.0,1,N/A,1099489409000,N/A,1452,N/A,,N/A,[],people,people
N/A,good,poor,good,0,786138,0,,awesome,5,BIO3524,One of the nicest teacher I've ever had,04/03/2003,1.0,1.0,,5,N/A,5.0,5.0,1,N/A,1049411459000,N/A,1452,N/A,,N/A,[],people,people
