attendance,clarityColor,easyColor,helpColor,helpCount,id,notHelpCount,onlineClass,quality,rClarity,rClass,rComments,rDate,rEasy,rEasyString,rErrorMsg,rHelpful,rInterest,rOverall,rOverallString,rStatus,rTextBookUse,rTimestamp,rWouldTakeAgain,sId,takenForCredit,teacher,teacherGrade,teacherRatingTags,unUsefulGrouping,usefulGrouping
Mandatory,good,average,good,1,31513684,0,,awesome,5,PHI1051,"Just the best. So interesting, clear and lively. Never had a teacher that good before.",04/02/2019,3.0,3.0,,5,N/A,5.0,5.0,1,Yes,1554174235000,Yes,1452,Yes,,N/A,"['Amazing lectures ', 'Inspirational', 'Gives good feedback']",people,person
Not Mandatory,good,average,good,1,31146747,0,,awesome,5,PHI1501,Just the best I ever had. Period.,12/23/2018,3.0,3.0,,5,N/A,5.0,5.0,1,Yes,1545608697000,Yes,1452,Yes,,B+,"['Amazing lectures ', 'Inspirational', 'Respected']",people,person
N/A,good,average,good,0,11039041,0,,awesome,5,PHI1501,"He is a very pasionate teacher, and knows his students. When we get bored, he signs a song, which in university feels good once in a while! Most of his assignments consist of exercises not so much defintions. PRACTICE!!!",12/02/2005,2.0,2.0,,5,Sorta interested,5.0,5.0,1,N/A,1133548289000,N/A,1452,N/A,,N/A,[],people,people
N/A,good,average,good,0,2806345,0,,good,4,ÉTHIQUE,excellent prof. qui aime vraiment ce qu'il fait.,11/21/2004,2.0,2.0,,4,Really into it,4.0,4.0,1,N/A,1101059712000,N/A,1452,N/A,,N/A,[],people,people
N/A,good,average,good,0,2389161,0,,awesome,5,PHI1501,Roch Bouchard brings passion and humbleness to a study that can sometimes pretentious and dry. He is still fundamentally curious about the &quot;questions première&quot; of the world.,08/14/2004,2.0,2.0,,4,N/A,4.5,4.5,1,N/A,1092450299000,N/A,1452,N/A,,N/A,[],people,people
N/A,good,average,good,0,718927,0,,awesome,5,PHI,He is awesome.,03/18/2003,2.0,2.0,,5,N/A,5.0,5.0,1,N/A,1047988755000,N/A,1452,N/A,,N/A,[],people,people
N/A,good,average,good,0,313622,0,,awesome,5,ELG4172,He is by far one of the best professors I've had during my 4 years at university,10/31/2002,3.0,3.0,,5,N/A,5.0,5.0,1,N/A,1036059501000,N/A,1452,N/A,,N/A,[],people,people
N/A,average,average,average,0,303297,0,,average,3,PHI1501,He was reading his notes and we had them also... so really boring!,10/24/2002,2.0,2.0,,3,N/A,3.0,3.0,1,N/A,1035457190000,N/A,1452,N/A,,N/A,[],people,people
N/A,good,average,good,0,91883,0,,awesome,5,HIS2574,Excellent...,02/04/2002,2.0,2.0,,5,N/A,5.0,5.0,1,N/A,1012864906000,N/A,1452,N/A,,N/A,[],people,people
