attendance,clarityColor,easyColor,helpColor,helpCount,id,notHelpCount,onlineClass,quality,rClarity,rClass,rComments,rDate,rEasy,rEasyString,rErrorMsg,rHelpful,rInterest,rOverall,rOverallString,rStatus,rTextBookUse,rTimestamp,rWouldTakeAgain,sId,takenForCredit,teacher,teacherGrade,teacherRatingTags,unUsefulGrouping,usefulGrouping
Not Mandatory,good,average,good,0,26919882,0,,awesome,5,ECO4116,Great prof!,08/22/2016,2.0,2.0,,5,N/A,5.0,5.0,1,Yes,1471868151000,Yes,1452,Yes,,A+,"['Gives good feedback', 'Accessible outside class', 'Clear grading criteria']",people,people
Mandatory,good,poor,good,0,26642857,0,,awesome,5,ECO6999,"Prof. Grenier is my supervisor of the major research paper. He is the most popular prof for choosing a MRP supervisor. Very good reputation. Patient, nice, brilliant.",05/24/2016,1.0,1.0,,5,N/A,5.0,5.0,1,No,1464082115000,N/A,1452,Yes,,Not sure yet,"['Inspirational', 'Gives good feedback']",people,people
Not Mandatory,average,average,average,0,25869633,0,,good,3,ECO2544,"Doesn't use any technology in class. Tests are easy (especially the final, which consists in your choice of 7 questions out of 10) but he often seemed lost when he was teaching. Follows religiously the textbook. Overall, good prof.",01/04/2016,2.0,2.0,,4,Sorta interested,3.5,3.5,1,Yes,1451901024000,N/A,1452,Yes,,A+,[],people,people
N/A,average,poor,good,0,19621882,0,,good,3,MICROA,"c'est un bon professeur , il communique assez bien la matière. c'est un professeur attentionné. j'aime bien ce professeur :)",12/26/2011,1.0,1.0,,5,Low,4.0,4.0,1,Yes,1324875680000,N/A,1452,N/A,,N/A,[],people,people
N/A,average,good,average,0,19038248,0,,average,2,ECO2544,"Notes are very unclear and not detailed. Doesn't speak loudly during class and mumbles a lot. Takes everything straight from the textbook, but doesn't do anything problem examples during class.",10/02/2011,4.0,4.0,,3,Really into it,2.5,2.5,1,Yes,1317576617000,N/A,1452,N/A,,N/A,[],people,people
N/A,good,average,good,0,16139843,0,,good,4,LABEC1111,Very smart professor and if you work hard he will not trick you on the midterm. But he always give you a B and hardly an A. I loved his classes but a bit boring i have to admit.,08/21/2009,2.0,2.0,,4,It's my life,4.0,4.0,1,Yes,1250853871000,N/A,1452,N/A,,N/A,[],people,people
N/A,good,average,average,0,11096087,0,,average,4,ECO2147,"He is really boring, so make sure that you sit at the front of the class.Easy assign.harder exams. he says he posts things on the internet, he does a poor job of it. for exams, make sure you look through old exams and find the multiple choice answers you dont know and study them with &quot;google defined answers.",12/08/2005,2.0,2.0,,2,Sorta interested,3.0,3.0,1,N/A,1134077302000,N/A,1452,N/A,,N/A,[],people,people
N/A,good,good,good,0,3406845,0,,good,4,ECO4116,"This prof doesn't seem comfortable teaching.  He always hesistates and stuff, but he does know his stuff bc does a lot of research in labour eco.",03/01/2005,4.0,4.0,,4,It's my life,4.0,4.0,1,N/A,1109692000000,N/A,1452,N/A,,N/A,[],people,people
N/A,good,average,good,0,3141583,1,,awesome,4,ECO4116,A great class with a great prof.,01/02/2005,2.0,2.0,,5,Really into it,4.5,4.5,1,N/A,1104681928000,N/A,1452,N/A,,N/A,[],person,people
