attendance,clarityColor,easyColor,helpColor,helpCount,id,notHelpCount,onlineClass,quality,rClarity,rClass,rComments,rDate,rEasy,rEasyString,rErrorMsg,rHelpful,rInterest,rOverall,rOverallString,rStatus,rTextBookUse,rTimestamp,rWouldTakeAgain,sId,takenForCredit,teacher,teacherGrade,teacherRatingTags,unUsefulGrouping,usefulGrouping
Mandatory,poor,average,poor,0,33766428,0,online,awful,1,LAWS3201,I have quite literally NEVER met a professor so absurd and so blatantly uncaring for his students or their welfare. Gilles refused to post slides or notes online in order for us to look over to study. He doesn't have slides to show DURING lectures either and chooses to drone on and on about tangents that are wildly irrelevant to the course.,11/03/2020,3.0,3.0,,1,N/A,1.0,1.0,1,No,1604445590000,No,1452,Yes,,N/A,[],people,people
N/A,good,poor,good,1,18003647,0,,awesome,5,ADM3360,I love this prof he doesn't mark anything and its russian roulette for what you'll get. He never gives clear guidelines for anything at all so you'll never know what you're going to get. If you're going to class make sure to pay attention because he will call on you. He also hates the university and will always come late.,12/20/2010,1.0,1.0,,4,It's my life,4.5,4.5,1,No,1292840703000,N/A,1452,N/A,,N/A,[],people,person
N/A,average,average,average,1,13426842,0,,poor,2,CMN2148,"Levasseur is a genious. Bottom line end of story. He told us that we didn't need to buy are textbooks, all we had to do was take notes. If you have him for orgnizational communication, write down his stories/examples, pay attentions to what he says, and participate in his improvised debates, he'll remember you come marking season.",08/22/2007,3.0,3.0,,2,Low,2.0,2.0,1,No,1187779849000,N/A,1452,N/A,,N/A,[],people,person
N/A,poor,average,poor,0,12851492,0,,awful,1,ECO1302,I've never even heard of a professor this bad.  I mean it.,02/07/2007,3.0,3.0,,1,Meh,1.0,1.0,1,No,1170891295000,N/A,1452,N/A,,N/A,[],people,people
N/A,good,poor,good,0,12705097,0,,awesome,5,ADM3360,AMAZING TEACHER FOR BUSINESS LAW!,01/01/2007,1.0,1.0,,5,It's my life,5.0,5.0,1,Yes,1167676900000,N/A,1452,N/A,,N/A,[],people,people
N/A,average,poor,average,0,10423749,0,,average,2,CMN,This guy is hilarious! Sure he was a bit hard to follow but it was worth coming to class just to hear his stories!!!!,09/17/2005,1.0,1.0,,3,Really into it,2.5,2.5,1,N/A,1126959974000,N/A,1452,N/A,,N/A,[],people,people
N/A,poor,good,poor,0,2982018,0,,awful,1,CMN,You will not believe he is actually a prof.,12/10/2004,4.0,4.0,,1,Meh,1.0,1.0,1,N/A,1102721933000,N/A,1452,N/A,,N/A,[],people,people
