attendance,clarityColor,easyColor,helpColor,helpCount,id,notHelpCount,onlineClass,quality,rClarity,rClass,rComments,rDate,rEasy,rEasyString,rErrorMsg,rHelpful,rInterest,rOverall,rOverallString,rStatus,rTextBookUse,rTimestamp,rWouldTakeAgain,sId,takenForCredit,teacher,teacherGrade,teacherRatingTags,unUsefulGrouping,usefulGrouping
N/A,average,good,poor,0,24320167,0,,poor,2,ENG1101,"Had this prof a few years ago. Was quite tedious to deal with. Could be very fun at times, but his poor interpersonal skills and way of doing things took away from things and left a bad taste in my mouth. Worth tolerating if you have no other options available, but I would recommend someone else. I enjoyed his work on the emotion series, though.",01/22/2015,4.0,4.0,,1,Sorta interested,1.5,1.5,1,Yes,1421927622000,N/A,1452,Yes,,N/A,[],people,people
N/A,good,average,good,0,21501597,0,,good,4,ENG1121,Energetic and eager to help out. Will call you out if you don't do teh readings.,04/08/2013,3.0,3.0,,4,Low,4.0,4.0,1,Yes,1365434777000,N/A,1452,N/A,,N/A,[],people,people
N/A,average,average,average,0,21245778,0,,poor,2,ENG1101,"follows the stereotypical drama/poetry person. the blue hair, swearing, and  putting people down is a little unprofessional and is frankly quite annoying.",01/11/2013,3.0,3.0,,2,Meh,2.0,2.0,1,Yes,1357900962000,N/A,1452,N/A,,N/A,[],people,people
N/A,average,average,average,0,21161607,0,,poor,3,ENG1100,Had him as a TA and was not too fond of him. Didn't help at all in person but would rather communicate through email - not helpful. Seemed arrogant when asked for help in person. Communicating with him seemed extremely stressful and impossible at times...,12/24/2012,3.0,3.0,,1,Low,2.0,2.0,1,No,1356317140000,N/A,1452,N/A,,N/A,[],people,people
N/A,average,average,average,0,18444302,0,,good,3,ENG1100,"He is a good professor and is very clear with what he wants and expects.  He is very clear in his teaching about what is good and what isn't and provides good feedback on assignments, he really tries not to be too negative.  He does mean well.  However, he could be a little more organized and needs to not swear in class.",04/20/2011,3.0,3.0,,4,Low,3.5,3.5,1,Yes,1303340806000,N/A,1452,N/A,,N/A,[],people,people
N/A,good,average,good,0,17469695,0,,awesome,5,ENG101,"Awesome Prof. He's funny, plus, he's a dj! Make sure to do your readings or you will struggle. He's extremely clear on what he expects from his students and helps out a lot. Always available during office hours and he lets you know exactly what is going to be on the exams.",08/01/2010,2.0,2.0,,5,Sorta interested,5.0,5.0,1,Yes,1280677156000,N/A,1452,N/A,,N/A,[],people,people
N/A,average,average,average,0,16898403,0,,average,2,ENG1101,"Interesting character. Heavy on class discussion, so do your readings or he WILL call you out and make you look unprepared. Isn't afraid to shoot down you're opinion. Often unclear on what he's asking of you. Not the greatest.",03/23/2010,2.0,2.0,,3,Low,2.5,2.5,1,Yes,1269303533000,N/A,1452,N/A,,N/A,[],people,people
