attendance,clarityColor,easyColor,helpColor,helpCount,id,notHelpCount,onlineClass,quality,rClarity,rClass,rComments,rDate,rEasy,rEasyString,rErrorMsg,rHelpful,rInterest,rOverall,rOverallString,rStatus,rTextBookUse,rTimestamp,rWouldTakeAgain,sId,takenForCredit,teacher,teacherGrade,teacherRatingTags,unUsefulGrouping,usefulGrouping
Not Mandatory,good,good,good,0,27230293,0,,awesome,5,HSS4324,"Awesome professor! I loved physiology story time. Always willing to stay after class to answer questions. Clearly loves physiology and teaches it exceptionally well! Lots of great practical examples in class.  Explains difficult concepts well, but makes it fun!!  Wish she taught more classes.",11/20/2016,4.0,4.0,,5,N/A,5.0,5.0,1,Yes,1479676537000,Yes,1452,N/A,,N/A,[],people,people
Not Mandatory,good,good,good,0,26679614,0,,good,4,HSS4324,"Dr. Reed is very nice and really cares about her student. However her exams were  hard and she gave a lot of readings (articles) that we had to memorize by heart, which in my opinion is completely useless. If you do not like reading, do not take this class.  Do not recommend taking special topics with her as an elective to boost your GPA.",06/01/2016,4.0,4.0,,4,N/A,4.0,4.0,1,Yes,1464790849000,No,1452,Yes,,N/A,"['Accessible outside class', 'Inspirational', 'Tough grader']",people,people
Not Mandatory,good,good,good,0,23300061,0,,awesome,5,HSS3305,"If you want a professor who cares A LOT about her students and goes the extra mile to make sure you learn A LOT and prepares you for future courses in the health field - take a course with Dr. Reed!! She is amazing, but tough! I really enjoyed her course, super interesting and practical.  Great professor, physiology wizz.",05/22/2014,4.0,4.0,,5,Sorta interested,5.0,5.0,1,Yes,1400780292000,N/A,1452,N/A,,B,[],people,people
N/A,good,average,good,0,21475101,0,,awesome,5,APA2121,"I took this course last year and did fine.  I don't know what the other posters are complaining about - they must not have gone to lectures.  If you go to class and pay attention, you'll do fine.  Very fair prof, always willing to help if you go to office hours or send emails with questions.",04/02/2013,2.0,2.0,,5,Really into it,5.0,5.0,1,Yes,1364907814000,N/A,1452,N/A,,N/A,[],people,people
N/A,good,average,good,0,21401111,0,,awesome,5,APA2121,Excellent prof!  Very helpful and always willing to spend extra time after class.  Extremely passionate and knowledgeable about the subject.  I will definitely take other classes taught by Dr. Reed.,03/11/2013,2.0,2.0,,5,It's my life,5.0,5.0,1,Yes,1362996622000,N/A,1452,N/A,,N/A,[],people,people
N/A,good,average,good,0,21353000,0,,awesome,4,HSS3305,Great prof. Very knowledgeable and helpful!,02/19/2013,3.0,3.0,,5,Really into it,4.5,4.5,1,Yes,1361313157000,N/A,1452,N/A,,N/A,[],people,people
N/A,poor,good,poor,0,21124114,0,,awful,1,APA2121,"The exam was ridiculous... cumulative over 1000 slides, with no idea of anything not to study. She seems to purposely make the class extremely challenging. I have never heard anyone take this class that has had this much work for a nutrition class. DO NOT TAKE",12/19/2012,5.0,5.0,,1,Sorta interested,1.0,1.0,1,Yes,1355918644000,N/A,1452,N/A,,N/A,[],people,people
N/A,good,good,average,0,20996526,0,,average,4,APA2121,"Nice person, but a ridiculous amount of information/numbers needed to be memorized for midterms and the final. 1000 slides on the final, are you kidding me?",12/09/2012,4.0,4.0,,2,Sorta interested,3.0,3.0,1,Yes,1355053899000,N/A,1452,N/A,,N/A,[],people,people
N/A,average,good,average,0,20950418,0,,average,3,APA2121,"Makes the course a lot harder then it should be. I would not recommend her. If you have an option for another prof in this course, take it.",12/04/2012,5.0,5.0,,2,Sorta interested,2.5,2.5,1,No,1354647237000,N/A,1452,N/A,,N/A,[],people,people
