attendance,clarityColor,easyColor,helpColor,helpCount,id,notHelpCount,onlineClass,quality,rClarity,rClass,rComments,rDate,rEasy,rEasyString,rErrorMsg,rHelpful,rInterest,rOverall,rOverallString,rStatus,rTextBookUse,rTimestamp,rWouldTakeAgain,sId,takenForCredit,teacher,teacherGrade,teacherRatingTags,unUsefulGrouping,usefulGrouping
Mandatory,good,poor,good,0,36673721,0,,awesome,5,ELG3736,Zer,10/03/2022,1.0,1.0,,5,N/A,5.0,5.0,0,Yes,1664814499000,Yes,0,No,,Not sure yet,"['Get ready to read', 'Group projects']",people,people
Mandatory,good,average,good,0,36018008,0,,good,4,ELG3736,He facilitates the understanding of this course for mechanical engineering students,04/04/2022,3.0,3.0,,4,N/A,4.0,4.0,1,Yes,1649099802000,Yes,0,Yes,,A-,"['Gives good feedback', 'Participation matters', 'Respected']",people,people
Not Mandatory,average,average,average,0,35765770,0,online,poor,2,ELG3736,"Prof. Bougataya was an ok prof. Even though, lectures were quite boring and monotone(he just reads powerpoint slides), he responds to emails very late, the course get quite hard from time to time and the course load is much more than the average, the exams were pretty straightforward and he was very understanding about the deadlines.",01/18/2022,3.0,3.0,,2,N/A,2.0,2.0,1,No,1642516935000,No,1452,Yes,,B,"['Group projects', 'Clear grading criteria', 'So many papers']",people,people
Mandatory,poor,average,poor,0,35620226,0,online,awful,1,ELG3736,"Worst prof ever, he just reads the ppt slides without any explanation. The lectures are boring. You have to study by yourself if want to get good marks.",12/21/2021,3.0,3.0,,1,N/A,1.0,1.0,1,No,1640106758000,No,1452,Yes,,N/A,[],people,people
Mandatory,poor,average,poor,0,35080010,0,online,awful,1,ELG3736,Le prof ne fait que lire les diapos ppt sans rien &eacute;laborer. Le pire c'est qu'il s'absente. C'est nul !!,09/20/2021,3.0,3.0,,1,N/A,1.0,1.0,1,Yes,1632153721000,No,1452,Yes,,N/A,[],people,people
Mandatory,poor,average,poor,0,35080004,0,online,awful,1,ELG3736,"This professor is the worst professor I have ever seen!! How can a prof not attend the lectures and let the students on wait! This is so incredible. More than that, he just goes over the ppt lectures with no explanations.",09/20/2021,3.0,3.0,,1,N/A,1.0,1.0,1,Yes,1632153524000,No,1452,Yes,,N/A,[],people,people
Mandatory,poor,good,poor,2,34262117,0,online,awful,1,CEG2536,"Retook this class to boost my mark, but he was still as bad as the first time around. I believe that some of the reviews are faked since they are so similar. He is simply lazy as a teacher, although he's at least a nice enough guy. You've gotta be ready to teach yourself off YouTube, though.",01/11/2021,5.0,5.0,,1,N/A,1.0,1.0,1,No,1610371854000,No,1452,Yes,,A-,"['Tough grader', 'Test heavy']",people,people
Mandatory,good,good,good,0,33953360,3,,awesome,5,CSI2911,I enjoyed this course with a good balance between theory and pratique . I highly recommend this professor.,12/04/2020,5.0,5.0,,5,N/A,5.0,5.0,3,Yes,1607118234000,Yes,1452,Yes,,B,"['Amazing lectures ', 'Caring', 'Gives good feedback']",people,people
Mandatory,good,good,good,0,33896435,3,,awesome,5,CEG2136,Amazing :),11/27/2020,5.0,5.0,,5,N/A,5.0,5.0,3,Yes,1606512089000,Yes,1452,Yes,,A,[],people,people
Mandatory,good,good,good,0,33896425,3,,awesome,5,CEG2136,Good feedback :),11/27/2020,5.0,5.0,,5,N/A,5.0,5.0,3,Yes,1606511943000,Yes,1452,Yes,,B-,['Inspirational'],people,people
Mandatory,good,good,good,0,33896415,3,,awesome,5,CEG2136,Is the best,11/27/2020,5.0,5.0,,5,N/A,5.0,5.0,3,Yes,1606511818000,Yes,1452,Yes,,A+,"['Inspirational', 'Participation matters']",people,people
Mandatory,good,good,good,0,33859376,3,,awesome,5,CEG2136,"Best prof I've ever had, take him over any other prof at uOttawa. Very motivating and cares for students.",11/20/2020,5.0,5.0,,5,N/A,5.0,5.0,1,Yes,1605902555000,Yes,1452,Yes,,A-,"['Gives good feedback', 'Participation matters']",people,people
Mandatory,poor,average,poor,3,33840217,0,,awful,1,CEG2136,I do not know who gave him 5/5 as a rating but it is clearly a lie. DO NOT TAKE THIS PROFESSOR. He doesn't know what he's teaching. Only reads the PowerPoint and always cancels classes. His exam questions are unclear and contradictory.,11/18/2020,3.0,3.0,,1,N/A,1.0,1.0,1,No,1605715381000,No,1452,Yes,,N/A,[],people,people
Mandatory,good,good,good,0,33813844,3,,awesome,5,CEG2536,Tthe teacher is friendly and takes his time to fully explain the subject. But requires a lot of reading,11/13/2020,5.0,5.0,,5,N/A,5.0,5.0,1,Yes,1605295193000,Yes,1452,Yes,,A-,"['Participation matters', 'Gives good feedback']",people,people
Mandatory,good,good,good,0,33780135,3,,awesome,5,CEG2536,tres bon professeur,11/06/2020,5.0,5.0,,5,N/A,5.0,5.0,1,Yes,1604700889000,Yes,1452,Yes,,N/A,"['Inspirational', 'Lecture heavy', 'Gives good feedback']",people,people
Mandatory,good,good,good,0,33729231,3,,awesome,5,CEG2536,Excellent professeur,10/23/2020,5.0,5.0,,5,N/A,5.0,5.0,1,Yes,1603487975000,Yes,1452,Yes,,B-,"['Inspirational', 'Gives good feedback']",people,people
Mandatory,good,good,good,0,33707884,3,,awesome,5,CEG2536,tr&egrave;s bon prof,10/16/2020,4.0,4.0,,5,N/A,5.0,5.0,1,Yes,1602882885000,Yes,1452,Yes,,N/A,"['Inspirational', 'Gives good feedback']",people,people
Mandatory,good,good,good,0,33696537,3,,good,4,CEG2536,Explains well the hardware operation,10/13/2020,4.0,4.0,,4,N/A,4.0,4.0,1,Yes,1602568123000,Yes,1452,Yes,,A-,"['Amazing lectures ', 'Respected', 'Participation matters']",people,people
Mandatory,good,good,good,0,33693258,3,,awesome,5,CEG2536,Excellent Prof,10/12/2020,5.0,5.0,,5,N/A,5.0,5.0,1,Yes,1602466234000,Yes,1452,Yes,,B+,"['Gives good feedback', 'Respected', 'Participation matters']",people,people
Not Mandatory,average,poor,average,0,33014766,0,,average,3,CSI2911,"Very easy class with him. Gave out basically free marks on the homework, and the midterm was very simple and logical. If you have common sense about what is right and wrong, you should be able to do well in this class.",04/02/2020,1.0,1.0,,3,N/A,3.0,3.0,1,No,1585858761000,No,1452,Yes,,Not sure yet,"['Group projects', 'Lots of homework', 'Caring']",people,people
Not Mandatory,poor,good,poor,3,32558638,0,,awful,1,CEG2536,"Il a annul&eacute; 3 classes sur la session, nous avons du rattraper la mati&egrave;re nous meme. Ses labs ne refl&egrave;te pas du tout la mati&egrave;re vue en classe. Ses devoirs sont des copier-coller des dgd, du coup 100% d'office mais on a aucune id&eacute;e de notre niveau r&eacute;el. L'examen final est le meme que celui de la section anglaise, malgr&eacute; toute la mati&egrave;re non-vue...",12/07/2019,4.0,4.0,,1,N/A,1.0,1.0,1,No,1575732005000,No,1452,Yes,,INC,"['Get ready to read', 'So many papers']",people,people
Not Mandatory,poor,good,poor,3,32545959,0,,awful,1,CEG2536,"I cannot tell if it is because he is not motivated, but he cancels a lot of classes. Out of 3 hours of lecture, he gives max an hour. During that hour he only reads what's on the powerpoint, and even there he isn't good at it. He does not prepare you well for exams. His labs are also very very unclear. Please don't take his class....",12/06/2019,4.0,4.0,,1,N/A,1.0,1.0,1,No,1575605250000,No,1452,No,,Not sure yet,[],people,people
Not Mandatory,poor,good,poor,3,32526434,0,,awful,1,CEG2536,"The structure for this course was very unclear throughout the semester, we were never sure what to expect and when. Labs were only available in English despite being a French course. You have to review the material a lot outside of class to fully understand it, as well as attend the tutorials.",12/04/2019,4.0,4.0,,1,N/A,1.0,1.0,1,No,1575494283000,No,1452,Yes,,B+,[],people,people
Not Mandatory,poor,good,poor,3,32489525,0,,awful,1,CEG2536,"Ok, so I had this prof for Introduction to Computer Architecture. There is no nice way to describe all of this: cancels a lot of lectures, posts assignments and labs way too late, there is no structure to his class... He just reads powerpoints while facing the board the entire lecture. And he grades the class on material not presented. Avoid him.",11/28/2019,4.0,4.0,,1,N/A,1.0,1.0,1,No,1574966135000,No,1452,Yes,,N/A,"['Lecture heavy', 'Graded by few things', 'Get ready to read']",people,people
