attendance,clarityColor,easyColor,helpColor,helpCount,id,notHelpCount,onlineClass,quality,rClarity,rClass,rComments,rDate,rEasy,rEasyString,rErrorMsg,rHelpful,rInterest,rOverall,rOverallString,rStatus,rTextBookUse,rTimestamp,rWouldTakeAgain,sId,takenForCredit,teacher,teacherGrade,teacherRatingTags,unUsefulGrouping,usefulGrouping
Not Mandatory,good,average,good,0,34817127,0,online,awesome,5,LIN3328,"Myriam is the nicest prof, she always makes class fun and lighthearted. Workload is very reasonable, 4 homeworks (only best 3 count) and a final. The homework is very straightforward. She is always understanding and accomodates for the stress of online school. No textbook, just optional readings. :)",05/18/2021,2.0,2.0,,5,N/A,5.0,5.0,1,No,1621355818000,Yes,1452,Yes,,A+,"['Amazing lectures ', 'Hilarious', 'Caring']",people,people
Not Mandatory,good,average,good,0,34817094,0,,awesome,5,LIN3315,"Myriam is the sweetest teacher out there She cares so much about her students and the content. Class is always fun and she really makes an effort to be reasonable and understanding in her grading. She is always available when you need extra help and makes semantics very fun. Very manageable workload, 3 homework exercises, midterm, and a final. :)",05/18/2021,2.0,2.0,,5,N/A,5.0,5.0,1,No,1621355594000,Yes,1452,Yes,,A+,"['Clear grading criteria', 'Caring', 'Amazing lectures ']",people,people
Not Mandatory,good,average,good,0,34697414,0,online,good,4,3315A,"She is a sweetheart. Her assessments are not hard at all. The course was simple not too much workload. If you have any issue she will take care of it. There was 1 midterm, 1 exam, and 3 hwrks. She is also fun to be watching in an online lecture!",05/04/2021,2.0,2.0,,4,N/A,4.0,4.0,1,No,1620131901000,Yes,1452,Yes,,Not sure yet,"['Caring', 'Graded by few things', 'Gives good feedback']",people,people
N/A,good,average,good,0,34593471,0,,awesome,5,LIN3328,"10/10 would recommend a class with her! She is so kind and great at explaining the material. No textbook or lecture slides, but her handouts for each class were concise and had everything we needed. Lectures were very interesting &amp; fun. Exam/Assignments were fair and reflected exactly what we had learned. LOVED this prof!!!",04/21/2021,3.0,3.0,,5,N/A,5.0,5.0,1,No,1619034528000,Yes,1452,Yes,,A+,"['Amazing lectures ', 'Clear grading criteria', 'Caring']",people,people
N/A,good,average,good,0,34467334,0,,awesome,5,LIN3315,"I cannot say enough good things about Professor Dali. Really caring and kind; she explains complicated topics gradually so you can follow along. The class isn't easy, but Myriam makes it enjoyable and pleasant, and is a fair grader. Very accessable outside the class for office hours. Would definitely reccommend.",03/24/2021,3.0,3.0,,5,N/A,5.0,5.0,1,No,1616551089000,Yes,1452,Yes,,N/A,"['Respected', 'Amazing lectures ', 'Caring']",people,people
Mandatory,good,average,good,0,33776589,0,online,awesome,5,LIN2700,Just overall a nice prof. Was available on zoom during our exam to answer questions. Spent the first half of the semester reviewing first year linguistics concepts as they applied to the class. Each lecture had a clear learning goal and she ensured that the topic was covered sufficiently within the time. Always open to answer questions in class.,11/06/2020,3.0,3.0,,5,N/A,5.0,5.0,1,No,1604624310000,Yes,1452,Yes,,Not sure yet,"['Clear grading criteria', 'Graded by few things', 'Caring']",people,people
Mandatory,good,average,good,0,30265851,0,,good,4,LIN1710,"Myriam cared about all of the students and knew a lot of us by name. She is kind and always makes sure that we did our work and understood what we were doing. The TAs were kind of useless. Most of us finished the exam within the first 45 minutes. Funny, always made jokes and kept us awake and interested early in the morning",06/14/2018,3.0,3.0,,4,N/A,4.0,4.0,1,No,1529003941000,Yes,1452,Yes,,A-,"['Respected', 'Gives good feedback', 'Caring']",people,people
Mandatory,good,average,good,2,29610995,0,,good,4,LIN1710,"she was super nice and truly caring for her students, I wish she was now my syntax teacher.",03/01/2018,3.0,3.0,,4,N/A,4.0,4.0,1,No,1519918276000,Yes,1452,Yes,,N/A,"['Caring', 'Accessible outside class', 'Clear grading criteria']",people,people
