attendance,clarityColor,easyColor,helpColor,helpCount,id,notHelpCount,onlineClass,quality,rClarity,rClass,rComments,rDate,rEasy,rEasyString,rErrorMsg,rHelpful,rInterest,rOverall,rOverallString,rStatus,rTextBookUse,rTimestamp,rWouldTakeAgain,sId,takenForCredit,teacher,teacherGrade,teacherRatingTags,unUsefulGrouping,usefulGrouping
Not Mandatory,average,average,average,0,34976127,0,online,poor,2,CML2343,"On the plus side, Prof Hecht seems to like teaching a lot, and frequently offers to teach students non-examinable material outside of class, if they're interested. On the other hand, he puts very little effort into actually teaching. His lectures are convoluted, and he puts the bare minimum effort into structuring the class and writing his exams.",07/19/2021,3.0,3.0,,2,N/A,2.0,2.0,1,Yes,1626717246000,No,1452,Yes,,N/A,[],people,people
Mandatory,good,average,good,0,30276954,0,,good,4,CML1111,"Great professor. Had Tort Law in 1L with him. I would recommend him to any incoming 1L students. Exams are very fair, although he did not do a great job in explaining his assignments which caused some confusion. Overall, great prof.",06/19/2018,3.0,3.0,,4,N/A,4.0,4.0,1,Yes,1529405977000,Yes,1452,Yes,,N/A,['Accessible outside class'],people,people
N/A,good,average,good,0,30111701,0,,awesome,5,CML12072,Professor Hecht was my favourite prof in first year. Definitely a prof who cares a lot about his students and wants to see you succeed. Interesting coverage of the material while keeping students involved. Exams and assignments are very fair. Would 10/10 recommend taking a course from him.,05/15/2018,3.0,3.0,,5,N/A,5.0,5.0,1,Yes,1526387299000,Yes,1452,Yes,,B,"['Accessible outside class', 'Gives good feedback']",people,people
Mandatory,good,average,good,0,29491325,0,,good,4,CML2311,"Nice person, tries to cover material in interesting manner and fair exam.",01/23/2018,2.0,2.0,,4,N/A,4.0,4.0,1,No,1516684126000,Yes,1452,Yes,,N/A,[],people,people
N/A,average,good,average,0,12942537,0,,good,3,CMLDELI,"Outstanding guy.  Good prof.  Tough to follow in French - his French is not up to par to teaching a course in French.  But, he gave us every opportunity to improve, ask questions, do papers - and his review was top notch!",03/25/2007,4.0,4.0,,4,It's my life,3.5,3.5,1,Yes,1174857379000,N/A,1452,N/A,,N/A,[],people,people
N/A,poor,average,poor,0,12937374,0,,poor,1,CML4542,Very tough to follow Torts in French.  But he was super kind in going over and over again our queries and his course review was EXCELLENT!,03/22/2007,3.0,3.0,,2,Really into it,1.5,1.5,1,No,1174553456000,N/A,1452,N/A,,N/A,[],people,people
