attendance,clarityColor,easyColor,helpColor,helpCount,id,notHelpCount,onlineClass,quality,rClarity,rClass,rComments,rDate,rEasy,rEasyString,rErrorMsg,rHelpful,rInterest,rOverall,rOverallString,rStatus,rTextBookUse,rTimestamp,rWouldTakeAgain,sId,takenForCredit,teacher,teacherGrade,teacherRatingTags,unUsefulGrouping,usefulGrouping
Mandatory,poor,good,poor,0,35900443,0,online,awful,1,DVM3540,Worst prof I’ve taken in my 4 years of studying. He is extremely lazy and never answers emails. His lectures are extremely boring.Drop this course if you can I do not recommend this « professor » he shouldn’t be teaching. Plus he removed the option to grade the course because he knows how terrible he is. ,03/03/2022,4.0,4.0,,1,N/A,1.0,1.0,1,N/A,1646323484000,N/A,0,Yes,,N/A,[],people,people
Mandatory,poor,average,poor,0,35461203,0,online,awful,1,ECO2517,"Avoid if you have the choice. Very insolent, gives no feedback. Incoherent dans ses formulations. If you ask him to clarify something, he will write you a whole essay telling you why you're asking the question instead of just answering it. Final exam is usually 3h but we had 30m. doesn't care about your success and boring voice. I am warning y'all",12/10/2021,3.0,3.0,,1,N/A,1.0,1.0,1,No,1639167422000,No,1452,Yes,,B-,['Tough grader'],people,people
Mandatory,poor,average,poor,1,35461124,0,online,awful,1,ECO2517,"I had to give 2 feedbacks cuz I had other things to say. When we had to evaluate our teachers, his survey wasn't there because he knows all things we were going to say. we had to contact the faculty. Acts nice on zoom because they're recorded but as soon as we had questions at the end of the lecture, he would stop recording and put down his mask.",12/10/2021,3.0,3.0,,1,N/A,1.0,1.0,1,No,1639167192000,No,1452,Yes,,B-,['Tough grader'],people,person
Mandatory,poor,good,poor,1,35460839,0,online,awful,1,ECO2517,"The worst experience I have ever had. The worst teacher known to man. If it is not mandatory DONT TAKE THE CLASS. He is so rude whenever you send emails asking questions, he refuses to share the powerpoints of bright space, he barely gives anytime to complete exams literally 30 mins !!!! When we ask for help he says that were the problem.",12/10/2021,5.0,5.0,,1,N/A,1.0,1.0,1,No,1639166294000,No,1452,Yes,,B-,[],people,person
Mandatory,average,good,average,0,34756118,0,,poor,2,DVM3540,"This is my first time ever rating a prof. Avoid this man if you can. The way that he phrases things in the test makes no sense and is not compatible with what was learned in class. He does explain properly what he wants from you and is such a tough grader. Also, he gives no feedback for the midterms. I have never done this badly in a class...",05/10/2021,5.0,5.0,,2,N/A,2.0,2.0,1,No,1620678283000,No,1452,No,,D+,"['Accessible outside class', 'Tough grader', 'Test heavy']",people,people
Mandatory,average,average,average,1,31523485,0,,poor,2,ECO2517,"Contextual with his explanations, which helps concretize the material in a real-life context. But a terrible people person and not very accommodating with his students. Very difficult to reach as he does not answer any of his e-mails and avoids answering questions during class breaks or office hours.",04/03/2019,3.0,3.0,,2,N/A,2.0,2.0,1,No,1554309860000,No,1452,Yes,,N/A,[],people,person
Not Mandatory,poor,average,poor,7,31454713,0,,awful,1,ECO2517,"Terrible teacher, he takes everything personal. Talks to you like youre fresh out the womb, respects you less than a dog and grades your work with his eyes closed. Avoid him at all cost. Even if you have to change you undergrad.",03/20/2019,3.0,3.0,,1,N/A,1.0,1.0,1,Yes,1553042573000,No,1452,Yes,,INC,[],people,people
Not Mandatory,poor,average,poor,3,31454528,0,,awful,1,ECO2517,"Notes de cours inaccessibles en ligne, environnement d'apprentissage difficile, &eacute;valuations vagues et organisation mal effectu&eacute;e.",03/20/2019,3.0,3.0,,1,N/A,1.0,1.0,1,Yes,1553040102000,No,1452,Yes,,N/A,[],people,people
Not Mandatory,good,average,good,0,31429406,7,,awesome,5,ECO2517,Very Good,03/12/2019,3.0,3.0,,5,N/A,5.0,5.0,1,Yes,1552423969000,Yes,1452,Yes,,N/A,['Hilarious'],people,people
Not Mandatory,average,average,average,5,27448025,0,,poor,2,ECO2517,"Il connaît bien ce qu'il enseigne. Il est drôle mais super arrogant et n'accepte pas de critiques. Il peut te mettre dans un état d'embarras si tu dis quelque chose qu'il n'aime pas. Ces cours sont ok, mais beaucoup de matériels. Évitez si vous pouvez.",12/12/2016,2.0,2.0,,2,N/A,2.0,2.0,1,Yes,1481555431000,No,1452,Yes,,N/A,[],people,people
Not Mandatory,average,average,average,2,27388534,0,,poor,2,ECO2517,"tu peux avoir une bonne note dans son cours. Mais, se présenter en classe est une perte de temps. On apprend rien en classe! Il vaut mieux faire ses lectures et lire ses notes chez soi. Si vous avez le choix, je vous conseille de prendre un autre professeur.",12/08/2016,2.0,2.0,,2,N/A,2.0,2.0,1,Yes,1481201244000,No,1452,Yes,,A,[],people,people
Not Mandatory,good,average,good,0,27381561,1,,awesome,5,ECO2517,Funny prof! Definitely knows his stuff and made going to class enjoyable. 100% would take his class again!!,12/07/2016,3.0,3.0,,5,N/A,5.0,5.0,1,No,1481154253000,Yes,1452,Yes,,A,"['Participation matters', 'Hilarious', 'Graded by few things']",person,people
Mandatory,average,average,average,0,26650455,0,,good,3,DVM3540,"Hes a nice teacher, I had him in another class which students had poblems with his attitude but he somehow changed and I started to like him more! Gives us example of questions for exam but mostly uses them on exam which is helpful due to the ambiguous teaching.  Took 2 classes with him and would still take more!",05/25/2016,2.0,2.0,,4,N/A,3.5,3.5,1,No,1464184369000,Yes,1452,Yes,,A+,"['Hilarious', 'Gives good feedback']",people,people
Not Mandatory,average,average,average,3,25763673,0,,poor,2,ECO2517,"Je ne recommande pas ce prof. Il est drôle et gentil en tant que personne mais ce n'est pas le meilleur en tant que prof. Ses explications ne sont vraiment pas claires, ses exemples non plus! ses critères sont flous et il corrige de façon assez incohérente. Il a retiré les notes de cours de bbl avant l'exam et il n'est pas d'une grande aide!",12/18/2015,3.0,3.0,,2,Sorta interested,2.0,2.0,1,No,1450458157000,N/A,1452,Yes,,N/A,[],people,people
Mandatory,poor,good,poor,1,25548782,0,,poor,1,DVM3560,"Ce prof méprise ces étudiants au plus haut point, il manque de professionnalisme et d'éthique. Comes across as very arrogant, cannot accept constructive criticism only gives out negetive and MEAN feedback.   If you can change prof, DO IT.  Si vous pouvez évitez ce prof, FAITES LE.",12/04/2015,5.0,5.0,,2,Really into it,1.5,1.5,1,No,1449235598000,N/A,1452,Yes,,N/A,"['Lecture heavy', 'Group projects', 'So many papers']",people,person
N/A,average,average,average,0,21056538,2,,average,3,ECO2517,"Il connait sa matière mais n'explique pas d'avantage pour pouvoir comprendre la leçon sans revoir ces notes et powerpoints. Utilise des exemples qui son utile et explique biens les examens de classe. Si tu es bon en économie et c'est une matière qui t'intéresse, tu aimeras ce prof.",12/13/2012,3.0,3.0,,2,Sorta interested,2.5,2.5,1,No,1355410892000,N/A,1452,N/A,,N/A,[],people,people
N/A,good,average,good,1,20673495,1,,awesome,5,ECO2517,Vraiment un bon prof ! Très drôle mais un peu arrogant! Ses examens comprennent majoritairement des questions à choix multiples vraiment ressemblantes à celles des examens exemples sur C.V,10/02/2012,3.0,3.0,,5,It's my life,5.0,5.0,1,Yes,1349169859000,N/A,1452,N/A,,N/A,[],person,person
N/A,average,average,average,1,18780881,1,,poor,2,ECO1704,"Ce prof MÉPRISE les étudiants. Il s'en fout carrément. Don't take his class, it's horrible.",06/30/2011,3.0,3.0,,2,Sorta interested,2.0,2.0,1,Yes,1309449882000,N/A,1452,N/A,,N/A,[],person,person
N/A,good,average,good,1,18218003,3,,awesome,4,ECO2517,Excellent professeur!Il sait rendre vivant un savoir qui n'est pas du tout évident.  Est toujours prêt à recevoir et à aider.Donne de très bons conseils.Les exemples sont efficacement unique. L'assistant de très grande utilité.  Merci à vous.Je recommande fortement.,02/08/2011,2.0,2.0,,5,Really into it,4.5,4.5,1,Yes,1297160417000,N/A,1452,N/A,,N/A,[],people,person
N/A,average,good,poor,0,18114174,1,,poor,2,ECO1704,Méprisant à un nouveau niveau. Ses assistants son bêtes et désinteressés. Enseigne la matière de manière très inéfficace. Très monotone. Changez de prof si vous en avez l'opportunité.,01/10/2011,4.0,4.0,,1,Sorta interested,1.5,1.5,1,Yes,1294676625000,N/A,1452,N/A,,N/A,[],person,people
N/A,poor,average,poor,0,18076541,1,,awful,1,ECO1704,"Pas organisé, très méprisant envers les étudiants. He's not organized and he doesn't like students. Furthermore, he's really not willing to help, even if you really need it!",01/03/2011,3.0,3.0,,1,Sorta interested,1.0,1.0,1,Yes,1294015350000,N/A,1452,N/A,,N/A,[],person,people
N/A,average,average,average,0,17649209,1,,poor,2,ECO1704,"Ennuyeux comme c'est pas possible, pas organisé, dit qu'il donnera les notes, oublie de le faire. Est drôle cependant. Si vous pouvez avoir un autre prof, changez!",10/12/2010,3.0,3.0,,2,Sorta interested,2.0,2.0,1,Yes,1286883157000,N/A,1452,N/A,,N/A,[],person,people
