attendance,clarityColor,easyColor,helpColor,helpCount,id,notHelpCount,onlineClass,quality,rClarity,rClass,rComments,rDate,rEasy,rEasyString,rErrorMsg,rHelpful,rInterest,rOverall,rOverallString,rStatus,rTextBookUse,rTimestamp,rWouldTakeAgain,sId,takenForCredit,teacher,teacherGrade,teacherRatingTags,unUsefulGrouping,usefulGrouping
Mandatory,good,poor,good,0,25126011,0,,awesome,5,PSY3706,J'ai beaucoup aimé et appris dans ce cours. Elle est une enseignante et une chercheuse inspirante. Je conseil ce cours à tous ceux qui sont intéressé par la psychologie de la santé. Je referais ce cours n'importe quand. ,08/16/2015,1.0,1.0,,5,It's my life,5.0,5.0,1,Yes,1439767466000,Yes,1452,Yes,,A-,['Inspirational'],people,people
N/A,average,good,average,1,20092974,0,,average,2,PSY3706,"The book was just god-awful. The teacher is really nice but her exams are really tough. Wouldn't take this course again, nor would I recommend it to someone else.",04/21/2012,5.0,5.0,,3,Low,2.5,2.5,1,Yes,1335030061000,N/A,1452,N/A,,N/A,[],people,person
N/A,average,good,average,1,20072398,0,,good,3,PSY3706,The teacher is decent. She's nice and she's helpful but a lot of her material is pretty random and you pretty much have to memorize everything even if she insists on the comprehension aspect of the material. Only take this class if mandatory.,04/18/2012,4.0,4.0,,4,Really into it,3.5,3.5,1,Yes,1334756587000,N/A,1452,N/A,,N/A,[],people,person
N/A,good,average,good,0,20022159,0,,awesome,5,PSY3706,"She makes the class very interesting. Althought its alot of information to learn, she makes it easy to learn by giving concrete examples. Her feedback on exams is very useful.",04/10/2012,3.0,3.0,,5,It's my life,5.0,5.0,1,Yes,1334049321000,N/A,1452,N/A,,N/A,[],people,people
N/A,good,average,good,0,18513723,0,,awesome,5,PSY3706,"Excellent teacher!!! Makes the class participate and uses movies, cases and special guests to make the class more interesting. I would recommend her to anyone.",05/03/2011,2.0,2.0,,5,It's my life,5.0,5.0,1,Yes,1304416195000,N/A,1452,N/A,,N/A,[],people,people
