attendance,clarityColor,easyColor,helpColor,helpCount,id,notHelpCount,onlineClass,quality,rClarity,rClass,rComments,rDate,rEasy,rEasyString,rErrorMsg,rHelpful,rInterest,rOverall,rOverallString,rStatus,rTextBookUse,rTimestamp,rWouldTakeAgain,sId,takenForCredit,teacher,teacherGrade,teacherRatingTags,unUsefulGrouping,usefulGrouping
N/A,average,average,average,0,24258644,0,,good,3,MAT1341,"Before I took this class, I didn't know what a vector was. However, Professor Christie was very helpful, and his practice exams were always similar to his tests! Not to mention, he always posts his notes online, which is very helpful. Lastly, he was very attentive towards his students, and would answer your question in the lecture itself or outside",01/09/2015,3.0,3.0,,4,Really into it,3.5,3.5,1,No,1420797300000,Yes,1452,Yes,,N/A,['Caring'],people,people
Not Mandatory,good,average,good,0,23889852,0,,good,4,MAT1302,"Great proff. All the class notes, assignments, and practice exams are on his personal website which makes it very easy to follow along. Great grading scheme with a DGD exam every two weeks on only a few sections per exam. Follow along with the class notes and you will pass.",11/25/2014,2.0,2.0,,4,Sorta interested,4.0,4.0,1,No,1416885209000,Yes,1452,Yes,,N/A,"['Lecture heavy', 'Amazing lectures ']",people,people
N/A,poor,poor,poor,4,23621937,2,,poor,1,MAT1341,"He definitely know everything in his class. However, he just don't know how to express it by words clearly. He talks in very soft voice, and he talks when he is writing, this makes his class super case and I don't even have time to understand all the materials.",10/01/2014,1.0,1.0,,2,Meh,1.5,1.5,1,No,1412154291000,N/A,1452,Yes,,N/A,[],people,people
N/A,average,average,average,0,23100713,1,,good,3,MAT1302,"Overall, he's not a bad prof. For 1302, he posts all notes online, which is great because you can miss class, read the notes, and still get a good grade. He's also young and hipster but he doesn't interact with the class to much beyond the course material. He's very helpful during his office hours.",04/25/2014,2.0,2.0,,4,Meh,3.5,3.5,1,No,1398437408000,N/A,1452,N/A,,N/A,[],person,people
Not Mandatory,average,average,average,2,23065423,0,,average,2,MAT13012,"He's a really nice guy who seems to really care about the class. He's helpful and approachable when you ask a question in person. However, he needs to improve his teaching style! He has little eye contact with the class and his teaching is pretty monotone and boring. He's young so he should take advantage of that to better connect with students.",04/20/2014,2.0,2.0,,4,Meh,3.0,3.0,1,No,1397992352000,N/A,1452,N/A,,N/A,[],people,people
Mandatory,average,average,average,1,22974305,1,,poor,2,MAT1302,"He is probably a nice guy, but he is new to teaching so he talks really fast and his voice is really low and not easily understandable. He posts note online which are really helpful. If you can choose a better prof, go for it.",04/01/2014,2.0,2.0,,2,Meh,2.0,2.0,1,No,1396357690000,N/A,1452,N/A,,N/A,[],person,person
Mandatory,poor,poor,average,0,22794369,0,,average,1,MAT1308,"He's new to teaching (very obvious. I understood the material but had NO IDEA what he was saying in class. All over the place. Constantly corrects himself or is corrected by students. However, he does seem like he genuinely cares about his students",01/26/2014,1.0,1.0,,4,Sorta interested,2.5,2.5,1,Yes,1390757200000,N/A,1452,N/A,,A+,[],people,people
Not Mandatory,good,average,good,0,22505371,0,,good,4,MAT1308,"He's clearly new to teaching, and I wasn't a big fan to begin with, as he seemed flustered. As the term went on, I felt that he actually became a very good teacher. I'm glad that he'll be my prof for MAT1302 next term, as his course requirements are quite straightforward. Also, don't hesitate to ask questions, as he's more than happy to answer them",12/11/2013,2.0,2.0,,4,Meh,4.0,4.0,1,No,1386761716000,N/A,1452,N/A,,B,[],people,people
Not Mandatory,average,average,average,0,22442894,0,,average,3,MAT1308,"New professor, so naturally a couple hiccups here and there.  Very clear, and wants you to succeed.  Endorses asking questions, and really loves what he teaches.  This guy will go far.",12/05/2013,2.0,2.0,,3,Low,3.0,3.0,1,Yes,1386247526000,N/A,1452,N/A,,A-,[],people,people
