attendance,clarityColor,easyColor,helpColor,helpCount,id,notHelpCount,onlineClass,quality,rClarity,rClass,rComments,rDate,rEasy,rEasyString,rErrorMsg,rHelpful,rInterest,rOverall,rOverallString,rStatus,rTextBookUse,rTimestamp,rWouldTakeAgain,sId,takenForCredit,teacher,teacherGrade,teacherRatingTags,unUsefulGrouping,usefulGrouping
Mandatory,good,average,good,1,36187802,0,,awesome,5,JNP1901,She is a amazing teacher and super caring. She has helped me so thought the semester and gave me such a amazing first year. If you get her you are supper lucking!,04/28/2022,2.0,2.0,,5,N/A,5.0,5.0,1,Yes,1651190117000,Yes,0,No,,B+,"['Amazing lectures ', 'Accessible outside class', 'Caring']",people,person
Mandatory,good,average,good,1,35910184,0,,awesome,5,JPN1902,"She is one of the kindest professor I&#39;ve ever met, really cares about her students(ask how to pronounce their names), and make sure we understood the new vocabulary/grammar points. 10/10!",03/07/2022,2.0,2.0,,5,N/A,5.0,5.0,1,Yes,1646626167000,Yes,0,Yes,,N/A,"['Participation matters', 'Caring']",people,person
Mandatory,good,poor,good,1,35731627,0,online,awesome,5,JPN1901,"Though she sometimes struggles to get the point through, she makes the class very easy to understand and tests include exactly what it's seen in class. Very cute and very kind, 100/10 recommended.",01/10/2022,1.0,1.0,,5,N/A,5.0,5.0,1,Yes,1641854967000,Yes,1452,Yes,,A,"['Lots of homework', 'Group projects']",people,person
Mandatory,good,average,good,0,35238040,0,online,awesome,5,JPN1901,Great teacher,11/15/2021,3.0,3.0,,5,N/A,5.0,5.0,1,Yes,1636938381000,Yes,1452,No,,A+,"['Amazing lectures ', 'Accessible outside class', 'Gives good feedback']",people,people
Mandatory,good,average,good,1,34279789,0,online,awesome,5,JPN1901,"One of my favourite classes and profs throughout my time in university. Professor was kind and fun and never made class boring even though it was pretty early. everything she taught was relevant. super caring and lovely professor, would highly recommend to anybody who wants to learn Japanese!",01/15/2021,2.0,2.0,,5,N/A,5.0,5.0,1,Yes,1610678578000,Yes,1452,No,,A+,"['Caring', 'Inspirational', 'Amazing lectures ']",people,person
Mandatory,good,poor,good,1,32831915,0,,awesome,5,JPN1901,super friendly pro ! the exams and tests are really what she mentioned in class. the handout is very useful if you wanna prepare for exam.,01/14/2020,1.0,1.0,,5,N/A,5.0,5.0,1,Yes,1578963629000,Yes,1452,Yes,,A+,"['Respected', 'Gives good feedback', 'Accessible outside class']",people,person
Mandatory,good,average,good,1,31429456,0,,awesome,5,JPN1901,"Kubota sensei is a really good prof. There are a lot of tests in her class, but she always told us exactly what to study and, without fail, everything on the tests was exactly what she said it would be. She explains things really well and she's very funny. Kubota sensei has a lot of energy and it's fantastic. There was never a dull class with her.",03/12/2019,3.0,3.0,,5,N/A,5.0,5.0,1,Yes,1552424539000,Yes,1452,Yes,,A+,"['Hilarious', 'Clear grading criteria', 'Test heavy']",people,person
Not Mandatory,good,poor,good,1,29665594,0,,awesome,5,JPN1901,"Very sweet, very funny, very kind. Make a couple mistakes on an assignment and you'll still get 99%. Course is super easy if you're decent at memorizing, especially if you already know kana going in. 3 hour exam took about half an hour to write even though I only studied the day before. Is very clear about what's on her tests, no surprises.",03/18/2018,1.0,1.0,,5,N/A,5.0,5.0,1,Yes,1521406447000,Yes,1452,Yes,,A+,"['Hilarious', 'Caring']",people,person
N/A,good,poor,good,1,29473217,0,,awesome,5,JNP1901,"Really good prof, her class is interesting and not so hard.",01/18/2018,1.0,1.0,,5,N/A,5.0,5.0,1,Yes,1516285490000,Yes,1452,Yes,,A+,"['Participation matters', 'Caring', 'Respected']",people,person
N/A,good,average,good,1,27745427,0,,good,4,JPN1901,"She'll be one of the weirdest teachers you'll ever have, but she's adorable and extremely helpful. She goes out of her way to answer your questions and genuinely cares about her students. Plus, she's an easy marker. However,  be prepared to do lots and lots of memorization--you ARE learning a new language after all.",01/17/2017,2.0,2.0,,4,N/A,4.0,4.0,1,No,1484686915000,Yes,1452,Yes,,A+,"['Hilarious', 'Lots of homework', 'Amazing lectures ']",people,person
Mandatory,good,average,good,1,27666275,0,,good,4,JPN1901,"She is extremely kind. The course itself is very easy, but you need to be willing to spend the time to memorize lots of Japanese vocabularies. Don't bother to buy the textbook.",01/03/2017,2.0,2.0,,4,N/A,4.0,4.0,1,No,1483479644000,Yes,1452,Yes,,N/A,[],people,person
Mandatory,good,average,good,1,27656350,0,,awesome,5,JPN1901,"She is a wonderful lady and I'm so glad she was my introduction to the language. She is hilarious and makes sure you understand difficult concepts with memorable actions or even songs. Quizzes almost every week to keep you fresh and the course follows the textbook, so while you don't really need it, you should buy it anyway. Make sure you practice",01/02/2017,2.0,2.0,,5,N/A,5.0,5.0,1,Yes,1483367438000,Yes,1452,Yes,,A,"['Respected', 'Participation matters', 'Gives good feedback']",people,person
Mandatory,good,poor,good,1,26087995,0,,awesome,5,JPN1901,"She is fantastic, and very hilarious. One of the best teacher ever.  Make sure to work hard on your own too, because everything is new information.  She is more than welcome to answer !",02/25/2016,1.0,1.0,,5,It's my life,5.0,5.0,1,Yes,1456412769000,Yes,1452,Yes,,A+,"['Caring', 'Hilarious']",people,person
Not Mandatory,good,average,good,1,25927087,0,,good,4,JPN1901,"She's an amazing teacher, always there for her students and really nice and supportive. Lots of assignments, quizzes, 2 exams and one oral presentation in front of the class. There's a lot of studying so beware. She's clear in her explanations, would take the class again.",01/12/2016,2.0,2.0,,4,Really into it,4.0,4.0,1,No,1452611166000,Yes,1452,N/A,,A,"['Hilarious', 'Lots of homework']",people,person
Mandatory,good,average,good,0,25913197,0,,awesome,4,JPN1901,Great professor and great class. Definitely will take another class with sensei Kubota. There is an oral presentation to do but sensei is there to help and it is easy to make friends so the presentation is not something to worry about. Sensei is very energetic and wants her students to understand and succeed.,01/10/2016,2.0,2.0,,5,It's my life,4.5,4.5,1,Yes,1452448448000,N/A,1452,Yes,,N/A,"['Gives good feedback', 'Amazing lectures ', 'Lots of homework']",people,people
Not Mandatory,average,average,average,0,25768061,1,,average,3,JPN1901,She's nice and exams are okay. Can get Easy A.,12/18/2015,2.0,2.0,,3,Really into it,3.0,3.0,1,No,1450480693000,N/A,1452,Yes,,N/A,"['Lecture heavy', 'Hilarious']",person,people
Mandatory,good,average,good,1,25441916,0,,awesome,4,JPN1901,"She is very animated and funny. She gives very good feedback on homework, and tells funny stories. I miss this class!",11/18/2015,2.0,2.0,,5,It's my life,4.5,4.5,1,Yes,1447857485000,N/A,1452,Yes,,N/A,"['Gives good feedback', 'Hilarious', 'Lots of homework']",people,person
Not Mandatory,good,poor,good,8,23425406,0,,awesome,5,JPN1901,"Great professor, makes class really interesting. Easy quiz, assignment and exam. You can get an easy A if you pay attention to her, but being absent minded in class is not a big deal because she posts everything on the website.",07/06/2014,1.0,1.0,,5,It's my life,5.0,5.0,1,Yes,1404652277000,N/A,1452,N/A,,A+,[],people,people
Mandatory,good,poor,good,2,23244837,0,,awesome,5,JPN1902,"Overall, great class. She gets everyone to participate in her class. Her review slides are very good, great study guides. Homework, assignments and everything is good. I am glad and lucky to be her student in JPN1902 class. Mami sensei is an easygoing, helpful, funny and friendly professor. I enjoyed learning Japanese in her class.",05/14/2014,1.0,1.0,,5,It's my life,5.0,5.0,1,Yes,1400067793000,N/A,1452,N/A,,B+,[],people,people
Mandatory,good,poor,good,1,22694014,0,,awesome,5,JPN1901,This professor is amazing!,01/04/2014,1.0,1.0,,5,It's my life,5.0,5.0,1,Yes,1388804111000,N/A,1452,N/A,,N/A,[],people,person
Mandatory,good,poor,good,4,22616970,0,,awesome,5,JPN1901,BEST CLASS! I absolutely loved attending sensei's lectures. She truly cares about her students and even offers extra help. The homework she assigns makes it easier to learn the language. Her review sessions helps solidify learning. I learned so much with her and I would gladly take another class! She's adorable and her slides have cats as examples.,12/19/2013,1.0,1.0,,5,It's my life,5.0,5.0,1,No,1387467871000,N/A,1452,N/A,,A+,[],people,people
N/A,good,poor,good,0,22397220,0,,awesome,5,JPN1901,"SHE IS SO ADORABLE. She is also very very very funny, helpful, and clear. I recommend her class.",11/27/2013,1.0,1.0,,5,It's my life,5.0,5.0,1,Yes,1385555556000,N/A,1452,N/A,,N/A,[],people,people
