attendance,clarityColor,easyColor,helpColor,helpCount,id,notHelpCount,onlineClass,quality,rClarity,rClass,rComments,rDate,rEasy,rEasyString,rErrorMsg,rHelpful,rInterest,rOverall,rOverallString,rStatus,rTextBookUse,rTimestamp,rWouldTakeAgain,sId,takenForCredit,teacher,teacherGrade,teacherRatingTags,unUsefulGrouping,usefulGroupingMandatory,average,good,poor,5,25658275,2,,poor,2,PHY1321,"worst prof, he has a lot of attitude and rushes the subject material. You are left to learn a bulk of the material on your own which is fine, but his final exam does not reflect the problems done in class! This prof has an attitude problem and he should attend a workshop on how to teach properly. For paying $7000 tuition, find someone better  ",12/12/2015,4.0,4.0,,1,Low,1.5,1.5,1,Yes,1449915910000,N/A,1452,Yes,,B,"['Get ready to read', 'Tough grader']",people,people
N/A,good,good,good,2,25636200,1,,good,4,PHY1331,"Honestly, if you do the suggested problems/assignments as you go, you'll have no problem with the midterms/final. Final was multiple choice, so it's not TOO bad - many questions were similar to old finals! The midterms were a little brutal, but Dr. C gives chances for bonus marks. Don't buy the textbook, his lecture notes are all you need!! ",12/10/2015,4.0,4.0,,4,Sorta interested,4.0,4.0,1,No,1449780476000,N/A,1452,Yes,,N/A,['EXTRA CREDIT'],person,people
Not Mandatory,good,average,good,1,25563126,0,,good,4,PHY1321,"He's a great prof for a first year course. Very laid back in his teaching and has good pacing. As long as you do the assignments, quizzes and assigned problems you will easily get a great mark in his class. Be ready to do some self teaching as he recommends because although it may be new to some of you it is essential for success in university. ",12/06/2015,2.0,2.0,,4,Really into it,4.0,4.0,1,No,1449416181000,N/A,1452,Yes,,A-,"['Lots of homework', 'Participation matters']",people,person
Not Mandatory,average,average,average,0,25439205,2,,poor,2,PHY1321,"Have fun getting in contact with him (hint: you won't). Does not frequently reply to emails, rarely comes to his office hours. His TA's lost my midterm, and I was not even able to contact him about it.  Does not allow electronic devices in his lectures either.  Also gives online quizzes with irritating marking schemes. ",11/18/2015,3.0,3.0,,2,Low,2.0,2.0,1,Yes,1447842370000,N/A,1452,Yes,,B,"['Tough grader', 'Get ready to read']",people,people
Not Mandatory,average,average,average,1,25369886,1,,average,3,PHY1321,"I thought I could do well without getting the textbook and only attending the lectures... but actually attend the DGD, read the textbook in conjunction to the lecture notes and do as many practice problems as possible. He is the type of teacher that shows you how to be independent. He doesn't teach EVERYTHING. You will have big responsibility!  ",11/09/2015,3.0,3.0,,3,Meh,3.0,3.0,1,Yes,1447062192000,N/A,1452,Yes,,N/A,"['Gives good feedback', 'Get ready to read', 'Lots of homework']",person,person
Mandatory,good,average,good,3,25274567,1,,good,4,PHY1321,"Considering he actually showed us some of his reviews in class, I'll write one because I know he reads them.  He's a fantastic prof. His lectures are designed to compliment your own readings and studying. As long as you put in the work and do practice problems on a regular basis, you'll get an A. Get the textbook for additional problems.",10/21/2015,2.0,2.0,,4,Really into it,4.0,4.0,1,Yes,1445419497000,N/A,1452,Yes,,A+,"['Lots of homework', 'Hilarious']",person,people
Mandatory,good,average,good,0,25172489,0,,good,4,PHY1322, can't fail his class ,09/04/2015,3.0,3.0,,4,Really into it,4.0,4.0,1,Yes,1441381274000,N/A,1452,Yes,,N/A,"['Clear grading criteria', 'EXTRA CREDIT']",people,people
Not Mandatory,good,average,good,0,25012921,0,,awesome,5,PHY1321,Awesome prof! Loved his classes and would 100% take any class with him as a prof again! Highly recommend and he isn't too bad to look at either!,07/02/2015,3.0,3.0,,4,It's my life,4.5,4.5,1,No,1435849704000,N/A,1452,Yes,,B+,"['Lots of homework', 'Hilarious', 'Amazing lectures ']",people,people
Mandatory,good,average,good,1,24949864,0,,good,4,PHY1322,"He is the best prof you will ever have for PHY 1321 or PHY 1322. He's hilarious! The jokes really keep you awake during class. Material is tough but he does a great job at teaching it. You have to do your part tho! He gives a lot of bonus marks, and his exam is MC which is epic for a physics exam. You can't fail this class! He even says that!",06/09/2015,2.0,2.0,,4,It's my life,4.0,4.0,1,No,1433848105000,N/A,1452,Yes,,A+,"['EXTRA CREDIT', 'Hilarious', 'Amazing lectures ']",people,person
N/A,good,average,average,0,24858021,0,,good,4,PHY1322,"Harder content than Phy1321, but interesting course theory!!  Dr. Czajkowski is hilarious and does everything in his power to make sure NO ONE fails his class.  Seriously - the guy cares that much!  DO textbook problems, GO to DGDs!!! Prof gives extra-credit which helps.  It's easy to get a B in the class, but you gotta work for that A :)",05/18/2015,3.0,3.0,,3,Really into it,3.5,3.5,1,Yes,1431948779000,N/A,1452,Yes,,N/A,['Lots of homework'],people,people
N/A,average,average,average,1,24857861,0,,good,3,PHY1321,"(also for PHY1322) Czajkowski made me LOVE university physics.  He's hilarious! For Phy1321, he's a lot more easy going.  DO the weekly assignments, and try to do pre-lecture quizzes and DGD bonus quizzes.  He gives you every opportunity to get an A, so take it!  He does demos in class - they're amazing.  Recommended class for Biomed students!! :)",05/18/2015,3.0,3.0,,4,Sorta interested,3.5,3.5,1,Yes,1431947680000,N/A,1452,Yes,,N/A,"['Lots of homework', 'EXTRA CREDIT', 'Amazing lectures ']",people,person
N/A,average,average,average,0,24571943,1,,poor,3,PHY1321,"Go to class, the problems are similar to the ones he does in class. Prof gives sample problems without solutions so the textbook is a must. He may not be the nicest guy, but just pay attention to the in class problems, and make sure you can do Q's in the textbook that are similar. Exam is most difficult part of course.",04/09/2015,2.0,2.0,,1,Low,2.0,2.0,1,Yes,1428610405000,N/A,1452,Yes,,N/A,[],person,people
N/A,average,average,good,0,24514963,0,,good,3,PSY1321,"I found his tests very fair in the sense that he tested us on what he taught us. It wasn't the easiest subject matter all the time, and he multiple choice final did not go well for me because I could do the hard questions but not the easy ones. I would take it again with him if I had to.",03/28/2015,3.0,3.0,,5,Sorta interested,4.0,4.0,1,No,1427581259000,N/A,1452,Yes,,A,"['Gives good feedback', 'Clear grading criteria', 'Hilarious']",people,people
Mandatory,good,poor,good,1,24474196,0,,awesome,4,PHY1300,"Great prof. Was always asking him questions, always had time for me. ",03/18/2015,1.0,1.0,,5,It's my life,4.5,4.5,1,Yes,1426699076000,N/A,1452,Yes,,A+,"['Inspirational', 'Hilarious', 'Caring']",people,person
N/A,average,good,average,0,24381880,0,,average,3,PHY1321,"He's a really funny guy which made the class more enjoyable but it was a difficult course. Assignments were tricky at times, and the first midterm was killer. His demos were cool and course notes were very handy. Go to the DGDs!! (TA Eric was so hepful!) He honestly wants you to well, but wants you to deserve it.",02/12/2015,4.0,4.0,,3,Low,3.0,3.0,1,No,1423776022000,N/A,1452,Yes,,B+,"['Lots of homework', 'Respected']",people,people
Mandatory,good,average,good,0,24352123,1,,good,4,PHY1322,"He is absolutely hilarious, but at the end of the day he still does a very good job teaching physics (which is pretty dry of a subject). I would take any of his classes just to have him again.",02/02/2015,3.0,3.0,,4,Sorta interested,4.0,4.0,1,No,1422868048000,N/A,1452,N/A,,Not sure yet,"['Respected', 'Hilarious', 'Amazing lectures ']",person,people
Not Mandatory,average,average,average,1,24307501,2,,poor,2,PHY1321,"Honestly, one of the worst profs I've ever had. He's extremely disorganized and after the second midterm, you're basically teaching yourself everything. The only good thing about him are his bonuses and the boosts he gives you on midterms and for assignments. Other than that a complete mess. He's really sassy, seems like a decent guy, but bad prof!",01/19/2015,3.0,3.0,,2,Low,2.0,2.0,1,No,1421700458000,N/A,1452,Yes,,A+,[],people,person
Mandatory,average,average,average,0,24260997,0,,average,3,PHY1331,"He is hilarious, has a cool accent to listen to. The lectures were useful until after the second midterm, where it became a game of ''study this on your own, I'll show you how to start problems you should know how to solve, but won't actually solve them.'' Lots of extra credit, though. He doesn't coordinate the labs, but they are easy.",01/09/2015,3.0,3.0,,3,Really into it,3.0,3.0,1,No,1420825790000,N/A,1452,Yes,,A,"['Hilarious', 'Tough grader', 'EXTRA CREDIT']",people,people
N/A,average,average,average,0,24256908,0,,average,2,PHY1331,"Its easy to crack this course   do the assignments and pre-lectures whether you get help or not.  Use his package, look over the notes, do the practice exams, take notes on everything he says, and look up questions online. He is really into physics, and sometimes into himself, but otherwise he's a decent prof, if a tad condescending",01/08/2015,3.0,3.0,,3,Sorta interested,2.5,2.5,1,Yes,1420753728000,N/A,1452,Yes,,N/A,"['EXTRA CREDIT', 'Lots of homework']",people,people
Not Mandatory,average,average,average,0,24251329,0,,average,2,PHY1321,"This man is pure sass. I found this class challenging because he is all over the place. Even if you are in PHY 1321, go to the extra class for PHY 1331 because examples in that class are on the midterms. Very heavy workload, so start things early. DO NOT buy the textbook ($140+) , just stick to his lecture notes ($15).",01/07/2015,3.0,3.0,,3,Meh,2.5,2.5,1,No,1420673251000,N/A,1452,Yes,,C+,"['Lots of homework', 'Lecture heavy']",people,people
N/A,average,good,average,0,24246369,0,,good,3,PHY1331,Prof C. is definitely a someone that other professors should strive to be. He cares a lot about how the students do and will go out of his way to help and make sure you do well in his class even if you were flunking. Definitely would take this course again because he was such a great professor!,01/07/2015,4.0,4.0,,4,Really into it,3.5,3.5,1,No,1420635082000,N/A,1452,Yes,,N/A,"['Inspirational', 'Hilarious', 'Respected']",people,people
Mandatory,average,average,average,0,24245628,1,,good,3,PHY1331,"Super funny guy. Assignments are definitely worth doing, as well as the pre-lecture quizzes. Go to the physics help centre and you'll do great on all of them and they give you easy marks. Professorstudent relations will be much more pleasant if you've done the work. ",01/07/2015,3.0,3.0,,4,Sorta interested,3.5,3.5,1,Yes,1420628784000,N/A,1452,Yes,,N/A,"['Hilarious', 'Lecture heavy', 'Respected']",person,people
N/A,average,poor,average,1,24185862,0,,average,3,PHY1321,"He is a little confusing when it comes to teaching, but he goes through a decent amount of examples in class as well as demos. Assignments questions are often tricky, but his exams are very fair. Gives many opportunities for bonus to lower the final exam weight as well. Hilarious guy as well, overall a good professor!",12/25/2014,1.0,1.0,,3,Sorta interested,3.0,3.0,1,No,1419521187000,N/A,1452,Yes,,N/A,"['EXTRA CREDIT', 'Hilarious']",people,person
N/A,average,good,average,0,24170878,0,,average,3,1300,"He keeps the lectures interesting and interacts with students who want to be there and actively participate. The lectures can be difficult especially since the class is meant for people who aren't in Physics, I think he forgot that sometimes and went a bit too intense.  However, he makes it so you want to research it further so it works out. ",12/22/2014,4.0,4.0,,3,Really into it,3.0,3.0,1,Yes,1419275239000,N/A,1452,N/A,,N/A,"['Amazing lectures ', 'Participation matters']",people,people
Mandatory,average,average,average,0,24148110,0,,good,2,PHY1321,"Honestly, if you don't have a physics frame of mind you might find some of the concepts in this class challenging. However , if you but in the time, go to the dgd's (super helpful), do all the assignments (not last minute) then you might actually end up with  good mark. There's no surprises on the midterms and final and overal Czajkowski is solid",12/19/2014,3.0,3.0,,5,Low,3.5,3.5,1,Yes,1419005881000,N/A,1452,Yes,,N/A,"['Clear grading criteria', 'Gives good feedback']",people,people
Not Mandatory,good,average,average,0,24102268,0,,good,4,PHY1321,Solid professor. Keeps lectures interesting. Fun sense of humor. Very easy pass with basic effort. ,12/16/2014,3.0,3.0,,3,Low,3.5,3.5,1,Yes,1418738212000,N/A,1452,Yes,,C,"['Clear grading criteria', 'Lots of homework', 'EXTRA CREDIT']",people,people
Mandatory,average,good,average,0,24003768,0,,average,3,PHY1331,"Dr. Czaijkowski gives interesting lectures and is a fair marker. His course was hard because of the content, not because of his teaching abilities or grading criteria! Questions on exams are very similar to what we see in class (where you always get lots of examples). Class DGDs are VERY helpful and give you a lot more examples to follow.",12/09/2014,5.0,5.0,,3,Really into it,3.0,3.0,1,Yes,1418142900000,N/A,1452,Yes,,D+,['Lots of homework'],people,people
Not Mandatory,average,good,poor,1,23963497,1,,poor,2,PHY1331,"His lectures are all over the place. He spends way too much time reviewing simple concepts before the first midterm and flies through the material before the final. He skips numerous sections of his course pack, which is filled with incorrect symbols and errors, resulting in a lot of confusion. Not a class I would take again. ",12/05/2014,4.0,4.0,,1,Sorta interested,1.5,1.5,1,Yes,1417803695000,N/A,1452,Yes,,N/A,[],person,person
N/A,average,good,poor,0,23906019,2,,poor,2,PHY1331,"Very tough, good content but super difficult if you don't already have a working knowledge of physics.",11/29/2014,5.0,5.0,,1,Sorta interested,1.5,1.5,1,No,1417277859000,N/A,1452,Yes,,N/A,"['Lots of homework', 'Tough grader']",people,people
Mandatory,good,average,good,0,23902122,0,,good,4,PHY1321,Hilarious prof and gave the most stimulating lectures out of all my first year profs. Hell load of assignments and pre-lecture quizzes but the midterms are bearableawesome if you practice the end-of-section questions in his notes.,11/27/2014,3.0,3.0,,4,Really into it,4.0,4.0,1,Yes,1417125019000,N/A,1452,Yes,,N/A,"['Amazing lectures ', 'Lots of homework', 'Hilarious']",people,people
Mandatory,good,average,good,0,23882639,1,,awesome,5,PHY4362,"Great prof, great class, I would take every course with this guy! The assignments can be really long but if you cant suck it up and do them anyways you probably didn't make it this far. Hilarious and engaging lectures where you learn a lot about all kinds of stuff and hes always available if you go to his office.",11/24/2014,2.0,2.0,,5,It's my life,5.0,5.0,1,Yes,1416822103000,N/A,1452,Yes,,Not sure yet,"['Amazing lectures ', 'Caring', 'Hilarious']",person,people
N/A,average,good,average,0,23725445,0,,average,2,1322,"The teacher is a funny guy, he's a good person. However, he isn't very good at transferring the information he is teaching. He knows his stuff though and you can tell he has a massive pool of knowledge. It would just be nice if he could actually transfer that to his students in a productive way.  Super nice though, he really tries to help. ",11/01/2014,4.0,4.0,,3,Sorta interested,2.5,2.5,1,Yes,1414864307000,N/A,1452,Yes,,N/A,"['Participation matters', 'Caring', 'Hilarious']",people,people
Mandatory,poor,good,poor,1,23705052,0,,awful,1,PHY1331,"Horrible lecturer, can't explain the topics he teaches. For example, he took half an hour to explain integration and summed it up with ""you really have to guess an integral, there are no real rules"". His online quizzes are broken and he does not round his answers when he asks you to. His course pack is filled with formatting errors and blank pages.",10/28/2014,5.0,5.0,,1,Meh,1.0,1.0,1,Yes,1414506035000,N/A,1452,Yes,,N/A,"['Tough grader', 'Lots of homework']",people,person
Mandatory,good,average,good,0,23678127,0,,awesome,5,PHY1321,"He got lots of assignments, be ready for that. He doesn't use textbook, it is for people seeking for a score higher than A. ",10/21/2014,3.0,3.0,,4,Really into it,4.5,4.5,1,Yes,1413909747000,N/A,1452,Yes,,N/A,"['Amazing lectures ', 'Hilarious', 'Respected']",people,people
Mandatory,good,average,good,0,23677999,0,,awesome,5,PHY1321,"Czajkowski is for sure a good prof and a nice person with great sense of humour. The lectures are interesting with clear explanations on demonstrated questions, and he's always willing to answer your questions. The exam is for sure not hard,  pretty fair for the amount of time he offers. Also, he never uses textbook, he has his own lecture note. ",10/21/2014,2.0,2.0,,5,It's my life,5.0,5.0,1,No,1413908484000,N/A,1452,Yes,,N/A,"['Amazing lectures ', 'Gives good feedback', 'Respected']",people,people
N/A,good,average,good,0,23581340,0,,good,4,PHY1122,"Good teacher, very funny and clever. Labs are easy. His notes aren't very good, and the quizzes are somehow extremely hard. Final was very hard but marking scheme is awesome.",09/07/2014,3.0,3.0,,4,Sorta interested,4.0,4.0,1,Yes,1410109612000,N/A,1452,N/A,,N/A,[],people,people
Not Mandatory,good,average,good,0,23400345,0,,good,4,PHY1322,"Great guy and Midterms can be so easy but if you screw up a simple Multiple choice question its basically over, the Final is hard but great guy and interesting stuff you can do well without too much effort if you're interested in the topic. If not he's funny so tolerate the class for a bit",06/25/2014,2.0,2.0,,4,Really into it,4.0,4.0,1,Yes,1403684839000,N/A,1452,N/A,,B+,[],people,people
N/A,average,good,average,2,23308559,0,,average,2,PHY1322,"Absolutely hilarious lecturer/emailer/Facebooker! Content is not that bad but testing this year was. Final + 2nd midterm were brutal. Mighty disappointed. Takes a lot of questions from the textbook so practice, practice, practice. And when you're done, practice some more. Eat, sleep and breath Physics II.",05/24/2014,4.0,4.0,,3,Sorta interested,2.5,2.5,1,No,1400941301000,N/A,1452,N/A,,N/A,[],people,people
Not Mandatory,good,average,average,0,23180608,1,,good,4,PHY1322,"ONE word for this guy ""AMAZING""",05/06/2014,2.0,2.0,,3,Really into it,3.5,3.5,1,No,1399407172000,N/A,1452,N/A,,N/A,[],person,people
Mandatory,good,good,good,0,23047008,0,,good,4,PHY1322,One of my favourite profs! He's hilarious so it makes you want to wake up to go to a morning class. His classes are filled with demos and are quite exciting. His exams are a little hard but you'll be okay if you practice every day.,04/16/2014,4.0,4.0,,4,It's my life,4.0,4.0,1,Yes,1397647885000,N/A,1452,N/A,,N/A,[],people,people
N/A,average,average,average,0,22943263,0,,average,3,PHY1321,"One of the funniest profs eva! His class is not easy though. Go to class and write down answers to his suggested probs. PRACTICE DAILY his midterms are brutal. 3 things to do well: 1. Do well in labs , 2. GET THE BONUS POINTS and 3. don't just look up assignment answers online(actually do them). I got an A with 70s on the midterm and final",03/25/2014,2.0,2.0,,2,Low,2.5,2.5,1,No,1395707642000,N/A,1452,N/A,,N/A,[],people,people
Mandatory,average,good,average,0,22699163,0,,average,2,PHY1332,This prof is hilarious but I found not cut out for teaching. He spends far too long rushing through the theory and not nearly enough time solving problems. I seriously understood nothing past the second midterm but still managed to get an A+ in the course. The labs and all the bonus opportunities are good buffers on your grade though which helps!,01/05/2014,4.0,4.0,,4,Meh,3.0,3.0,1,No,1388934221000,N/A,1452,N/A,,A+,[],people,people
Mandatory,poor,good,average,0,22680466,0,,poor,1,1321,This prof is super nice and helpful and funny but can't teach !!!,01/01/2014,5.0,5.0,,3,Really into it,2.0,2.0,1,No,1388570032000,N/A,1452,N/A,,P,[],people,people
N/A,average,good,average,1,22664214,0,,average,2,PHY1331,"Very tough for students who have not taken physics in grade 11 or 12. Things speed up very quickly & you will probably fall behind-recommend taking this course over the summer. Extra lecture classes are not helpful-must self-teach & spend most study time on this class. Prof is very nice & helpful, really cares about his students but course is hard.",12/27/2013,4.0,4.0,,3,Sorta interested,2.5,2.5,1,Yes,1388174758000,N/A,1452,N/A,,N/A,[],people,person
N/A,average,poor,average,1,22631768,0,,good,3,PHY1331A,"Hilarious guy, but doesn't teach theory. Read the text! 1321 + 1331 are combined, and there's way too much material, but not his fault. He does his best by us. Get all the bonus points you can and you'll pass. I had no idea what I was doing in this course (still don't) and managed an A. Make sure you prepare well for labs. Good luck! :)",12/20/2013,1.0,1.0,,4,Sorta interested,3.5,3.5,1,Yes,1387583437000,N/A,1452,N/A,,N/A,[],people,person
N/A,average,poor,average,0,22602250,0,,average,3,PHY1321,"Dr. Czajkowski is hilarious and you will laugh with him multiple times per lecture. Yes, as others have said, he doesn't really teach he just does problems. However, for a physics prof he  makes the class easy as he throws bonus marks at you and counts all multiple choice parts of tests out of less marks than there were questions to boost marks.",12/18/2013,1.0,1.0,,3,Sorta interested,3.0,3.0,1,No,1387375930000,N/A,1452,N/A,,N/A,[],people,people
N/A,good,average,good,0,22562516,0,,awesome,4,PHY1321,"I don't like physics in particular, but I love Czajkowski. He's such a funny and enthusiastic prof. Definitely do the weekly and bonus assignments, he's very fair like that. I asked for help with a particular assignment question once and he worked it out with me for 45 minutes, going well past his office hours. An amazing prof.",12/15/2013,2.0,2.0,,5,Sorta interested,4.5,4.5,1,Yes,1387128129000,N/A,1452,N/A,,N/A,[],people,people
N/A,average,good,poor,1,22550639,0,,poor,2,PHY1331,He's a cool guy who knows his physics. But he can't teach. Every lecture is basically him going through and us watching him do them.It's as if he expects you to already know all the theory. I'd grab a beer with the guy but never again take a class with him,12/14/2013,5.0,5.0,,1,Really into it,1.5,1.5,1,Yes,1387012262000,N/A,1452,N/A,,N/A,[],people,person
N/A,average,average,average,0,22544858,0,,average,3,PHY1321,"Probably the funniest prof i've ever had, which makes it easy to pay attention in class, but sometimes i feel like he expects you to memorize things he says in an instant. he kinda gets mad when the class doesn't (or doesn't talk). we flew through some material too fast which was pretty alarming and worrying. The exams are fair though.",12/13/2013,3.0,3.0,,2,Meh,2.5,2.5,1,No,1386958458000,N/A,1452,N/A,,N/A,[],people,people
N/A,average,good,good,0,22464405,1,,good,3,PHY1321,The subject material was really difficult and a lot of the times his explanations were a little difficult to understand. So read up before going to class! Also he is really helpful and you can tell that he wants the best for his students. Some classes he can get moody though. He's also self-deprecating which can make the class uncomfortable.,12/07/2013,5.0,5.0,,5,Low,4.0,4.0,1,No,1386445400000,N/A,1452,N/A,,N/A,[],person,people
N/A,good,good,average,0,22464337,0,,good,4,PHY1331,"Really funny prof which makes him easy to listen to, probably the only reason I didnt die going to this class :P He doesnt actually teach you anything ever though, so be prepared to learn from working through the textbook and printed off lecture notes on your own. Also he's really demeaning towards students. I liked him a lot, but not as a prof.",12/07/2013,4.0,4.0,,3,Low,3.5,3.5,1,Yes,1386444773000,N/A,1452,N/A,,N/A,[],people,people
Not Mandatory,average,good,poor,0,22432870,0,,poor,2,PHY1321,Worst prof ever. On the last class he told us he was giving us all the wrong answers all semester. What kind of prof does that?!,12/04/2013,4.0,4.0,,1,Meh,1.5,1.5,1,Yes,1386169372000,N/A,1452,N/A,,N/A,[],people,people
N/A,good,average,good,0,22382301,0,,awesome,5,PHY1321,"Explains the material well, does tons of practice problems in class and stops to answer any questions you have. His jokes and demonstrations always make the lectures entertaining.",11/24/2013,3.0,3.0,,5,Sorta interested,5.0,5.0,1,No,1385336900000,N/A,1452,N/A,,N/A,[],people,people
N/A,poor,good,poor,0,22301141,0,,awful,1,PHY1331B,"He's a funny guy and you can tell he knows physics. His tests are fair. However, he doesn't teach anything. He just does problems in class and expects and the students watch. Don't take him if you haven't previously done physics",11/12/2013,4.0,4.0,,1,Really into it,1.0,1.0,1,Yes,1384275796000,N/A,1452,N/A,,N/A,[],people,people
N/A,good,good,good,0,21897863,0,,awesome,5,PHY1322,"He gives many opportunities to do well in the course. If you bother doing the assignment, especially the bonus assignments/tasks, you should finish the course well. His passion for not only physics, but the well-being and success  of his students, make him an admirable prof! Czajkowski is one who offers ""A+ on final exam is A+ in the course!""",06/16/2013,4.0,4.0,,5,Low,5.0,5.0,1,No,1371417411000,N/A,1452,N/A,,N/A,[],people,people
