attendance,clarityColor,easyColor,helpColor,helpCount,id,notHelpCount,onlineClass,quality,rClarity,rClass,rComments,rDate,rEasy,rEasyString,rErrorMsg,rHelpful,rInterest,rOverall,rOverallString,rStatus,rTextBookUse,rTimestamp,rWouldTakeAgain,sId,takenForCredit,teacher,teacherGrade,teacherRatingTags,unUsefulGrouping,usefulGroupingN/A,good,average,good,0,21333460,0,,awesome,5,2174B,Excellent professor! Very clear expectations and lectures were very enjoyable. Extremely helpful throughout the semester. By far the best prof I've had at uOttawa.,02/10/2013,3.0,3.0,,5,Really into it,5.0,5.0,1,No,1360527228000,N/A,1452,N/A,,N/A,[],people,people
N/A,good,average,good,0,20999611,0,,awesome,4,PSY2174,"He's a great teacher! He's extremely helpful and always takes time to answer our questions, both in class and outside of class period. He's respectful to all the students and treats everyone nicely. He's also really funny in class and often tells jokes! Take him and you won't regret it!",12/09/2012,3.0,3.0,,5,Sorta interested,4.5,4.5,1,Yes,1355080058000,N/A,1452,N/A,,N/A,[],people,people
N/A,good,average,good,0,20937702,0,,awesome,4,PSY2174,"Best teacher I've had so far in university. Very patient, explains everything if you ask, super nice. No exams or tests (although he said he might include some next year), just a big research assignment divided into 4 parts (the textbook is basically a guide for your assignment). I came into this class already hating it, but I actually enjoyed it!",12/03/2012,2.0,2.0,,5,Sorta interested,4.5,4.5,1,No,1354546682000,N/A,1452,N/A,,N/A,[],people,people
N/A,good,poor,good,0,20689414,0,,awesome,5,CMN1548,I am taking his class this semester and he is the best teacher ive had at university,10/09/2012,1.0,1.0,,5,Really into it,5.0,5.0,1,Yes,1349813577000,N/A,1452,N/A,,N/A,[],people,people
N/A,good,poor,good,0,19676760,0,,awesome,5,PSY2174,"One of the best profs I've had, very helpful and always willing to make time for questions and meetings, treats you as a prof should - like a person and not a number; DEFINITELY take his class",01/05/2012,1.0,1.0,,5,Really into it,5.0,5.0,1,No,1325793948000,N/A,1452,N/A,,N/A,[],people,people
N/A,good,average,good,1,19576860,0,,awesome,5,PSY2174,"He was amazing! I love him, and he was super cute. A really kind hearted, and smart person. I wouldn't have taken this course with anyone else!",12/19/2011,2.0,2.0,,5,It's my life,5.0,5.0,1,No,1324337477000,N/A,1452,N/A,,N/A,[],people,person
N/A,good,average,good,0,19551666,0,,awesome,5,PSY2174,"Greeeat prof. If you're taking Research Methods don't take it with any other prof, especially if you're looking to write a thesis in psychology at any point, it's the best preparation. Also very clear what you need to do to get a high grade. You basically carry out a research project during the semester and get a ton of feedback. Even had fun!",12/17/2011,2.0,2.0,,5,Sorta interested,5.0,5.0,1,Yes,1324128733000,N/A,1452,N/A,,N/A,[],people,people
N/A,good,average,good,0,19189723,0,,good,4,PSY2174,"Nice guy, easy to approach. Sounds like Jerry Seinfeld. Gets a little snippy during lectures when he thinks he's teaching things we should already know, but one on one he's very patient. Was sometimes hard to meet with - busy guy. I think they piled too much on him this semester. No exams, expensive textbook.",11/08/2011,2.0,2.0,,4,Meh,4.0,4.0,1,Yes,1320776074000,N/A,1452,N/A,,N/A,[],people,people
