attendance,clarityColor,easyColor,helpColor,helpCount,id,notHelpCount,onlineClass,quality,rClarity,rClass,rComments,rDate,rEasy,rEasyString,rErrorMsg,rHelpful,rInterest,rOverall,rOverallString,rStatus,rTextBookUse,rTimestamp,rWouldTakeAgain,sId,takenForCredit,teacher,teacherGrade,teacherRatingTags,unUsefulGrouping,usefulGroupingMandatory,good,average,good,0,29326760,0,,awesome,5,PHY1321,"Prof Czajkowski is the only prof for this course and is the best. He can be intimidating, but he is hilarious. His marking is really fair such that you will not be able to fail his class unless you put in no work. The final was multiple choice which was good. Midterms were quite hard but he gives many opportunities to bring your mark up.",12/23/2017,3.0,3.0,,5,N/A,5.0,5.0,1,Yes,1514061590000,Yes,1452,Yes,,N/A,"['Amazing lectures ', 'Lecture heavy', 'Hilarious']",people,people
Mandatory,average,good,average,1,29319367,0,,average,3,PHY1321,"He gets angry at students from time to time, and I can't remember ever being on schedule in his class. He skips over some content in class (sometimes would ask TAs to make up for it in DGDs). The assignments are hard, but if you can do them you're good for the midterms. Exam was more challenging in addition to being entirely multiple choice.",12/22/2017,4.0,4.0,,3,N/A,3.0,3.0,1,No,1513970314000,Yes,1452,Yes,,A,"['Lots of homework', 'Hilarious']",people,person
Not Mandatory,good,good,good,0,29244147,0,,good,4,PHY1331,"Great prof! While the content is hard, he is a funny lecturer and makes it really difficult to fail! Wouldn't take the class as an elective but Czajkowski makes it easy to enjoy. Hilarious emails too!",12/17/2017,4.0,4.0,,4,N/A,4.0,4.0,1,No,1513513971000,Yes,1452,Yes,,N/A,"['Inspirational', 'Amazing lectures ', 'Lots of homework']",people,people
Mandatory,average,good,average,0,29236989,0,,average,3,PHY1331,"Sends the most hilarious emails, if you don't get his sarcasm you will hate him, accent is thick but still easy to understand. Attending the lectures is a must, content isn't posted online. Doing an assignment every week is annoying but easily brings up your grade. Midterms and exams were fair to what we saw in class, posts old tests and breakdown.",12/16/2017,4.0,4.0,,3,N/A,3.0,3.0,1,No,1513445116000,Yes,1452,Yes,,C,"['Lots of homework', 'Lecture heavy']",people,people
Mandatory,average,good,average,0,29226804,0,,average,3,PHY1331B,"Not the best teacher. He goes over a lot of the assignments in class and makes it VERY difficult to fail. I failed a midterm and the final and still managed to pass with over a 60. Also, DO THE EXTRA CREDIT, It can take pretty close to 10% off the final exam. Very difficult class if you didn't take high school physics. GO TO CLASS, it's worth it",12/15/2017,4.0,4.0,,3,N/A,3.0,3.0,1,Yes,1513370217000,Yes,1452,Yes,,B+,['EXTRA CREDIT'],people,people
Not Mandatory,good,average,good,0,29072001,6,,awesome,5,PHY1321,"Reviewers say Czajkowski is rude, but that's because no one understand sarcasm these days. I found him to be very nice/genuine outside of lectures (office hours), where you can talk to him 1 on 1. Many complain about how heavy the course is, but assignments are optional (bonus points). 1331 kids are also salty since they didn't take HS physics.",12/06/2017,3.0,3.0,,5,N/A,5.0,5.0,1,No,1512595002000,Yes,1452,Yes,,A+,"['Hilarious', 'Amazing lectures ', 'EXTRA CREDIT']",people,people
Not Mandatory,good,good,good,0,29031355,0,,awesome,5,PHY1321,"There are assignments every week, which although is a lot, only 240 of 310 possible points actually counts which leaves out 2-3 assignments. You only lose BONUS marks from him if you ask questions from a lecture 2 weeks ago. There are many practice quizzes at the DGDs to help you. He's a great prof and wants to help, but it's a difficult course.",12/04/2017,4.0,4.0,,5,N/A,5.0,5.0,1,No,1512386663000,Yes,1452,Yes,,A,[],people,people
N/A,average,good,average,6,28909659,5,,poor,2,PHY1331,"He has a huge ego, he likes to single out students in class and embarrass them for answering questions wrong and thinks he is a lot better of a teacher than he actually is. He also takes away marks if you ever email him or go to his office hours; he really doesn't like to help students. Gives lots of homework and just rude in general.",11/15/2017,4.0,4.0,,2,N/A,2.0,2.0,1,Yes,1510778212000,No,1452,Yes,,N/A,['Lots of homework'],people,people
Mandatory,poor,good,poor,2,28892773,3,,awful,1,PHY1321,"This class will take over your life. The prof is extremely egotistical and thinks he is the best thing since sliced bread - he isn't. No written feedback until the midterms/exams. If this course is a requirement for you, I'd recommend trying to get another prof. Or get well acquainted with Khan Academy and be prepared to self teach!",11/14/2017,4.0,4.0,,1,N/A,1.0,1.0,1,Yes,1510660275000,No,1452,Yes,,N/A,"['Lots of homework', 'Lecture heavy']",people,people
Not Mandatory,average,good,average,7,28734408,7,,poor,2,PHY1321,"Just a Jerk. He expects you to pick up the material immediately, and is shocked if you don't get it like he does. Says some funny things in class but that's about it. Otherwise he's a hard professor not looking to help you.",10/11/2017,4.0,4.0,,2,N/A,2.0,2.0,1,Yes,1507740874000,No,1452,Yes,,N/A,"['Lecture heavy', 'Lots of homework']",people,people
Mandatory,average,average,average,5,28661311,6,,poor,2,PHY1331,"He is rude. When you talk to him, he turns your back towards you and starts talking to somebody else. On the final exam, he changed the order of the questions but forgot to change the order of the answers. In addition, the scanner missed some answers. We were shocked when we received the results but he would not believe us that something went wrong",09/06/2017,3.0,3.0,,2,N/A,2.0,2.0,1,Yes,1504717512000,No,1452,Yes,,A+,[],people,people
N/A,good,average,good,3,28454567,3,,awesome,5,PHY1322,"Favourite first year prof, genuinely cares about students.  With pre-lecture quizzes, assignments, etc., he gives you more than enough of a chance to bump up your grade. His midterms/exams are very reasonable. DO THE ASSIGNMENTS and GO TO CLASS: oftentimes midterm questions will be taken straight from assignments and in-class questions.",06/14/2017,2.0,2.0,,5,N/A,5.0,5.0,1,No,1497475340000,Yes,1452,Yes,,A+,"['Hilarious', 'EXTRA CREDIT', 'Respected']",people,people
Not Mandatory,average,average,average,2,28349617,0,,average,3,PHY1331,"As a student who never took physics in her life, taking this class wasn't easy, but Czajkowski also makes this class hard to fail. I failed both the final and one midterm with 43%, and passed the class with a 69%. He gives a lot of bonus marks so you can pass even without being the greatest. The workload is a little heavy though!",05/19/2017,3.0,3.0,,3,N/A,3.0,3.0,1,No,1495211854000,No,1452,Yes,,C,"['Hilarious', 'Lots of homework']",people,people
Mandatory,average,average,average,2,28148001,2,,poor,2,PHY1322,"Hated this class and regretted taking it as an elective. Way too much work for really nothing in the end. Do not take this class if you do not have to. Isn't really a prereq for most Canadian professional schools, so don't be misled by others into taking it like I was.",04/27/2017,3.0,3.0,,2,N/A,2.0,2.0,1,No,1493324354000,No,1452,Yes,,N/A,['Lots of homework'],people,people
Mandatory,poor,good,poor,1,28109858,3,,awful,1,PHY1322,"Condescending, does not reply to emails, not helpful",04/24/2017,4.0,4.0,,1,N/A,1.0,1.0,1,No,1493008964000,No,1452,Yes,,N/A,[],people,person
Mandatory,average,average,average,1,27925705,0,,average,3,PHY1322,"Czajkowski is a decent lecturer. If you do not immediately grasp the subject beware as he will criticize you for that. He is very opinionated and will say things that you may not necessarily agree with. Tests and exam are a real piece of cake (study the assignments, past tests, DGD problems, and end-of-lecture questions). He is also very funny.",03/20/2017,3.0,3.0,,3,N/A,3.0,3.0,1,Yes,1490045394000,No,1452,Yes,,A+,"['EXTRA CREDIT', 'Lecture heavy']",people,person
Mandatory,good,average,good,1,27733662,1,,good,4,PHY1331,"Czajkowski is easily the funniest prof/teacher I've ever had.  I find physics boring, but his humour made it bearable.  It is very hard to fail this course even if you fail the midterms and exams because of the assignments, quizzes, and bonus marks he gives out.  If you're in 1331 get ready to work a lot at the start of the semester.",01/15/2017,3.0,3.0,,4,N/A,4.0,4.0,1,No,1484488910000,Yes,1452,Yes,,N/A,"['Hilarious', 'Lots of homework']",person,person
Mandatory,good,average,good,1,27732332,1,,good,4,PHY1331,"Czajkowski truly is THE MAN he was by far the funniest prof I had that semester. He cares about the students and is always accessible for extra help. It's basically impossible to fail the class, he gives lots of extra credit work and if you're in 1331 you basically get an extra 5% taken off the exam. He makes an unbearable subject a little better!",01/14/2017,3.0,3.0,,4,N/A,4.0,4.0,1,No,1484432813000,Yes,1452,Yes,,B+,"['Gives good feedback', 'Hilarious', 'Caring']",person,person
Mandatory,good,average,good,2,27732068,3,,good,4,PHY1321,"The course itself is very challenging, and if you want an A+ you have to put in a little more effort. I got a 54% on the 1st MT, and 66% on the 2nd MT, and 77% on the final and still ended up with an A- cuz of the BONUSES AND LABS!!!! So in short DO NOT WASTE ANY BONUS MARKS - THEY HELP YOUR MARK SOO MUCH! plus get a 100% on labs - they are EASY!",01/14/2017,3.0,3.0,,4,N/A,4.0,4.0,1,No,1484426317000,Yes,1452,Yes,,A-,"['EXTRA CREDIT', 'Accessible outside class', 'Tough grader']",people,people
Not Mandatory,average,average,average,1,27707919,1,,average,3,PHY1321,"Dr. Czajkowski is a good lecturer and keeps you interested. However, the material he teaches does not sufficiently reflect the evaluated course material. He does provide a lot of opportunities for bonus marks which makes passing the class relatively easy but achieving a truly great mark is next to impossible when you have 4 other courses.",01/10/2017,3.0,3.0,,3,N/A,3.0,3.0,1,Yes,1484056233000,No,1452,Yes,,Not sure yet,"['Accessible outside class', 'Lots of homework', 'Get ready to read']",person,person
Mandatory,average,average,average,0,27704240,2,,average,3,PHY1321,"Not the best teacher, but he is hysterical! He provides a ton of ways to pick up bonus marks bc he knows the course isn't easy. Cares about his students, but could be a better teacher",01/09/2017,3.0,3.0,,3,N/A,3.0,3.0,1,No,1483999496000,No,1452,Yes,,B+,"['EXTRA CREDIT', 'Clear grading criteria']",people,people
Not Mandatory,average,good,average,2,27694128,4,,poor,2,PHY1331,"He really wants all his students to pass and gives out tons of bonus marks. Makes lectures funny, but expect lots of work outside of class. If you're a 1331 student (no 4U physics) and not a 1321 student, expect an extra 10-20 question test every week along with two quizzes & an assignment. Don't bother with textbook, he has you buy a course pack.",01/08/2017,4.0,4.0,,2,N/A,2.0,2.0,1,No,1483890605000,Yes,1452,Yes,,Not sure yet,"['EXTRA CREDIT', 'Caring', 'Lots of homework']",people,people
Not Mandatory,average,good,average,0,27558275,1,,average,3,PHY1321,"He makes it very easy to pass this course. The final was easy but his midterms are  more challenging. He's aware that he is teaching an unpopular subject, and takes that into account for the final grading. I did not find his teaching helpful unless I went over the material ahead of time. Expect at least 2 quizzes and an assignment every week.",12/18/2016,4.0,4.0,,3,N/A,3.0,3.0,1,Yes,1482091979000,Yes,1452,Yes,,N/A,"['Hilarious', 'Gives good feedback', 'Lots of homework']",person,people
Mandatory,average,good,average,1,27516113,1,,average,3,PHY1331,"Andrzej is a very caring prof and really tries to make the class interesting and fun by doing demos and cracking a few jokes (which is pretty important considering most people are not incredibly interested in the subject he teaches). He gives so many bonus marks that it is very hard to actually fail this class, but you still need to work for it!!",12/15/2016,4.0,4.0,,3,N/A,3.0,3.0,1,Yes,1481821119000,Yes,1452,Yes,,Not sure yet,"['EXTRA CREDIT', 'Lots of homework']",person,person
N/A,good,average,good,2,27477118,1,,awesome,5,PHY1321,"This guy definitely has one of the toughest courses to teach because there are very few people who actually enjoy physics, but I gotta say he made it so much better. Great sense of humour which really lightened up the mood for the class. Gave lots of hints for what to expect on midterms, and lots of extra credit given. Do attend class though..",12/13/2016,3.0,3.0,,5,N/A,5.0,5.0,1,Yes,1481661383000,Yes,1452,Yes,,A+,"['Lots of homework', 'Hilarious']",person,people
Mandatory,good,average,good,2,27418479,0,,awesome,5,PHY1321,"I like his class, especially his jokes, very good prof/ gives bounces, he gave all the class full mark in the pre-lecture quizzes / just do ur assignments and you'll pass",12/10/2016,2.0,2.0,,5,N/A,5.0,5.0,1,Yes,1481333270000,Yes,1452,Yes,,Not sure yet,"['Hilarious', 'Caring', 'Respected']",people,people
Mandatory,good,average,good,5,27389810,0,,good,4,PHY1331,I'm never not entertained by this man. He truly cares about his students and is very passionate about teaching and gets upset when students are apathetic to the course and the material. Most of his questions are recycled/can be found online and his content isn't that hard!,12/08/2016,2.0,2.0,,4,N/A,4.0,4.0,1,No,1481204664000,Yes,1452,Yes,,A+,"['EXTRA CREDIT', 'Lots of homework', 'Hilarious']",people,people
N/A,good,good,good,4,27371760,0,,good,4,PHY1321,"I think Dr Czajkowski is the saltiest human being on the planet. He's hilarious.  His strategy is to crush you by starting off with thermodynamics before building you back up with forces/kinematics. He is very generous with bonuses, and he gives a lot of information about what you can expect on tests. It would take real effort to fail this course.",12/07/2016,4.0,4.0,,4,N/A,4.0,4.0,1,Yes,1481125039000,Yes,1452,Yes,,B+,"['Hilarious', 'EXTRA CREDIT']",people,people
Not Mandatory,poor,poor,poor,3,27356044,4,,awful,1,PHY1321,"Lectures are almost intolerable. Any written work he does in lectures is horribly written. Should have someone proof read his documents, they are riddled with confusing spelling and grammar issues.",12/06/2016,1.0,1.0,,1,N/A,1.0,1.0,1,Yes,1481048286000,No,1452,Yes,,B,['Get ready to read'],people,people
Mandatory,good,good,good,0,27341923,1,,good,4,PHY1321,favorite professor this semester by far. Makes lectures interesting by adding in comical jokes. As long as you do all the assignments and pre-lecture quizzes you will pass its very hard not to.,12/05/2016,4.0,4.0,,4,N/A,4.0,4.0,1,Yes,1480970514000,Yes,1452,Yes,,N/A,"['Hilarious', 'Lots of homework']",person,people
N/A,good,average,good,13,26980704,4,,awesome,5,PHY1322,The Czajkowski man is THE MAN. He is a blessing to humanity from the heavens in the guise of a physics professor and the embodiment of perfection in a human form coupled with superior intellect along with ancient wisdom. God bless this messiah and prophet-like figure who also happens to be the achilles of our campus.,09/19/2016,3.0,3.0,,5,N/A,5.0,5.0,1,Yes,1474280052000,Yes,1452,Yes,,N/A,"['Amazing lectures ', 'Hilarious']",people,people
Not Mandatory,average,average,average,0,26949002,0,,poor,2,PHY1322,"Easy but very disorganized. Just do the assignments and past exams. He recycles most of the final exam questions, so if you do all the past finals, its an easy A+.",09/01/2016,2.0,2.0,,2,N/A,2.0,2.0,1,No,1472737233000,No,1452,Yes,,A+,"['EXTRA CREDIT', 'Hilarious', 'Lots of homework']",people,people
Not Mandatory,good,good,good,1,26933570,0,,awesome,5,PHY1321,"Great Prof, and extremely entertaining to listen to. Fair, but not easy. Understanding, and a cool and funny guy.  10/10, would recommend.",08/26/2016,4.0,4.0,,5,N/A,5.0,5.0,1,No,1472207177000,Yes,1452,Yes,,B+,"['Beware of pop quizzes', 'Get ready to read', 'Respected']",people,person
Not Mandatory,good,good,good,0,26812750,0,,awesome,5,PHY1321,"Great prof, very fun to listen to. The class is a lot of work but you can definitely a good grade if you work hard and go to the physics help hours at the Macdonald building",07/18/2016,4.0,4.0,,5,N/A,5.0,5.0,1,No,1468806188000,Yes,1452,Yes,,A,[],people,people
Not Mandatory,good,poor,good,1,26724764,0,,awesome,5,PHY1321,"Amazing class, plenty of ways to do good in his class. And he really cares about his students. He is a funny and interesting man on the whole.",06/14/2016,1.0,1.0,,5,N/A,5.0,5.0,1,Yes,1465915274000,Yes,1452,Yes,,N/A,"['Caring', 'Respected', 'Lots of homework']",people,person
Mandatory,average,good,average,0,26713275,1,,average,3,PHY1321,You can't fail this class. I just barely passed the midterms and failed the final and still passed. Trust me on this. Weekly assignments are annoying but most questions are googleable. Exams are similar to practice problems in terms of type but go to the DGDs and do all the practice given. Very entertaining prof just teaches an awful subject.,06/10/2016,4.0,4.0,,3,N/A,3.0,3.0,1,Yes,1465520290000,No,1452,Yes,,N/A,"['Lots of homework', 'Hilarious', 'Caring']",person,people
Not Mandatory,average,good,average,1,26623635,0,,average,3,PHY1322,"Lectures aren't crystal clear, so unless you are gifted at physics, it's a lot of work outside the lecture hall. Exams are mostly fair. Labs are easy, some TA's mark stupidly specific for no reason. Final exam is marked very fairly. He's a funny guy.",05/20/2016,4.0,4.0,,3,N/A,3.0,3.0,1,No,1463745082000,N/A,1452,Yes,,A+,"['Tough grader', 'Lots of homework', 'EXTRA CREDIT']",people,person
N/A,poor,average,poor,1,26572709,0,,awful,1,PHY1322,"He gives plenty of bonus marks- do his old tests! they are very close to the ones he gives. He is kind of arrogant and rude in person and in class, he doesn't help students much even online- and if he does, it's normally accompanied by a snarky comment of some sort. But all in all, it's not a bad course- and he can be funny",05/14/2016,3.0,3.0,,1,N/A,1.0,1.0,1,Yes,1463213263000,N/A,1452,Yes,,N/A,"['Tough grader', 'Participation matters']",people,person
N/A,average,average,average,0,26506686,0,,good,3,PHY1322,"He's a nice guy, gives a lot of bonus points and marks pretty fairly. However, he doesn't always explain things well, so you need to study and teach yourself for some parts. Midterms are straightforward, and the final is all MC. It's pretty easy to pass his class, but you really need to work hard to get an A.",05/08/2016,3.0,3.0,,4,N/A,3.5,3.5,1,Yes,1462740181000,N/A,1452,Yes,,N/A,"['EXTRA CREDIT', 'Hilarious', 'Respected']",people,people
Not Mandatory,average,average,good,1,26503261,0,,good,3,PHY1322,Dr. Czajkowski is THE MAN! He is the embodiment of superior intellect coupled with ancient wisdom.,05/08/2016,2.0,2.0,,5,N/A,4.0,4.0,1,Yes,1462704691000,N/A,1452,Yes,,N/A,"['Lots of homework', 'EXTRA CREDIT', 'Hilarious']",people,person
Not Mandatory,good,poor,good,2,26384869,0,,awesome,5,PHY1321,"Midterm Exams are straightforward: 7MC (but the grade is X/6) and 5 long answer (you pick 4 to get graded) Final: 33 MC but graded out of 30 (usually) Nice, funny prof, teaching style is a bit different, worked for some people (like me) but not for others.",04/26/2016,1.0,1.0,,5,N/A,5.0,5.0,1,No,1461692231000,Yes,1452,Yes,,A+,"['EXTRA CREDIT', 'Amazing lectures ']",people,people
N/A,good,poor,good,0,26299381,0,,awesome,5,PHY1322,i hadnt take phy1321 and itd been a long time since physics so i was actually nervous and considered dropping the course at a point. but honestly its not hard and the prof is the best part about it he has such a great personality like ive never seen some1 honestly do so much for our service to help us do well and make us happy 3,04/14/2016,1.0,1.0,,5,N/A,5.0,5.0,1,Yes,1460653814000,N/A,1452,Yes,,Not sure yet,"['Respected', 'Caring', 'Hilarious']",people,people
Mandatory,good,poor,good,0,26235723,4,,awesome,5,PHY1124,He's a man and a professor.,04/05/2016,1.0,1.0,,5,N/A,5.0,5.0,1,Yes,1459875833000,N/A,1452,Yes,,A+,[],people,people
Mandatory,average,good,average,4,26159925,1,,average,2,PHY1322,"You've really got to foster your own understanding to succeed in this guy's class. Good at delivering baseline knowledge, but is never good enough as a lecturer to actually convey understanding; he's better at this when working one-on-one. Seems to have an inflated expectation of what his students should be able to do, but at least he's funny.",03/19/2016,4.0,4.0,,4,Sorta interested,3.0,3.0,1,No,1458387138000,N/A,1452,Yes,,Not sure yet,"['Lots of homework', 'EXTRA CREDIT', 'Respected']",person,people
Mandatory,average,good,average,2,25944114,0,,good,3,PHY1321,"He is a really funny prof and makes the lectures interesting. His midterms are tough, so make sure to review very well for them. The final was all multiple choice, and he makes it so that it's very easy to pass, but you'll still have to work hard for an A. He gives lots of bonus marks, and even held study sessions for the class.",01/14/2016,4.0,4.0,,4,Sorta interested,3.5,3.5,1,No,1452807206000,N/A,1452,Yes,,A+,"['EXTRA CREDIT', 'Hilarious']",people,people
Mandatory,poor,good,average,1,25943198,2,,average,1,PHY1321,"He was a funny person but not the best professor. He spent a lot of time deriving equations and talking about theory (that time could have been spent doing problems). You really need to practice. I got a 60 on the two midterms (I took physics in hs), but I did everything that he asked with the bonus and ended up with an A. There's hope for everyone",01/14/2016,5.0,5.0,,4,Low,2.5,2.5,1,Yes,1452798843000,N/A,1452,Yes,,A,"['EXTRA CREDIT', 'Tough grader', 'Lots of homework']",people,person
N/A,average,good,average,2,25892376,0,,poor,2,PHY1321,"Mixed feelings- great guy, not such a good lecturer. Tests were 'easy', but since we never did any easy questions in class, they were hard tests. Taught it flipped, caused a lot of class to completely flunk first midterm. He set up extra help session after that. Take someone else if possible. Extra credit is wise- do every little thing.",01/06/2016,4.0,4.0,,2,Meh,2.0,2.0,1,Yes,1452118991000,N/A,1452,Yes,,C,"['EXTRA CREDIT', 'Tough grader', 'Hilarious']",people,people
Not Mandatory,good,average,good,2,25878744,0,,awesome,5,PHY1331B,"He is an AMAZING prof. His lectures are always entertaining and he provides great examples. In lecture, he often asks the students if they have questions from the textbook that they want him to solve. His package of notes is very helpful. He does everything he can to help with review notes, final exam notes and extra help sessions",01/05/2016,3.0,3.0,,4,Really into it,4.5,4.5,1,No,1451994796000,Yes,1452,Yes,,A-,['Amazing lectures '],people,people
Mandatory,average,average,average,0,25844598,0,,average,3,PHY1331B,"Dr. Czajkowski is very helpful and tries to convey the material as clearly as possible. He is funny and tries his best to make his lectures engaging. If you want to pass do and UNDERSTAND the assignments. Also, do the practise midterms and finals and the suggested problems. Can be a little rude sometimes, but overall nice guy.",12/29/2015,3.0,3.0,,3,Sorta interested,3.0,3.0,1,No,1451405867000,N/A,1452,Yes,,A-,"['Hilarious', 'EXTRA CREDIT', 'Lots of homework']",people,people
Not Mandatory,average,average,average,3,25783717,0,,poor,2,PHY1331,"He is really funny and makes some ridiculous jokes in class, which is entertaining! However, as a teacher he isn't the best. The material is taught really quickly so it's easy to fall behind. God bless those extra credits though, they saved my life... including the lab component :')",12/20/2015,3.0,3.0,,2,Low,2.0,2.0,1,Yes,1450640503000,N/A,1452,Yes,,B+,"['Hilarious', 'Tough grader', 'EXTRA CREDIT']",people,people
Mandatory,average,average,average,1,25763027,4,,good,2,PHY1331,"Makes you work incredibly hard but in the end, you learn so much from the course (especially for 1331 students) that everything is worth it! The man's also a riot in class, albeit slightly offensive. Concentrate on doing problems first and the concepts will become clear afterwards. Old exams are key, then DGD problems and then suggested problems.",12/18/2015,3.0,3.0,,5,It's my life,3.5,3.5,1,Yes,1450455334000,N/A,1452,Yes,,A+,"['EXTRA CREDIT', 'Hilarious']",people,person
Mandatory,average,average,average,1,25734873,0,,good,3,PHY1332,"Professor Czajkowski puts in his greatest effort to help his students succeed. If you are aiming to pass that should not be a problem , planning on getting an A you will need to put in the time. The material is tough but he makes the class very entertaining and tries his best to explain to the class. Wouldn't mind having a beer with him.",12/16/2015,3.0,3.0,,4,Sorta interested,3.5,3.5,1,No,1450305345000,N/A,1452,Yes,,A,"['Hilarious', 'Respected', 'EXTRA CREDIT']",people,person
Mandatory,good,poor,good,0,25711895,0,,good,4,PHY1321,"A very solid prof. The course is first year physics so it is kinda impossible to make it fun unless you really like physics. AC does have his funny moments though and probably made the most jokes out of any of my profs. He gives students MANY opportunities to succeed, and doing well in this class should be a breeze for anyone willing to try.",12/15/2015,1.0,1.0,,4,Really into it,4.0,4.0,1,Yes,1450209148000,N/A,1452,Yes,,A+,"['EXTRA CREDIT', 'Lots of homework']",people,people
