attendance,clarityColor,easyColor,helpColor,helpCount,id,notHelpCount,onlineClass,quality,rClarity,rClass,rComments,rDate,rEasy,rEasyString,rErrorMsg,rHelpful,rInterest,rOverall,rOverallString,rStatus,rTextBookUse,rTimestamp,rWouldTakeAgain,sId,takenForCredit,teacher,teacherGrade,teacherRatingTags,unUsefulGrouping,usefulGrouping
Not Mandatory,average,good,average,0,35908808,0,online,poor,2,CMN4132,He rants for too long off topic. He words his questions in confusing ways and I has way too many readings. He’s one of those profs that acts like he’s the only class you have. ,03/06/2022,5.0,5.0,,2,N/A,2.0,2.0,1,N/A,1646590828000,N/A,0,Yes,,A-,"['Test heavy', 'Get ready to read', 'So many papers']",people,people
Not Mandatory,good,poor,good,0,35792502,0,online,good,4,CMN3144,Super boring lectures but super easy class. He seems like a super caring guy who tries to make lectures more interesting with humour but the subject is so dry. One of the easiest classes I've ever taken.,01/25/2022,1.0,1.0,,4,N/A,4.0,4.0,1,No,1643071425000,Yes,1452,Yes,,A+,"['Hilarious', 'Caring']",people,people
Not Mandatory,average,average,average,0,35734815,0,online,average,3,CMN3144,"lectures are so boring and often have so much unnecessary information that will not be used on tests and assignments. super easy marker and really caring about his students success, just really hard to pay attention and want to attend class because of the lectures.",01/11/2022,2.0,2.0,,3,N/A,3.0,3.0,1,No,1641909087000,Yes,1452,Yes,,A+,['Group projects'],people,people
Not Mandatory,good,good,good,0,35716633,0,online,awesome,5,CMN3144,"He genuinely care for his students, and tries to make the lectures fun. I found the course interesting and as long as you pay attention it is a really easy A.",01/07/2022,4.0,4.0,,5,N/A,5.0,5.0,1,No,1641586305000,Yes,1452,Yes,,A+,"['Caring', 'Amazing lectures ', 'Hilarious']",people,people
Not Mandatory,average,poor,average,0,35619234,0,online,poor,2,CMN3144,"I didn't go to a single full lecture because they were so boring and he ranted about useless things half the time. The quizzes are open book. The directives for the assignments are very unclear but he is an easy marker so it didn't really matter that much. Overall a really weird guy, but easy A",12/21/2021,1.0,1.0,,2,N/A,2.0,2.0,1,No,1640101089000,No,1452,Yes,,A+,['Get ready to read'],people,people
N/A,good,average,good,0,34532633,0,online,awesome,5,CMN4132,"Professor Benoit is so great! His assignments are fair, exams are easy to prepare for, feedback is always super useful, and he/his classes are funny. He is always willing to help you with the assignments and provides practice quizzes to prepare you for the exams. He also provides toolbox resources that are quite interesting. Highly recommend LB!",04/11/2021,2.0,2.0,,5,N/A,5.0,5.0,1,No,1618154070000,Yes,1452,Yes,,N/A,"['Hilarious', 'Caring', 'Gives good feedback']",people,people
Mandatory,average,poor,average,0,34232549,0,,poor,2,CMN4144,"Overall an easier grader and exams are straightforward. However lectures are boring and often all over the place, and somehow always end up just being him bragging about his accomplishments. Beware, problems that he or you have will be blamed on everyone but himself, so be careful about bringing up grading or technical issues.",01/04/2021,1.0,1.0,,2,N/A,2.0,2.0,1,No,1609770360000,No,1452,Yes,,A,"['Lecture heavy', 'Group projects', 'Participation matters']",people,people
Mandatory,good,poor,good,0,34056283,0,,awesome,5,CMN4132,I loved this teacher he was so caring! he loves his students and it shows through the class which is nice. He is also hilarious and tells funny and interesting stories.,12/13/2020,1.0,1.0,,5,N/A,5.0,5.0,1,No,1607891775000,Yes,1452,Yes,,A+,"['Participation matters', 'Gives good feedback', 'Hilarious']",people,people
Mandatory,good,average,good,0,33885397,0,,awesome,5,CMN4132,Learned a lot in his classes. Great teacher. Very kind. Relates course content to real life experiences.,11/25/2020,3.0,3.0,,5,N/A,5.0,5.0,1,No,1606264660000,Yes,1452,Yes,,N/A,"['Clear grading criteria', 'Amazing lectures ']",people,people
Mandatory,good,poor,good,1,33721310,0,online,awesome,5,CMN4132,This prof is amazing! He is so funny and so caring with students. He makes sure everyone understands and is always available to answer questions! He makes practice quizzes to get familiar with the material and prepare for the exam which I loved! His class is practical and you actually learn real life scenarios to help in the future!,10/21/2020,1.0,1.0,,5,N/A,5.0,5.0,1,No,1603304110000,Yes,1452,Yes,,N/A,"['Amazing lectures ', 'Respected', 'Gives good feedback']",people,person
Mandatory,poor,average,poor,0,33645818,0,,awful,1,CMN4132,"One of the most hostile profs I've ever had in my 4.5 years of university. I skipped 1 class &amp; let him know IN ADVANCE, IN PERSON, and he started acting very hostile towards me, including YELLING at me. He also made uncomfortable comments on the #metoo movement and on how the international students might have problems with presentations. THE WORST.",09/15/2020,3.0,3.0,,1,N/A,1.0,1.0,3,No,1600191595000,No,1452,Yes,,N/A,[],people,people
N/A,good,average,good,0,33458926,0,online,good,4,CMN4132,"Professor Benoit's expectations are very clear! He also presented insightful personal stories to relate to the course which shows how passionate he is about crisis communication. Although online learning has been a challenge, he was very understanding of the situation and tried his best to engage students in discussions!",06/24/2020,2.0,2.0,,4,N/A,4.0,4.0,1,No,1592961634000,Yes,1452,Yes,,A-,"['Gives good feedback', 'Amazing lectures ', 'Caring']",people,people
Not Mandatory,good,average,good,0,33443548,0,online,awesome,5,CMN4132,"All exams and assignments closely reflect powerpoint and readings. If you need help and send him an email, expect a speedy reply with a precise answer. He relates course content to real world experiences. You can tell he really loves crisis communication and enjoys teaching it. Very kind prof who wants his students to do well.",06/17/2020,2.0,2.0,,5,N/A,5.0,5.0,1,No,1592424921000,Yes,1452,Yes,,A,"['Gives good feedback', 'Caring', 'Accessible outside class']",people,people
Not Mandatory,average,good,average,0,32001587,0,,poor,2,CMN4132,"Thinks he is hilarious and loves the sound of his own voice. You will be scrambling to understand the point of his run-on sentences. Final examtake home paper worth 50%, but he didn't teach us the hardest part. Loves to make an example of students and might bight your head off for legitimate question. Very condescending in 'roundtable' assignments",06/06/2019,4.0,4.0,,2,N/A,2.0,2.0,1,No,1559835030000,No,1452,Yes,,Not sure yet,"['Group projects', 'Lecture heavy']",people,people
Mandatory,poor,good,poor,0,31729802,0,,awful,1,CMN4144,Very belittling and doesnt seem to really care how you do in your class. If you dont give him exactly the answer hes looking for youre wrong,05/01/2019,4.0,4.0,,1,N/A,1.0,1.0,1,Yes,1556708066000,No,1452,Yes,,N/A,"['Tough grader', 'Participation matters']",people,people
Mandatory,good,good,good,0,31632383,0,,awesome,5,CMN3144,"Probably my favorite teacher ever so far. He works at an executive level, so you can tell he has no patience for immature students. If you spend his lectures browsing Facebook on your laptop, he WILL notice and will be very reluctant to help you after that. If you participate and put in the effort, you will absolutely pass. Loved his class.",04/19/2019,4.0,4.0,,5,N/A,5.0,5.0,1,No,1555715515000,Yes,1452,Yes,,A+,"['Participation matters', 'Clear grading criteria', 'Amazing lectures ']",people,people
Mandatory,average,good,average,1,31487266,1,,poor,2,CMN3144,"Difficult to learn in his class, because: his PPT have no guidelines, he talks about his personal life, does'nt answer questions, if he answers your questions good luck to understand his answer. Pretty intimidating (always had trouble to look him in the eyes). If he likes you, he will help you. NOT good at teaching at all !",03/27/2019,4.0,4.0,,2,N/A,2.0,2.0,1,Yes,1553703248000,No,1452,Yes,,B+,"['Tough grader', 'Beware of pop quizzes']",person,person
Mandatory,average,good,average,1,31487170,0,,poor,2,CMN3144,"Here's the thing, if you are a good student (from his perspective) he will be an excellent teacher to you, if he spots you as a careless and untalented student he might not only ignore you, but also give you the push you need to drop the class. Sometimes unethical.. his teaching skills could be improved but I have to say I learned a lot with him.",03/27/2019,4.0,4.0,,2,N/A,2.0,2.0,1,Yes,1553702305000,No,1452,No,,A-,['Beware of pop quizzes'],people,person
Mandatory,poor,average,poor,0,31377032,0,,awful,1,CMN4132,Just rambles about personal stories and yells at you for not understanding questions he asks that he doesn't teach. Avoid him.,02/24/2019,3.0,3.0,,1,N/A,1.0,1.0,1,Yes,1550987893000,No,1452,Yes,,N/A,"['Test heavy', 'Lots of homework']",people,people
Mandatory,poor,good,poor,4,30863568,0,,awful,1,CMN4144,"had the worst experience taking his comms class, he was very rude and unwilling to help his students succeed.",12/04/2018,5.0,5.0,,1,N/A,1.0,1.0,1,No,1543943658000,No,1452,Yes,,B,['Tough grader'],people,people
Mandatory,poor,average,poor,4,30863473,0,,awful,1,CMN4144,possibly the rudest professor i've ever had. makes very inappropriate comments and is generally condescending :/,12/04/2018,3.0,3.0,,1,N/A,1.0,1.0,1,No,1543943254000,No,1452,Yes,,B,[],people,people
N/A,good,average,good,6,29169547,1,,awesome,5,CMN4132,One of the few classes I've taken where I felt I'm actually able to relate and apply the material to the real world. Highly recommend his crisis communications class. He wants to make sure you succeed and helps guides students.,12/13/2017,3.0,3.0,,5,N/A,5.0,5.0,1,Yes,1513132996000,Yes,1452,Yes,,Not sure yet,"['Caring', 'Respected', 'Gives good feedback']",person,people
N/A,average,good,average,2,27978605,0,,average,3,CMN3574,"He's a good prof... he knows what he's talking about and really cares for his students. He can be a little intimidating at times however, and midterms aren't the easiest. All in all, don't expect an easy A in this class.",04/01/2017,4.0,4.0,,3,N/A,3.0,3.0,1,Yes,1491046816000,No,1452,N/A,,N/A,"['Group projects', 'Test heavy', 'Respected']",people,people
Not Mandatory,good,average,good,1,25943292,2,,awesome,5,CMN4132,"He is an amazing professor! He knows his stuff and always makes lectures interesting and fun! He's hilarious, and genuinely cares about his students and wants them to succeed. HIGHLY RECOMMENDED!",01/14/2016,3.0,3.0,,5,It's my life,5.0,5.0,1,Yes,1452799950000,N/A,1452,Yes,,N/A,"['Respected', 'Hilarious', 'Inspirational']",people,person
Not Mandatory,good,average,good,1,23966312,0,,good,4,CMN3144,This class was an elective after history of film was full. This is one of the best classes Ive taken. The professor is super passionate and the three hour lectures go like a breeze. The readings are important and you must read them to do well in the class. ,12/06/2014,3.0,3.0,,4,It's my life,4.0,4.0,1,Yes,1417825616000,N/A,1452,N/A,,N/A,"['Inspirational', 'Respected', 'Amazing lectures ']",people,person
N/A,good,average,good,1,23375674,0,,awesome,5,CMN4144,Great prof. Super passionate and keeps the lectures very interesting. Tons of case study analysis. Do the readings as he talks about them a lot in class and appreciates participation in the class discussions.,06/16/2014,3.0,3.0,,5,It's my life,5.0,5.0,1,Yes,1402920956000,N/A,1452,N/A,,N/A,[],people,person
Mandatory,average,average,average,0,22181140,0,,average,3,CMN3144,"This professor is very passionate. His lectures and power point slides are quite clear. Exams are fair. For those going into the PR field, I find this class gives insight as to what to expect in the public relations world.",10/15/2013,3.0,3.0,,3,It's my life,3.0,3.0,1,Yes,1381856391000,N/A,1452,N/A,,N/A,[],people,people
