attendance,clarityColor,easyColor,helpColor,helpCount,id,notHelpCount,onlineClass,quality,rClarity,rClass,rComments,rDate,rEasy,rEasyString,rErrorMsg,rHelpful,rInterest,rOverall,rOverallString,rStatus,rTextBookUse,rTimestamp,rWouldTakeAgain,sId,takenForCredit,teacher,teacherGrade,teacherRatingTags,unUsefulGrouping,usefulGrouping
Mandatory,good,good,good,0,36276543,0,,awesome,5,ARB1912,"If you want an A+, you definitely have to work for it but you will be rewarded nicely if you do the work. Also, PARTICIPATION is a key component of the course, it's not a slacker course. The prof is very nice, respectful, caring, and always willing to give extension to submit the homework and assignments if you ask for it.",05/08/2022,4.0,4.0,,5,N/A,5.0,5.0,0,Yes,1651978209000,Yes,0,Yes,,A+,"['Accessible outside class', 'Participation matters', 'Caring']",people,people
Mandatory,good,good,good,0,35839151,0,online,good,4,ARB1912,"This class made me grow white hair from the anxiety it gave me, but the prof is really nice. He is caring and corrects mistakes very gently. I recommend this class if you're not an anxious person like me, since participation is a key component of this class.",02/09/2022,4.0,4.0,,4,N/A,4.0,4.0,1,No,1644365190000,Yes,1452,Yes,,N/A,"['Get ready to read', 'Participation matters', 'Respected']",people,people
Mandatory,good,average,good,0,35658732,0,online,good,4,ARB1911,"This course requires some effort, but the prof explains the material very well and answers questions in a very clear manner",12/27/2021,2.0,2.0,,4,N/A,4.0,4.0,1,Yes,1640567572000,Yes,1452,Yes,,A+,"['Accessible outside class', 'Respected', 'Caring']",people,people
Mandatory,good,poor,good,0,35205259,0,,good,4,ARB1911,Easy course even if you're not familiar with Arabic. It requires some practice; class notes and activities provide enough practice. It could be very boring and useless if you're familiar with the language. The prof is very easy to talk to and is very understanding and very flexible. Highly recommended : ),11/08/2021,1.0,1.0,,4,N/A,4.0,4.0,1,Yes,1636389975000,Yes,1452,Yes,,A+,[],people,people
Mandatory,good,average,good,0,34180508,0,,good,4,ESP1991,"If you show up to TLBs, oral will be easy. Easily accessible during office hours. Definitely recommended : )",12/23/2020,3.0,3.0,,4,N/A,4.0,4.0,1,No,1608683690000,Yes,1452,Yes,,A,"['Accessible outside class', 'Caring']",people,people
Not Mandatory,good,poor,good,0,34112506,0,online,good,4,ESP1991,Very patient and correct grammar errors perfectly. Highly recommended,12/17/2020,1.0,1.0,,4,N/A,4.0,4.0,1,No,1608171269000,Yes,1452,Yes,,A,"['Clear grading criteria', 'Caring', 'Accessible outside class']",people,people
