attendance,clarityColor,easyColor,helpColor,helpCount,id,notHelpCount,onlineClass,quality,rClarity,rClass,rComments,rDate,rEasy,rEasyString,rErrorMsg,rHelpful,rInterest,rOverall,rOverallString,rStatus,rTextBookUse,rTimestamp,rWouldTakeAgain,sId,takenForCredit,teacher,teacherGrade,teacherRatingTags,unUsefulGrouping,usefulGrouping
N/A,good,poor,good,0,21041088,0,,awesome,5,CHILDLIT,"Very easy marker, very clear! No exam, midterm was a breeze. Works read were also very interesting and expanded my skills in interpretive reading. Very nice man, and I hope to take another class with him!",12/12/2012,1.0,1.0,,5,It's my life,5.0,5.0,1,Yes,1355330307000,N/A,1452,N/A,,N/A,[],people,people
N/A,good,good,good,0,20967675,0,,awesome,5,ENGD,He is an amazing prof! He was interactive with us and he didn`t just stand up there and drone on. There was a lot of activities to do in class that really enhanced learning. He was readily available for communication either after class or via e-mail. Best prof  ever!,12/06/2012,4.0,4.0,,5,It's my life,5.0,5.0,1,Yes,1354782830000,N/A,1452,N/A,,N/A,[],people,people
N/A,good,good,good,0,19040968,0,,awesome,5,ENG1100,Very helpful. He really wants you to learn something.,10/03/2011,4.0,4.0,,5,Sorta interested,5.0,5.0,1,Yes,1317670859000,N/A,1452,N/A,,N/A,[],people,people
N/A,good,good,average,0,17428132,0,,average,4,ENG1101,"As long students follow the guidelines there shouldn't be too much of a problem.  Yes, he is strict, but...that may be expected.",07/17/2010,4.0,4.0,,2,Sorta interested,3.0,3.0,1,Yes,1279392388000,N/A,1452,N/A,,N/A,[],people,people
N/A,good,good,good,0,17418129,0,,good,4,ENG1100,"He's a tough one, but fair. My writing has improved a lot since I took his class. Recommend him - but you need to be willing to work hard.",07/14/2010,5.0,5.0,,4,Sorta interested,4.0,4.0,1,Yes,1279104868000,N/A,1452,N/A,,N/A,[],people,people
N/A,good,average,good,1,17380682,0,,good,4,ENG1101,"Prof split class into two parts, half lecture and half workshop which made the time go by much faster - and kept things interesting. Fair marker. Willing to help and answer all questions.",06/30/2010,3.0,3.0,,4,Sorta interested,4.0,4.0,1,Yes,1277911259000,N/A,1452,N/A,,N/A,[],people,person
N/A,good,good,good,0,16258216,0,,good,4,ENG1101,"Easy to understand, fair marker. Lets the class out early sometimes.",10/21/2009,4.0,4.0,,4,Sorta interested,4.0,4.0,1,No,1256127573000,N/A,1452,N/A,,N/A,[],people,people
