attendance,clarityColor,easyColor,helpColor,helpCount,id,notHelpCount,onlineClass,quality,rClarity,rClass,rComments,rDate,rEasy,rEasyString,rErrorMsg,rHelpful,rInterest,rOverall,rOverallString,rStatus,rTextBookUse,rTimestamp,rWouldTakeAgain,sId,takenForCredit,teacher,teacherGrade,teacherRatingTags,unUsefulGrouping,usefulGroupingN/A,good,good,good,0,31778277,0,,awesome,5,MAT1371,Take with her. Intensive class. No anecdotes and no ramblings. She is professional. I like her.,05/06/2019,4.0,4.0,,5,N/A,5.0,5.0,1,Yes,1557102298000,Yes,1452,Yes,,A+,"['Clear grading criteria', 'Gives good feedback', 'Lecture heavy']",people,people
N/A,good,average,good,1,31772296,0,,awesome,5,MAT3378,Dr. Kelly makes like a &quot;lady&quot;. She is courteous and decent. Serious and hard worker in the class. Wish the best for her.,05/05/2019,3.0,3.0,,5,N/A,5.0,5.0,1,Yes,1557022030000,Yes,1452,Yes,,B+,"['Lecture heavy', 'Gives good feedback']",people,person
Mandatory,good,average,good,1,31671790,0,,awesome,5,MAT1371,Humble and self-confident woman.,04/25/2019,2.0,2.0,,5,N/A,5.0,5.0,1,Yes,1556166954000,Yes,1452,Yes,,A-,"['Gives good feedback', 'Lecture heavy']",people,person
Mandatory,good,average,good,0,31649390,0,,awesome,5,MAT1371,Nice French professor. She never creeped students.,04/23/2019,2.0,2.0,,5,N/A,5.0,5.0,1,Yes,1555995486000,Yes,1452,Yes,,A,['Clear grading criteria'],people,people
Not Mandatory,good,average,good,1,26040793,2,,awesome,4,MAT3378,She's very knowledgeable and very kind,02/09/2016,3.0,3.0,,5,Sorta interested,4.5,4.5,1,Yes,1455012027000,N/A,1452,Yes,,B+,"['Gives good feedback', 'Clear grading criteria', 'Lots of homework']",people,person
Not Mandatory,good,poor,good,1,24222277,1,,awesome,5,MAT1371,"I switched from physics into geography, so stats was a little easier for me than the calculus i was used to, so you can ignore my ""easiness"" rating if you struggle with math. She allowed 1 cheatsheet front and back for the midterm, and 2 for the final which helped everyone I would think, and she was always available to talk to.",01/03/2015,1.0,1.0,,4,Sorta interested,4.5,4.5,1,No,1420316021000,N/A,1452,Yes,,B,"['Gives good feedback', 'Clear grading criteria', 'Lots of homework']",person,person
N/A,good,average,good,1,23661981,1,,awesome,4,MAT1371,"Kelly is an amazing teacher. Very approachable, clear and available for extra assistance (I see her every week for assignment clarification and reconfirmation of learning). Assignments are due every week. No tests asides the midterm and the final exam. Attendance is definitely required if you want to pass this course, but it is not mandatory.",10/16/2014,3.0,3.0,,5,Meh,4.5,4.5,1,Yes,1413465782000,N/A,1452,Yes,,N/A,"['Caring', 'Lots of homework']",person,person
Not Mandatory,good,average,good,1,23100566,3,,good,4,MAT3378,"The best stats prof I've had so far! She's super organized and explains everything very well. Shows examples in class using SAS and explains every part of the code, which is provided to you. Provides great feedback on the assignments. She's awesome.",04/25/2014,3.0,3.0,,4,Really into it,4.0,4.0,1,Yes,1398436310000,N/A,1452,N/A,,N/A,[],people,person
Not Mandatory,good,average,good,1,23015917,3,,good,4,MAT3378,She's very knowledgable. She is also very kind. The material is boring though. Overall a good prof.,04/09/2014,3.0,3.0,,4,Sorta interested,4.0,4.0,1,Yes,1397081493000,N/A,1452,N/A,,N/A,[],people,person
