attendance,clarityColor,easyColor,helpColor,helpCount,id,notHelpCount,onlineClass,quality,rClarity,rClass,rComments,rDate,rEasy,rEasyString,rErrorMsg,rHelpful,rInterest,rOverall,rOverallString,rStatus,rTextBookUse,rTimestamp,rWouldTakeAgain,sId,takenForCredit,teacher,teacherGrade,teacherRatingTags,unUsefulGrouping,usefulGrouping
Not Mandatory,poor,average,poor,0,33712981,0,online,awful,1,CHG8300,"Due to the pandemic, this class was offered online and I haven't learned a thing. This professor gives absolutely no guidance on projects, then complains when it wasn't &quot;what she had in mind&quot;. Also she explains nothing in class apart from reading the slides. I didn't take this class to teach myself. My advice? Avoid her.",10/19/2020,3.0,3.0,,1,N/A,1.0,1.0,1,No,1603123275000,No,1452,No,,B+,['Group projects'],people,people
Not Mandatory,average,good,average,0,30019422,0,,poor,2,CHG8191,"The midterm is disappointed. It examined many things that you will not notice. And the prof. sometimes seems like not sure about the answer of your questions. And the grade of presentation is low. Be careful to choose this class. There will be midterm, final, presentations, report, quiz in this lecture. And the professor has accent .",05/08/2018,4.0,4.0,,2,N/A,2.0,2.0,1,No,1525738467000,No,1452,No,,B,"['Tough grader', 'Beware of pop quizzes']",people,people
Mandatory,good,average,good,0,22156994,1,,awesome,5,CHG2714,"Dr. Baranova is a very good professor, she is clear and helpful. Her notes are all you need to know for the midterm. The final is more difficult, because you come in with a mentality of it going to be tough and panic. If you concentrate, you will do well. Only reason I got a B+, is because I forgot to do a whole number on the final.",10/04/2013,3.0,3.0,,5,Sorta interested,5.0,5.0,1,Yes,1380889988000,N/A,1452,N/A,,B+,[],person,people
Mandatory,average,average,average,0,22120720,0,,average,3,CHG3724,"Had her for heat tranfer and for thermodynamics. She's alright. Her printable notes are easy enough to follow and her examples are often useful, but her in class explanations are more often than not quite confusing. Midterm is usually easy, but final exam is much more difficult.",09/13/2013,3.0,3.0,,3,Really into it,3.0,3.0,1,Yes,1379094594000,N/A,1452,N/A,,A+,[],people,people
N/A,good,poor,good,0,18790524,0,,awesome,5,CHG3724,Simply amazing and Elegant!,07/05/2011,1.0,1.0,,5,It's my life,5.0,5.0,1,Yes,1309870904000,N/A,1452,N/A,,N/A,[],people,people
