attendance,clarityColor,easyColor,helpColor,helpCount,id,notHelpCount,onlineClass,quality,rClarity,rClass,rComments,rDate,rEasy,rEasyString,rErrorMsg,rHelpful,rInterest,rOverall,rOverallString,rStatus,rTextBookUse,rTimestamp,rWouldTakeAgain,sId,takenForCredit,teacher,teacherGrade,teacherRatingTags,unUsefulGrouping,usefulGrouping
Mandatory,average,poor,average,0,35779420,0,online,average,3,ECH2700,Asynchronous class. As long as you watch the lectures and videos given you will easily pass. Tests are easy and clear with the material learned.,01/20/2022,1.0,1.0,,3,N/A,3.0,3.0,1,No,1642718098000,Yes,1452,Yes,,A+,"['Clear grading criteria', 'Lecture heavy']",people,people
N/A,good,average,good,0,35657491,0,online,awesome,5,ECH2720,"Professor Clark-Kazak is brilliant. The class content for ECH2720 is not always the most interesting, but it's not all that bad either. Make sure to follow the criteria on the grading charts and you will have no issue getting an A+ in this class with average effort.",12/26/2021,2.0,2.0,,5,N/A,5.0,5.0,1,No,1640551351000,Yes,1452,No,,A+,"['Clear grading criteria', 'Accessible outside class', 'Gives good feedback']",people,people
Mandatory,good,average,good,0,35648999,0,online,awesome,5,ECH2720,"good teacher, had her for two semesters. very clear expectations for exams, papers based only on class material, quick to answer emails &amp; questions, weekly homework/small assignments for students to keep up with the material. very kind &amp; patient as well, good visual support. 100% best teacher",12/24/2021,2.0,2.0,,5,N/A,5.0,5.0,1,No,1640359642000,Yes,1452,Yes,,N/A,"['Accessible outside class', 'Gives good feedback', 'Lots of homework']",people,people
Mandatory,good,poor,good,0,32997233,0,,awesome,5,ECH4725,"Une des meilleures professeures en ECH. Il y a beaucoup de travail a effectuer, mais elle est tr&egrave;s claire dans ses attentes et est tr&egrave;s compr&eacute;hensive. Elle nous donne une grille d'&eacute;valuation d&eacute;taill&eacute;e ainsi que des commentaires pour chacun des travail. Nous &eacute;tions suppos&eacute;s particip&eacute; &agrave; une simulation, mais &ccedil;a a &eacute;t&eacute; annul&eacute;.",03/27/2020,1.0,1.0,,5,N/A,5.0,5.0,1,No,1585323818000,Yes,1452,Yes,,A+,"['Respected', 'Gives good feedback', 'Clear grading criteria']",people,people
Mandatory,average,good,average,0,32805101,0,,average,3,ECH2720,"She is a good prof, relly often there was misunderstanding between her and srudent. for her if one student understood, everyone else should of as well. She seems to be a quite busy prof and I felt like we were slowing her down in her day. She lost her patience few times but it has to be expected due to her really low tone of voice. Rate A",01/07/2020,4.0,4.0,,3,N/A,3.0,3.0,1,No,1578412428000,Yes,1452,Yes,,A-,"['Lots of homework', 'So many papers']",people,people
Mandatory,good,average,good,0,32798804,0,,awesome,5,ECH2700,La moiti&eacute; de la classe se faisait en ligne et il y avait tr&egrave;s peu de participation alors il pouvait &ecirc;tre plus difficile de participer d&eacute;pendamment de la participation de ton groupe. Cette enseignante &eacute;tait toujours disponible et compr&eacute;hensive tout au long de la session. Tr&egrave;s bonne enseignante.,01/06/2020,2.0,2.0,,5,N/A,5.0,5.0,1,No,1578320594000,Yes,1452,Yes,,A+,"['Accessible outside class', 'Clear grading criteria', 'Gives good feedback']",people,people
Mandatory,good,average,good,0,32798797,0,,awesome,5,ECH2720,"Bonne enseignante. Elle est toujours disponible &agrave; l'ext&eacute;rieur de la classe pour aider. Elle note bien et rapidement les examens. De plus, elle pr&eacute;pare bien ses &eacute;l&egrave;ves pour les projets et l'examen final &agrave; l'aide de petit quiz tout au long de la session. Je recommande.",01/06/2020,2.0,2.0,,5,N/A,5.0,5.0,1,No,1578320345000,Yes,1452,Yes,,A+,"['Gives good feedback', 'Participation matters', 'Accessible outside class']",people,people
Mandatory,good,good,good,0,32454759,0,,good,4,ECH2720,"She is specialized in research methodology and she knows her stuff. The semester revolves around one project so we get to apply what we see in class to reality, but get ready to work for your grade (but dont get scared shes really nice and comprehensive... Very human)",11/21/2019,4.0,4.0,,4,N/A,4.0,4.0,1,No,1574345807000,Yes,1452,Yes,,A,"['Participation matters', 'Get ready to read', 'Lots of homework']",people,people
Mandatory,good,average,good,0,32454729,0,,good,4,ECH2700,"The class is quiet straight to the point and half of it was online. To be honest you have to participate if you want a good grade and if you skip a class make sure to have someone for the extra notes. She gives a lecture, but if you want it to be interesting you have to talk. There is papers to read, but no book to buy. And the prof is awesome!!!",11/21/2019,3.0,3.0,,4,N/A,4.0,4.0,1,No,1574345350000,Yes,1452,Yes,,A-,"['Lots of homework', 'Gives good feedback', 'Clear grading criteria']",people,people
