attendance,clarityColor,easyColor,helpColor,helpCount,id,notHelpCount,onlineClass,quality,rClarity,rClass,rComments,rDate,rEasy,rEasyString,rErrorMsg,rHelpful,rInterest,rOverall,rOverallString,rStatus,rTextBookUse,rTimestamp,rWouldTakeAgain,sId,takenForCredit,teacher,teacherGrade,teacherRatingTags,unUsefulGrouping,usefulGrouping
Not Mandatory,poor,good,poor,0,36036093,0,,awful,1,PSY2505,"very monotone, keep saying EUH annoying. exams are hard and she ask stuff that she didn't say",04/07/2022,4.0,4.0,,1,N/A,1.0,1.0,1,Yes,1649318527000,N/A,0,Yes,,Not sure yet,['Tough grader'],people,people
Mandatory,poor,good,poor,0,32489674,0,,awful,1,PSY2574,"Horrible class, not good teacher, makes everything feel depressing",11/28/2019,5.0,5.0,,1,N/A,1.0,1.0,1,No,1574970331000,No,1452,Yes,,D,"['Tough grader', 'Get ready to read', 'Test heavy']",people,people
Mandatory,poor,good,poor,0,32486517,0,,awful,1,2574A,This professor is very boring. She keeps saying uh and her powerpoint are incomplete. Make sure to take notes and read the textbook. The exams are SUPER confusing.,11/27/2019,5.0,5.0,,1,N/A,1.0,1.0,1,Yes,1574878887000,No,1452,Yes,,N/A,"['Tough grader', 'Lecture heavy']",people,people
Not Mandatory,poor,good,poor,0,31448511,0,,awful,1,PSY2505,"Not stimulating, hard exams AND get ready to read if you want to pass.",03/18/2019,4.0,4.0,,1,N/A,1.0,1.0,1,Yes,1552936226000,No,1452,Yes,,N/A,"['Lots of homework', 'Get ready to read']",people,people
Not Mandatory,poor,good,poor,0,31448498,0,,awful,1,PSY2505,Les examens portent &agrave; confusion.,03/18/2019,4.0,4.0,,1,N/A,1.0,1.0,1,Yes,1552936043000,No,1452,Yes,,B,['Tough grader'],people,people
Not Mandatory,poor,good,poor,0,30771089,0,,awful,1,PSY2574,Does not prepare you for exams..,11/22/2018,4.0,4.0,,1,N/A,1.0,1.0,1,No,1542895932000,No,1452,Yes,,N/A,"['Test heavy', 'Accessible outside class']",people,people
Not Mandatory,poor,average,poor,2,29714954,2,,awful,1,PSY2505,"She's very monotone, I can't listen to her, &quot;EuHHH&quot; is her favorite word. Nothing's new . She's treating and talking to us like we're child. Child dev is not hard, but study cause she's questionning about specific things that she havn't talk in classe. I didn't recommand this classe at all",03/29/2018,3.0,3.0,,1,N/A,1.0,1.0,1,Yes,1522332193000,No,1452,No,,B+,"['Tough grader', 'Lots of homework', 'Test heavy']",people,people
Mandatory,good,average,good,1,28369169,2,,awesome,5,PSY2525,Child dev was an easy class! Make sure to read the manual because all of her trick questions come from there. If you attend class and TAKE NOTES you will be perfectly good to go!,05/23/2017,2.0,2.0,,5,N/A,5.0,5.0,1,Yes,1495547833000,Yes,1452,Yes,,A,"['Get ready to read', 'Clear grading criteria']",people,person
Not Mandatory,good,average,good,6,27746424,0,,good,4,PSY2505,She's a cutie. She's a bit monotone but overall pretty good!,01/17/2017,2.0,2.0,,4,N/A,4.0,4.0,1,Yes,1484696113000,Yes,1452,Yes,,Not sure yet,"['Get ready to read', 'Accessible outside class']",people,people
