attendance,clarityColor,easyColor,helpColor,helpCount,id,notHelpCount,onlineClass,quality,rClarity,rClass,rComments,rDate,rEasy,rEasyString,rErrorMsg,rHelpful,rInterest,rOverall,rOverallString,rStatus,rTextBookUse,rTimestamp,rWouldTakeAgain,sId,takenForCredit,teacher,teacherGrade,teacherRatingTags,unUsefulGrouping,usefulGrouping
Not Mandatory,poor,average,poor,0,29569080,1,,awful,1,ECO1104,"She frankly was far too concerned by random students leaving the classroom, to the point where she would waste 15 minutes of class time ranting about it. This was made doubly worse by the fact that she lectured far too slowly, barely managing to cover the required course content. She also picked ridiculous fights with students over random stuff.",02/15/2018,3.0,3.0,,1,N/A,1.0,1.0,1,Yes,1518707119000,No,1452,Yes,,A-,[],person,people
Not Mandatory,good,average,good,0,28330244,1,,good,4,ECO1104,"Seda was an experience. She has a very distinctive presentation style that takes some getting used to and all her slides are taken  directly from the textbook, but she really cares about her students learning the content. Give her a chance and she will surprise you. She is very open to adjusting grades.",05/17/2017,3.0,3.0,,4,N/A,4.0,4.0,1,Yes,1495012142000,Yes,1452,Yes,,A+,"['Accessible outside class', 'Caring']",person,people
N/A,poor,good,poor,0,28149127,0,,awful,1,ECO1104,"She seems to be very passionate towards economic and got a bit discouraged teaching it as the semester went on. Shes nice thought but really isnt meant for teaching. Her lectures and the way she explains concept are very confusing. her midterms were graded very strictly according to her ""ideal""answer that could just be 1-2 sentences.",04/27/2017,4.0,4.0,,1,N/A,1.0,1.0,1,Yes,1493331250000,No,1452,Yes,,N/A,"['Tough grader', 'Test heavy']",people,people
Not Mandatory,poor,average,poor,2,28074911,0,,awful,1,ECO1104,"I think this professor means well, but her lack of teaching experience was at the forefront every class. She got mad at students for leaving class early even when she would go over her allocated time. The exams are not overly hard, but her correction grid is specific. One assignment was terribly explained. Online Aplia assignments help your mark.",04/19/2017,2.0,2.0,,1,N/A,1.0,1.0,1,Yes,1492560548000,No,1452,N/A,,N/A,"['Lots of homework', 'Accessible outside class', 'Get ready to read']",people,people
N/A,poor,average,poor,3,28020993,0,,awful,1,ECO1104,The assignments seems made for students from engineering faculty.,04/09/2017,3.0,3.0,,1,N/A,1.0,1.0,1,Yes,1491775565000,No,1452,Yes,,N/A,"['Tough grader', 'Lots of homework']",people,people
Not Mandatory,poor,good,poor,8,27930954,0,,awful,1,ECO1104,"This prof is the ABSOLUTE worse prof I've ever taken!!!!! She does not know how to teach, she makes mistakes on the board doesnt realize them until the class is almost over, assignments are NOT specific and basically had to teach myself the course. First two midterms were HORRIBLE!!!! STAY AWAY!!!!! STAY. AWAY.",03/21/2017,5.0,5.0,,1,N/A,1.0,1.0,1,No,1490136398000,No,1452,Yes,,WD,"['Lots of homework', 'Lecture heavy']",people,people
Not Mandatory,poor,good,poor,7,27930929,0,,awful,1,ECO1104,Awful prof. Doesn't know how to teach. During the first midterm she wouldn't stop talking. Her class is disorganized and she calls out students for leaving early or leaving to go to the washroom. She had docked marks off my midterm for writing more than 2 sentences even though answers were right. Save yourself and don't take her class!!!!!!!,03/21/2017,4.0,4.0,,1,N/A,1.0,1.0,1,Yes,1490136150000,No,1452,Yes,,Not sure yet,"['Get ready to read', 'Lots of homework', 'Tough grader']",people,people
Not Mandatory,poor,average,poor,8,27910562,0,,awful,1,ECO1104,"I do not like the way she teaching. She has too many rules in class. Anyway, the microeconomics is easy. Thanks god!",03/15/2017,2.0,2.0,,1,N/A,1.0,1.0,1,No,1489596599000,No,1452,Yes,,N/A,"['Lots of homework', 'Hilarious']",people,people
