attendance,clarityColor,easyColor,helpColor,helpCount,id,notHelpCount,onlineClass,quality,rClarity,rClass,rComments,rDate,rEasy,rEasyString,rErrorMsg,rHelpful,rInterest,rOverall,rOverallString,rStatus,rTextBookUse,rTimestamp,rWouldTakeAgain,sId,takenForCredit,teacher,teacherGrade,teacherRatingTags,unUsefulGrouping,usefulGrouping
Not Mandatory,average,average,average,0,29384384,0,,average,3,SRS1510,"Les cours sont parfois int&eacute;ressants, parfois tr&egrave;s confus et mal ordonn&eacute;s. Les deux mid-term sont &agrave; faire &agrave; la maison mais l'examen final requiert tr&egrave;s beaucoup de pr&eacute;paration.",01/03/2018,3.0,3.0,,3,N/A,3.0,3.0,1,No,1515020254000,Yes,1452,N/A,,N/A,"['Get ready to read', 'Tough grader']",people,people
Not Mandatory,good,poor,good,0,29081502,0,,awesome,5,SRS1510,"Enseignante pr&eacute;f&eacute;r&eacute;e! J'ai ador&eacute; son cours, elle donne des examens maison puis le droit d'apporter 5 pages recto-verso &agrave; l'examen final! Elle care de ses &eacute;tudiants, et veut la r&eacute;ussite de tout le monde!",12/07/2017,1.0,1.0,,5,N/A,5.0,5.0,1,No,1512654775000,Yes,1452,Yes,,N/A,"['Respected', 'Hilarious']",people,people
Mandatory,good,poor,good,0,29070518,0,,awesome,5,SRS1510,"Un cours tr&egrave;s int&eacute;ressant, avec une professeure tout simplement g&eacute;niale, tr&egrave;s dynamique et dr&ocirc;le. La prise de note est n&eacute;cessaire dans cette classe, car les slides ne suffisent pas. Il suffit simplement d'&eacute;couter. Les tests sont &agrave; faire &agrave; la maison; il est donc ais&eacute; d'avoir une good grade.",12/06/2017,1.0,1.0,,5,N/A,5.0,5.0,1,No,1512589864000,Yes,1452,N/A,,A,"['Inspirational', 'Respected']",people,people
Mandatory,good,poor,good,0,28884049,0,,good,4,S1510,"Elle est vraiment gentille, elle donne les examens &agrave; choix multiples maisons, un vrai cours bonbon. Facile &agrave; souhait, juste &agrave; se pr&eacute;senter aux cours. Elle donne m&ecirc;me un gabarit pour prendre les notes de cours. Difficile &agrave; rater, un A gratuit.",11/13/2017,1.0,1.0,,4,N/A,4.0,4.0,1,No,1510579349000,Yes,1452,Yes,,A,"['Lecture heavy', 'Accessible outside class', 'Caring']",people,people
Not Mandatory,average,average,average,0,25913070,1,,average,2,SRS1510,"She talks so quickly & it's hard to know what's essential. You have to write down every single word she sais. Mid-terms are take homes, multiple choice but are hard without proper notes. Allowed a 10 page cheatsheet for final. Internet won't help. With right notes it's so easy but you can still do very well without.",01/10/2016,2.0,2.0,,4,Sorta interested,3.0,3.0,1,No,1452446927000,N/A,1452,Yes,,A-,"['Caring', 'Lecture heavy']",person,people
N/A,poor,good,poor,5,25807977,0,,awful,1,SRS1510,Hardest class. Last year's average was 91%. The class average is now something like a 70%.  She made the course really hard and her tests are tricked and hard.  Avoid her if you want an A+. Her exams are HARD. You need to literally have a background in Witchcraft to get a good grade. Studying everything on her slides doesn't bring you anywhere,12/22/2015,5.0,5.0,,1,Low,1.0,1.0,1,No,1450827688000,N/A,1452,N/A,,B+,"['Tough grader', 'Get ready to read']",people,people
N/A,average,good,average,1,25751838,0,,average,3,SRS1501,"I really struggled because I don't come from a house that french is my first language, the readings were really tough because of this, so I retained nothing. A lot of the test questions were from the reading... . If french isn't your 1st language, id suggest you take the english version of the course.",12/17/2015,4.0,4.0,,3,Sorta interested,3.0,3.0,1,No,1450387392000,N/A,1452,Yes,,N/A,"['Tough grader', 'Get ready to read']",people,person
