attendance,clarityColor,easyColor,helpColor,helpCount,id,notHelpCount,onlineClass,quality,rClarity,rClass,rComments,rDate,rEasy,rEasyString,rErrorMsg,rHelpful,rInterest,rOverall,rOverallString,rStatus,rTextBookUse,rTimestamp,rWouldTakeAgain,sId,takenForCredit,teacher,teacherGrade,teacherRatingTags,unUsefulGrouping,usefulGrouping
Mandatory,good,poor,good,0,32832912,0,,awesome,5,CMN2168,She's so nice. Her lectures are interesting and fun. It's so easy to do good in her class. Probably the easiest A ever. Usually summer school sucks but she made it enjoyable. Love her!,01/14/2020,1.0,1.0,,5,N/A,5.0,5.0,1,No,1578976630000,Yes,1452,Yes,,A-,"['Group projects', 'Amazing lectures ', 'Respected']",people,people
Mandatory,good,poor,good,0,32763796,0,,awesome,5,CMN3504,"One of my favorite classes. She really cares about her students and she is always available to answer questions. She gave so many opportunities to succeed, it is impossible to fail this class. Weekly class discussion based on readings, easy bonus points, two assignments, and choice between MC exam or take home. She is amazing &amp; gives great feedback",12/27/2019,1.0,1.0,,5,N/A,5.0,5.0,1,No,1577457269000,Yes,1452,Yes,,A,"['Respected', 'EXTRA CREDIT', 'Participation matters']",people,people
Mandatory,good,average,good,0,32723571,0,,awesome,5,CMN3504,"Such a sweetheart, very interesting lectures. Gives bonus points for pretty much anything and has clear grading criteria. Take-home final exam, always a perk!",12/19/2019,2.0,2.0,,5,N/A,5.0,5.0,1,No,1576797759000,Yes,1452,Yes,,N/A,"['Clear grading criteria', 'Amazing lectures ', 'Participation matters']",people,people
Mandatory,good,average,good,0,30986477,0,,awesome,5,CMN3504,Amazing teacher and awesome course. Would definitely take another class of hers. There are lectures every week but if you like the main subject of the class they're good. The teacher is really open minded and accepting - the participation matters but she gives us many options to get our extra points.,12/12/2018,3.0,3.0,,5,N/A,5.0,5.0,1,No,1544620311000,Yes,1452,Yes,,A-,"['Caring', 'Gives good feedback', 'Participation matters']",people,people
Mandatory,good,poor,good,0,30823205,0,,good,4,CMN3504,"As long as you're not afraid of writing you're good. You're graded on 4 things: an analysis of a visual media of your choice, a creative project OR a summary of a book, participation (only reason to show up) and a take-home final exam. Very easy even if you're not in communication",11/30/2018,1.0,1.0,,4,N/A,4.0,4.0,1,No,1543568749000,Yes,1452,Yes,,A+,"['Caring', 'Participation matters', 'EXTRA CREDIT']",people,people
