attendance,clarityColor,easyColor,helpColor,helpCount,id,notHelpCount,onlineClass,quality,rClarity,rClass,rComments,rDate,rEasy,rEasyString,rErrorMsg,rHelpful,rInterest,rOverall,rOverallString,rStatus,rTextBookUse,rTimestamp,rWouldTakeAgain,sId,takenForCredit,teacher,teacherGrade,teacherRatingTags,unUsefulGrouping,usefulGrouping
Mandatory,poor,good,poor,0,36325963,0,online,awful,1,ADM1340,"Just save your life and don't take any courses with her, do anything or leave the country.  ",05/12/2022,5.0,5.0,,1,N/A,1.0,1.0,0,N/A,1652396798000,N/A,0,Yes,,D,"['Lots of homework', 'Hilarious', 'Tough grader']",people,people
Mandatory,poor,good,poor,0,36325900,0,online,awful,1,ADM1340,"Firstly, the most important part is that I couldn't understand anything she says. Secondly, there was too much context at the same time, and you are not able to memorize and understand it. Finally, don't take this course with her NEVER save your GPA and nerves, just drop it or leave the country. ",05/12/2022,5.0,5.0,,1,N/A,1.0,1.0,0,N/A,1652396376000,N/A,0,Yes,,D+,"['Lots of homework', 'Tough grader']",people,people
Not Mandatory,poor,good,poor,0,35810052,0,,awful,1,ADM2342,Worst professor ever trust me,01/29/2022,4.0,4.0,,1,N/A,1.0,1.0,1,Yes,1643439444000,No,1452,Yes,,N/A,['Get ready to read'],people,people
N/A,poor,good,poor,0,34393467,1,online,awful,1,ADM1340,Lectures are prerecorded &quot;for foreign students&quot;. I respect wanting to ensure international students are treated fairly but it would be better for both foreign and local students if the lectures were live + recorded so we all can benefit from real time questions. She is bland and seems generally uncaring. I cannot believe she's a university prof.,02/26/2021,4.0,4.0,,1,N/A,1.0,1.0,1,Yes,1614368100000,No,1452,Yes,,N/A,"['Get ready to read', 'Lecture heavy']",person,people
Not Mandatory,average,good,average,0,34344565,0,online,poor,2,ADM2342,I physically cannot understand the words Dr. Chen speaks. It makes it so hard to learn anything. She is basically a robot. Her TA's are her saving grace. SOOOO much content at once. Legit no live class so if u need help you are at the mercy of emails or office hours. Midterms and Final only. Lockdown browser and webcam. No prof to switch to sucks.,02/05/2021,5.0,5.0,,2,N/A,2.0,2.0,1,Yes,1612544706000,No,1452,Yes,,INC,"['Graded by few things', 'Tough grader', 'Lecture heavy']",people,people
