attendance,clarityColor,easyColor,helpColor,helpCount,id,notHelpCount,onlineClass,quality,rClarity,rClass,rComments,rDate,rEasy,rEasyString,rErrorMsg,rHelpful,rInterest,rOverall,rOverallString,rStatus,rTextBookUse,rTimestamp,rWouldTakeAgain,sId,takenForCredit,teacher,teacherGrade,teacherRatingTags,unUsefulGrouping,usefulGrouping
N/A,good,good,good,0,34898941,0,online,good,4,LIN2310,"Wonderful prof. This man knows his stuff and even though his lectures are a bit dry, he's capable of conveying a good lecture. Super lecture heavy but that's Syntax for you. 3 quizzes, 1 midterm, 1 final. Didn't answer questions in class but to be fair there was too much material to get through. Textbook was so helpful, study it to do well.",06/08/2021,4.0,4.0,,4,N/A,4.0,4.0,1,Yes,1623134260000,Yes,1452,Yes,,B+,"['Lecture heavy', 'Respected']",people,people
Mandatory,good,good,good,0,34839684,0,online,awesome,5,LIN2310,"Genuinely the best professor I have had to date, he was extremely clear on all guidelines and in explanation. He answers questions well and gets to the point. Very punctual and helpful.",05/21/2021,4.0,4.0,,5,N/A,5.0,5.0,1,Yes,1621631272000,Yes,1452,Yes,,A+,"['Gives good feedback', 'Amazing lectures ']",people,people
N/A,good,good,good,0,34625209,0,online,awesome,5,LIN2310,"Professor Ott knows his content. Regardless of the class' difficulty, I enjoyed his lectures. He knows what he's talking about.",04/26/2021,4.0,4.0,,5,N/A,5.0,5.0,1,Yes,1619454974000,Yes,1452,Yes,,N/A,"['Respected', 'Lecture heavy', 'Test heavy']",people,people
N/A,average,good,average,0,34584624,0,online,poor,2,LIN2310,"Dennis was a really nice person and was always willing to answer students' questions during lecture time, but I felt that the course content was so heavy considering many people just came from the introduction course. There is a ton of reading and exercises per week along with the lecture/DGDs that if you don't do all three you'll fall behind fast",04/20/2021,4.0,4.0,,2,N/A,2.0,2.0,1,Yes,1618950032000,No,1452,Yes,,N/A,"['Test heavy', 'Lots of homework']",people,people
Mandatory,good,good,good,1,34399726,0,online,awesome,5,LIN2310,"Professor Ott is a very structured, knowledgeable and engaging lecturer. He promptly and directly answers students questions allowing for a better and clearer understanding of the subject matter. His lectures closely resemble and elaborate on the assigned readings, so I recommend students complete said readings before attending lectures.",03/01/2021,4.0,4.0,,5,N/A,5.0,5.0,1,Yes,1614634272000,Yes,1452,Yes,,Not sure yet,"['Get ready to read', 'Respected']",people,person
Not Mandatory,good,good,good,1,32992487,0,,awesome,5,LIN2310,"I initially was not a huge fan of the class as I did poorly on the first quiz and did not feel prepared for it. However, once I learned his teaching style I found the course far easier. Be prepared to do a lot of self-learning and independent work, just showing up to the lectures are not enough.",03/25/2020,4.0,4.0,,5,N/A,5.0,5.0,1,Yes,1585163375000,Yes,1452,Yes,,N/A,"['Clear grading criteria', 'Lecture heavy', 'Graded by few things']",people,person
Not Mandatory,good,good,good,0,30204442,0,,awesome,5,LIN3310,"I was terrified of this class because I barely passed LIN2310 (with a different prof). Ott made syntax so easy and accessible for me. Attendance isn't mandatory but he does such a good job of explaining concepts that it's in your best interest to go. Definitely makes you work for your grade, but gives you all the tools you need to succeed.",05/29/2018,4.0,4.0,,5,N/A,5.0,5.0,1,No,1527599577000,Yes,1452,Yes,,A+,"['Lecture heavy', 'Gives good feedback', 'Respected']",people,people
Mandatory,poor,good,poor,0,30006014,2,,awful,1,LIN2310,"Youre probably obligated to take this class. Not as kind and welcoming as Kevin at all. Was marked on 3 quizzes, the midterm and the exam; no assignments. Do your readings and go to class or you will not do well. Although he allows a cheat sheet for the midterm and final, he is a tough grader and not very helpful when it comes to asking questions.",05/06/2018,4.0,4.0,,1,N/A,1.0,1.0,1,Yes,1525648513000,No,1452,Yes,,N/A,"['Lecture heavy', 'Tough grader']",people,people
Not Mandatory,average,average,average,0,29411095,2,,average,3,LIN1310,"Chances are you're obligated to take this class. Posts all the slides online so you don't have to bother going to class. Grading consists of midterm and exam, and 4 assignments that he takes your top 3 marks from. Not an overly engaging prof, lectures get boring but they do their job.",01/08/2018,3.0,3.0,,3,N/A,3.0,3.0,1,Yes,1515417159000,No,1452,Yes,,B+,"['Accessible outside class', 'Graded by few things']",people,people
Not Mandatory,good,average,good,3,29064715,0,,awesome,5,LIN1320,Way better than Kevin in my opinion. He posts his slides and lets you use cheat sheets for the (1) midterm and the final exam. There are 4 assignments and he takes off the lowest grade. Go to class! My only problem with him is that he could have explained the material in simpler terms. Great prof overall!,12/06/2017,3.0,3.0,,5,N/A,5.0,5.0,1,Yes,1512570805000,Yes,1452,Yes,,N/A,[],people,people
Not Mandatory,good,good,good,1,28954193,0,,good,4,LIN1310,"Learned a lot in his class, Dr. Ott is very good at explaining the complicated material. Class had 4 assignments, a midterm, and an exam. Go to class and do the readings and you'll be fine. He's pretty formal, but he seems like a genuinely nice person. I had a good experience in his class",11/22/2017,4.0,4.0,,4,N/A,4.0,4.0,1,Yes,1511388963000,Yes,1452,Yes,,A+,"['Respected', 'Lecture heavy']",people,person
Not Mandatory,good,good,good,1,28939309,0,,good,4,LIN1310,DO THE READINGS BEFORE CLASS or you will have no clue what is going on! I did the readings and was still lost! Overall a good course but easy to get lost and fall behind,11/20/2017,4.0,4.0,,4,N/A,4.0,4.0,1,Yes,1511183958000,No,1452,Yes,,B+,['Lecture heavy'],people,person
Mandatory,good,good,good,0,28055981,2,,good,4,LIN1310,"Good professor who knows his stuff. Uses slides (which are uploaded) but he elaborates greatly on them in class. Midterms and final are very difficult but he allows one page of cheat sheet so you can put lots of info on it. Is not very welcoming, may seem a little cold and rude (sometimes doesn't let students finish questions before answering)",04/16/2017,4.0,4.0,,4,N/A,4.0,4.0,1,Yes,1492302202000,Yes,1452,Yes,,N/A,"['Tough grader', 'Lecture heavy']",people,people
Not Mandatory,poor,good,poor,3,27600283,3,,awful,1,LIN3310,Tests/Exams are hard. A very strict grader and not helpful.,12/22/2016,5.0,5.0,,1,N/A,1.0,1.0,1,No,1482371662000,No,1452,Yes,,N/A,"['Lecture heavy', 'Tough grader']",people,people
Mandatory,average,average,average,3,27564214,0,,average,3,LIN1310,"Overall I fairly good prof. For the midterm and exam he allowed a cheat sheet that we could use. Is lectures did tend to become  a bit boring and repetitive but he did add funny memes sometimes to make it more interesting. Biggest concern is that when someone asks questions, he won't let them finish and attempts to answer it before they finish.",12/19/2016,3.0,3.0,,3,N/A,3.0,3.0,1,Yes,1482146471000,Yes,1452,Yes,,N/A,"['Respected', 'Lecture heavy']",people,people
Mandatory,average,average,average,1,27397665,2,,poor,2,LIN1310,you probably have no choice but to take him tbh. class content is easy if you keep up but his slides are absolutely garbage no details at all so you must be in class at all times but theres hardly anything to refer to for an exam. isn't as welcoming as Kevin McMullin for sure. Read the textbook. Hope there is marks for attendance.,12/08/2016,3.0,3.0,,2,N/A,2.0,2.0,1,Yes,1481227163000,No,1452,Yes,,N/A,"['Tough grader', 'Lots of homework']",people,person
Not Mandatory,good,good,good,6,27109296,2,,good,4,LIN3310,"Best looking genius man who worked under the god of linguistics. Not as good as McMullin in terms of lectures because of how heavy his powerpoints are. Need more  hands on work with students, use the chalkboard and engage the students. Amazing professor over all, he's clearly intelligent!",11/01/2016,4.0,4.0,,4,N/A,4.0,4.0,1,No,1478021193000,Yes,1452,Yes,,A,"['Respected', 'Lecture heavy']",people,people
Not Mandatory,good,good,good,1,26959005,1,,good,4,LIN3310,"Tough marker, excellent teacher",09/07/2016,4.0,4.0,,4,N/A,4.0,4.0,1,No,1473243597000,Yes,1452,Yes,,A-,"['Gives good feedback', 'Tough grader', 'Respected']",person,person
Mandatory,average,good,average,5,26567630,0,,average,3,LIN3310,He's a very good prof. The only thing is he expects too much from the students. Most of the stuff we learned was theoretical so it was pretty difficult to keep up. He took way too many marks off for little things. He sometimes had attitude when you questioned him. To be honest this class was pretty boring and the DGD's were absolutely useless.,05/13/2016,5.0,5.0,,3,N/A,3.0,3.0,1,No,1463155680000,N/A,1452,Yes,,N/A,"['Get ready to read', 'Lots of homework', 'Tough grader']",people,people
Not Mandatory,average,good,average,3,26356725,0,,good,3,LIN3310,Dennis is a great professor but he also expects a lot from his students. I was surprised when many students failed the midterm he still made the final exam practically impossible. It was his first time teaching as a professor so he has a lot to learn but I think he still did a good job. The one thing I wish he did was practice questions in the DGDs,04/22/2016,5.0,5.0,,4,N/A,3.5,3.5,1,No,1461338574000,N/A,1452,Yes,,Not sure yet,"['Respected', 'Lots of homework']",people,people
