attendance,clarityColor,easyColor,helpColor,helpCount,id,notHelpCount,onlineClass,quality,rClarity,rClass,rComments,rDate,rEasy,rEasyString,rErrorMsg,rHelpful,rInterest,rOverall,rOverallString,rStatus,rTextBookUse,rTimestamp,rWouldTakeAgain,sId,takenForCredit,teacher,teacherGrade,teacherRatingTags,unUsefulGrouping,usefulGrouping
Mandatory,poor,average,poor,0,36678002,0,,awful,1,BIO3524,"unbelievably confusing and disorganized, won't recommend him.
",10/05/2022,2.0,2.0,,1,N/A,1.0,1.0,0,N/A,1664928975000,N/A,0,Yes,,Not sure yet,[],people,people
Mandatory,good,average,good,0,36672327,0,,awesome,5,BIO3126,"John is a very great prof. While his slides can be complicated and confusing to read through, he explains the concepts rather concisely and thoroughly during the first hour of the lab. Alongside this he is very quick to respond outside of office hours, including on the weekends. I would highly recommend taking BIO3126 with him if possible!",10/02/2022,3.0,3.0,,5,N/A,5.0,5.0,0,N/A,1664740292000,Yes,0,Yes,,INC,"['Caring', 'Accessible outside class', 'Participation matters']",people,people
Not Mandatory,average,average,average,0,36222024,0,online,average,3,BIO3151,"Man where do I start lol. This guy accidentally deleted all our midterms, got us prepared for a rewrite, then recovered them all of a sudden. Also cancelled an assignment after half the class already submitted it. Other than technical hiccups and boring lectures, he's a nice guy. The assignments/tests were super easy and half the class got an A+",05/03/2022,2.0,2.0,,3,N/A,3.0,3.0,1,N/A,1651545014000,N/A,0,Yes,,A+,"['Accessible outside class', 'Lots of homework', 'EXTRA CREDIT']",people,people
Mandatory,good,average,good,0,36137438,0,online,awesome,5,BIO3151,He is a very caring and nice person. His lectures were not heavy and he made sure everyone understood the lectures. He doesn't give hard examples during the lectures but he allowed us to use any kind of resources during the exams which was very helpful. He is also accommodating and you don't have to explain yourself to get an extension for exams.,04/23/2022,2.0,2.0,,5,N/A,5.0,5.0,1,N/A,1650751479000,Yes,0,Yes,,A+,"['Clear grading criteria', 'Caring', 'Respected']",people,people
Mandatory,good,good,good,0,35850684,0,,awesome,5,BIO3551,John est un des meilleurs profs que jai eu. Son cours est difficile mais il est toujours l&agrave; pour texpliquer davantage la mati&egrave;re jusqu&agrave; ce que tu comprennes. Cest un p&eacute;dagogue hors-pair.,02/13/2022,4.0,4.0,,5,N/A,5.0,5.0,1,No,1644752400000,Yes,1452,Yes,,N/A,"['Lots of homework', 'Participation matters', 'Caring']",people,people
Mandatory,good,average,good,0,35753187,0,online,awesome,5,BIO3524,"Great teacher, the class is very interesting and was very enjoyable to take. He clearly states how you will be graded, online exams that are open book and he gives you lots of time to do them. Only tedious part is that there are weekly quizzes but they are only for bonus marks and you don't have to do them. Would definitely recommend",01/14/2022,2.0,2.0,,5,N/A,5.0,5.0,1,No,1642173746000,Yes,1452,Yes,,A-,"['Clear grading criteria', 'Amazing lectures ']",people,people
Mandatory,good,average,good,0,35587752,0,,awesome,5,BIO3526,"easily uottawa's best science prof. definitely take this class if you're already taking bio3524/3124. lots of assignments but its pretty easy to do well on them. this class has one midterm and a final and they were both pretty hard, the midterm especially so. practice the calc questions!",12/18/2021,2.0,2.0,,5,N/A,5.0,5.0,1,No,1639838819000,Yes,1452,Yes,,A+,"['Accessible outside class', 'Amazing lectures ', 'Lots of homework']",people,people
Not Mandatory,good,good,good,2,35509499,0,online,awesome,5,BIO3524,The most caring and patient professor! He makes sure his students ask questions during class and does not move on to new material until the concepts are understood. Homeworks and previous exams are given to prepare you. Take thorough notes in class and listen to the audio (his exams and quizzes are SPECIFIC). Open-book exam + virtual exams :),12/14/2021,4.0,4.0,,5,N/A,5.0,5.0,1,No,1639449254000,Yes,1452,Yes,,Not sure yet,"['Accessible outside class', 'Gives good feedback', 'Test heavy']",people,people
N/A,good,good,good,1,34503131,0,,awesome,5,BIO3524,"Took this class a few years ago but im really surprised at all these negative reviews. His course is tough and you cant expect to do well if you dont attend and pay attention. He will emphasize material that is high yield for the exam. Moreover, he is ALWAYS available to answer questions. I went to his office and he was always helpful. Got A+",04/03/2021,4.0,4.0,,5,N/A,5.0,5.0,1,Yes,1617466662000,Yes,1452,Yes,,A+,[],people,person
Mandatory,poor,good,poor,0,32174734,0,,awful,1,BIO3151,Tough exams. He does not explain well.,08/15/2019,5.0,5.0,,1,N/A,1.0,1.0,1,No,1565889763000,No,1452,Yes,,N/A,[],people,people
Mandatory,good,good,good,0,32009802,0,,good,4,BIO3,Great teacher,06/09/2019,4.0,4.0,,4,N/A,4.0,4.0,1,No,1560068591000,Yes,1452,Yes,,B,['Respected'],people,people
Mandatory,good,average,good,1,31331759,1,,awesome,5,BIO3126,Great professor!,02/03/2019,3.0,3.0,,5,N/A,5.0,5.0,1,Yes,1549226580000,Yes,1452,Yes,,N/A,"['Gives good feedback', 'Caring', 'Accessible outside class']",person,person
Mandatory,good,good,good,1,30635584,0,,good,4,BIO3151,Very tough no doubt. But he is caring and willing to put in the time to help you. His molecular lab course is extremely time consuming but a lot of the work is built on a few major principles he will emphasize and that can make or break your mark. With the effort you can succeed and although he is tough he does want the best for his students.,10/31/2018,5.0,5.0,,4,N/A,4.0,4.0,1,No,1540978546000,Yes,1452,Yes,,N/A,"['Caring', 'Tough grader', 'Respected']",people,person
Mandatory,poor,good,poor,2,30612477,0,,awful,1,BIO3151,Assignments are very confusing. He does not explain material well.,10/25/2018,5.0,5.0,,1,N/A,1.0,1.0,1,No,1540493485000,No,1452,Yes,,N/A,[],people,people
Mandatory,good,good,good,3,30330262,3,,good,4,BIO3151,Super tough? Definitely. But the last couple reviews are unfairly negative. if you want to succeed you need to put in the work. He tends to give everybody a generous bump at the end if the average is low (which is often fort his classes). Unlike most profs he always has time to answer questions outside of class even if in class he is a bit stiff.,07/09/2018,5.0,5.0,,4,N/A,4.0,4.0,1,No,1531130673000,Yes,1452,Yes,,N/A,"['Accessible outside class', 'Tough grader']",people,people
Mandatory,average,good,average,4,30312062,4,,poor,2,BIO3151,"You have to visit his office consistently. Assignments are very confusing and hardly any of the concepts are taught in class. Many mistakes in his assignments, so you end up spending hours to complete them and after realize that you were doing it right the whole time. He also doesn't tell students of these mistakes unless you visit his office.",07/01/2018,5.0,5.0,,2,N/A,2.0,2.0,1,No,1530454726000,No,1452,Yes,,B,"['Test heavy', 'Lots of homework', 'Tough grader']",people,people
Mandatory,poor,good,poor,8,30200185,3,,awful,1,BIO3151,I went to his office the second week of the lab to get help on the math-side of things and he literally told me to drop the class if it wasn't mandatory and made me feel completely discouraged for not understanding everything right away. I dropped the class and the average for the midterm ended up being under 50 apparently.,05/28/2018,4.0,4.0,,1,N/A,1.0,1.0,1,No,1527512234000,No,1452,Yes,,WD,[],people,people
Mandatory,poor,good,poor,4,29986715,3,,awful,1,BIO3151,Complete flip from BIO3124 where he was a decent prof. The assignments are completely bogus (he doesnt teach you anything relevant in lecture) and in order to do well you need to go to his office for help or know someone who does. His office is also packed which makes it worse. The exams were v tough and were difficult to prepare for. Frustrating.,05/04/2018,4.0,4.0,,1,N/A,1.0,1.0,1,No,1525439374000,No,1452,Yes,,A,['Tough grader'],people,people
N/A,good,good,good,3,29986606,4,,good,4,BIO3124,"LOTS of material in lectures that you need to memorize and then be able to APPLY. His method of MCQ's is via method of elimination, so make sure you consider every answer and strike out ones that don't seem right. To understand how to play the game, go to his office and ask him to show you his reasoning on a handful of Q's from practice midterms",05/04/2018,4.0,4.0,,4,N/A,4.0,4.0,1,No,1525438888000,Yes,1452,Yes,,A+,"['Lecture heavy', 'Caring', 'Tough grader']",people,people
N/A,average,good,average,5,29771922,0,,poor,2,BIO3151,Avoid avoid avoid,04/09/2018,4.0,4.0,,2,N/A,2.0,2.0,1,No,1523317268000,No,1452,Yes,,N/A,"['Get ready to read', 'Tough grader']",people,people
Mandatory,poor,good,poor,7,29752494,0,,awful,1,BIO3151,"People only like this professor because he smiles at them and gives them 2 minutes of his time and it makes their day. The truth is, he is terrible at teaching and gives ridiculous questions on exams. Also slightly rude and mocks other students. He was slightly better at teaching microbio than this course.",04/05/2018,5.0,5.0,,1,N/A,1.0,1.0,1,No,1522966823000,No,1452,Yes,,N/A,"['Test heavy', 'Accessible outside class', 'Tough grader']",people,people
Mandatory,poor,good,poor,6,29708880,1,,awful,1,BIO3151,He only gave 8 one hour long lectures in the whole semester which covered only the basics of each concept. His assignments and exams are way too complicated compared to the examples he gives in class. His office is always full and he isnt very helpful there either and seems annoyed at times. Class averages are so low and he is totally fine with it,03/28/2018,5.0,5.0,,1,N/A,1.0,1.0,1,No,1522242712000,No,1452,Yes,,N/A,"['Test heavy', 'Lots of homework', 'Tough grader']",person,people
Mandatory,poor,good,poor,5,29657328,2,,awful,1,BIO3551,He does not explain material well. Very poor teaching skills.,03/15/2018,5.0,5.0,,1,N/A,1.0,1.0,1,No,1521130817000,No,1452,Yes,,N/A,[],people,people
Not Mandatory,poor,good,poor,7,29605955,2,,awful,1,BIO3124,"Personality cult around this prof FOR SURE. While Basso is a friendly and approachable person, he's not a good professor. He believes that you can't succeed in a class unless you visit the professor's office hours consistently... so, his office is always packed and he is always there, but yet class avg is always terrible bc exams are ridiculous.",02/28/2018,5.0,5.0,,1,N/A,1.0,1.0,1,No,1519824644000,No,1452,Yes,,B+,"['Tough grader', 'Lecture heavy', 'Accessible outside class']",people,people
N/A,good,good,good,6,29512199,1,,awesome,5,BIO3124,"John is the best!! Very caring, he listens to what the students have to say and will repeat until you understand. How to do well: 1. Attend lectures + take good notes 2. Rewatch podcasts &amp; fill in the missing info (he talks fast) 3. Do practice midterms + problem sets 4. GO SEE HIM IN HIS OFFICE (absolute must!! he gives similar qs in his office)",01/28/2018,4.0,4.0,,5,N/A,5.0,5.0,1,No,1517167231000,Yes,1452,Yes,,A+,['Lecture heavy'],person,people
Not Mandatory,good,good,good,5,29473435,4,,awesome,5,BIO3124,"JOHN IS THE BEST PROF IN THE WORLD IDC WHAT ANYONE ELSE SAYS. Great lectures, entertaining, approachable. Go to class, watch podcasts, do crosswords, practice past exams, do problem sets more than once! Up to 3% in bonus points, very easy to get. Seems like a lot to do but it was manageable even when I had 5 other courses to worry about.",01/18/2018,4.0,4.0,,5,N/A,5.0,5.0,1,No,1516287654000,Yes,1452,Yes,,A,"['EXTRA CREDIT', 'Lecture heavy', 'Respected']",people,people
Mandatory,average,good,average,1,29456300,1,,average,3,BIO3524,"John was very good at explaining. His lectures are interesting. Although I understood everything, he is a tough grader. Don't expect to get an easy grade out of this class. Wish he would help with the math problems more. Kinda made me like bio a little less. Study Early and work hard! Write everything he says! Open book final exam was hard!",01/15/2018,5.0,5.0,,3,N/A,3.0,3.0,1,No,1516050428000,No,1452,Yes,,C+,"['Respected', 'Tough grader']",person,person
Mandatory,good,good,good,5,29451883,2,,awesome,5,BIO3124,"John is best the prof I've had in my undergrad. He's probably the only person that actually made me understand instead of simply regurgitating. Super approachable and honestly wants the best for his students. If you get the chance to take one of his courses, do it and make sure to go to his office hours. A real gem and mentor.",01/14/2018,4.0,4.0,,5,N/A,5.0,5.0,1,No,1515967303000,Yes,1452,Yes,,A+,"['Respected', 'Caring']",people,people
Not Mandatory,good,good,good,2,29371470,1,,awesome,5,BIO3124,"John is probably my best professor from the university. His tests are very fair, his lectures are very useful and he breaks things down to make it easier to understand. While the course in itself is not easy, he makes it interesting. You will do no wrong taking this class with him",01/02/2018,4.0,4.0,,5,N/A,5.0,5.0,1,No,1514893688000,Yes,1452,Yes,,Not sure yet,"['Clear grading criteria', 'Accessible outside class']",person,people
Mandatory,good,good,good,3,29339387,0,,awesome,5,BIO3124,John is the best thing that happened to microbio - knows his stuff and fantastic lecturer. Very willing to help outside of class. Class is tough and he makes you work for it but he's one of the best,12/26/2017,4.0,4.0,,5,N/A,5.0,5.0,1,No,1514311390000,Yes,1452,Yes,,N/A,"['Accessible outside class', 'Respected']",people,people
Mandatory,good,good,good,1,29339359,1,,awesome,5,BIO3124,Dr. Basso is the best thing that happened to microbio - knows his stuff and fantastic lecturer. Very willing to help outside of class. Class is tough and he makes you work for it but one of my favourite profs,12/26/2017,4.0,4.0,,5,N/A,5.0,5.0,1,No,1514311171000,Yes,1452,Yes,,N/A,"['Respected', 'Accessible outside class']",person,person
N/A,good,good,good,7,29326977,0,,good,4,BIO3124,"Really nice guy, and super approachable. However, this class is not easy. All tests are MC only, and require a level of understanding beyond what's in the notes. It's not enough to simply memorize, you really need to understand everything. Read the questions carefully, as many options will all look correct. Final was open book but still very hard.",12/23/2017,4.0,4.0,,4,N/A,4.0,4.0,1,No,1514064150000,Yes,1452,Yes,,N/A,"['Gives good feedback', 'Caring', 'Respected']",people,people
N/A,average,good,average,5,29271760,1,,average,3,BIO3524,"Available to help students. Really hard exam, based application of memorized content (only reason why I would not take it again). Openbook final exam. Good person. Good examples to help you understand. More than a teacher.",12/19/2017,4.0,4.0,,3,N/A,3.0,3.0,1,No,1513669866000,No,1452,Yes,,N/A,[],person,people
Not Mandatory,good,good,good,2,29244611,0,,awesome,5,BIO3124,"John was probably my favourite professor yet. He cares about his students and wants them to succeed. That being said, his midterms and final exam are very tricky. Make you sure write down everything he says in class and write it down when you get home. Start studying early, there is a lot of material in this class.",12/17/2017,5.0,5.0,,5,N/A,5.0,5.0,1,No,1513517209000,Yes,1452,Yes,,B+,"['Lecture heavy', 'Get ready to read']",people,people
Mandatory,good,average,good,0,28743085,0,,awesome,5,BIO3524,"He is great at explaining, and I don't know why some comments are saying he talks fast; he takes breaks when he talks so you can write what he's saying. However, you can't expect to get a 10 just by learning the material by heart - you have to really understand how different units link together. Has an open door policy and is basically always there",10/14/2017,3.0,3.0,,5,N/A,5.0,5.0,1,No,1507998636000,Yes,1452,Yes,,N/A,"['Accessible outside class', 'Respected', 'Test heavy']",people,people
Mandatory,poor,good,poor,0,28109820,5,,awful,1,BCH3551,"He speaks quickly, does not explain the material well but expects you to know it in depth. There is usually a line up in his office to clarify the concepts. There are mistakes in his assignments and in his exams.",04/24/2017,5.0,5.0,,1,N/A,1.0,1.0,1,No,1493006294000,No,1452,Yes,,N/A,"['Participation matters', 'Tough grader']",people,people
Mandatory,average,good,average,3,27989419,1,,average,3,BIO3524,"Basso is a decent prof, but there's a bit of a personality cult around him. The class is interesting, but midterms can be pretty rough. Don't just memorise the material because his midterms aren't about regurgitating stuff. Type like the wind, because what he says in class is what's on the exam.",04/03/2017,4.0,4.0,,3,N/A,3.0,3.0,1,No,1491261668000,Yes,1452,Yes,,A+,"['Respected', 'Accessible outside class']",person,people
Mandatory,good,good,good,1,27825401,1,,awesome,5,BIO3151,"John is the best prof you can have during your undergrad. Had him for two classes. It isn't a memorization class but you have to memorize a lot of material to apply, it is super content heavy. His final exam was open book and the average was around 50, but he curved it heavily. Go see him about ALL question he explains very well in person.",02/13/2017,4.0,4.0,,5,N/A,5.0,5.0,1,No,1486994279000,Yes,1452,Yes,,A,"['Accessible outside class', 'Gives good feedback', 'Clear grading criteria']",person,person
Mandatory,good,good,good,0,27803080,1,,good,4,BIO3524,"John is a great prof in and outside of class. He's always available and will explain a concept 10 times in order for you to understand. However, the material is tough and the examples seen in class are A.L.O.T. easier than the questions in his midterms and problem sets. Do the past midterms and go see him immediately if you don't understand.",02/03/2017,5.0,5.0,,4,N/A,4.0,4.0,1,No,1486159255000,Yes,1452,Yes,,N/A,"['Accessible outside class', 'Test heavy', 'Lots of homework']",person,people
Mandatory,average,good,average,0,27784562,0,,average,3,BIO3126,"He is always accessible outside of his classes which is nice.  If you don't go see him ever, you will not succeed in his classes. I personally think his teaching is horrible... Goes too fast and gets irritated in class. You MUST learn to think like him on everything he teaches otherwise you'll do poorly on tests and assignments. Good luck!",01/28/2017,5.0,5.0,,3,N/A,3.0,3.0,1,No,1485605411000,No,1452,Yes,,N/A,"['Test heavy', 'Accessible outside class']",people,people
Mandatory,good,good,good,3,27679637,1,,good,4,BIO3524,"do yourself a favor and type every single word he says during the lectures in your notes. Review your notes weekly. The sooner you think like Dr. Basso, the faster you will succeed. So start adopting his ideology and ask him questions to pick his brain a little. He is always available. Do the practice midterms and the exercises. Good luck.",01/05/2017,5.0,5.0,,4,N/A,4.0,4.0,1,No,1483638110000,No,1452,Yes,,N/A,"['Tough grader', 'Amazing lectures ']",person,people
Mandatory,average,good,average,2,27679309,5,,poor,2,BIO3124,"This class was so incredibly hard. No matter what I did I just could not get the hang of it-lectures aren't useful, he basically reads off the slides and doesn't explain anything in-depth or help with understanding/application of concepts - but you're expected to do that AND MORE on the exams. Go see him immediately if you have trouble.",01/05/2017,5.0,5.0,,2,N/A,2.0,2.0,1,No,1483635415000,No,1452,Yes,,N/A,"['Tough grader', 'Accessible outside class', 'Test heavy']",people,people
Mandatory,average,good,average,4,27538445,2,,poor,2,BIO3124,"I did not like this class, going quickly through the slides and letting us out earlier, instead of taking the time available to EXPLAIN the material. He explains well in person but not in classroom",12/16/2016,5.0,5.0,,2,N/A,2.0,2.0,1,No,1481923249000,No,1452,Yes,,N/A,[],people,people
Mandatory,good,good,good,12,27499541,0,,good,4,BIO3124,"Okay here is the real truth. Don't go into this class thinking that it'll be like past microbio courses. The class is v tough. You will need to put in a lot of effort, a lot more than your other courses in order to even get a decent mark. John is great, but the material is not something that can be memorized, you have to fully understand everything",12/14/2016,5.0,5.0,,4,N/A,4.0,4.0,1,No,1481748406000,Yes,1452,Yes,,N/A,"['Respected', 'Lecture heavy']",people,people
Not Mandatory,average,good,average,6,27389873,0,,average,3,BIO3124,"This class is a lot of work and very hard! You have to really understand the material. I thought Basso was a very average prof - very helpful if you go to office hours, but he speaks very fast in class and is often unclear. He's a great person, but be warned that this class is hard.",12/08/2016,4.0,4.0,,3,N/A,3.0,3.0,1,No,1481204812000,No,1452,Yes,,A,"['Test heavy', 'Tough grader']",people,people
Mandatory,good,average,good,3,26358945,0,,awesome,5,BPS3551,"john is a helpful and selfless man. I have never seen a prof willing to help students more than this man is. I have learned a lot from his courses. He's very inspirational and knowledgeable. His classes are hard so you need to do your part in order to succeed. That being said, you need to go see him ASAP if you don't understand something.",04/22/2016,3.0,3.0,,5,N/A,5.0,5.0,1,No,1461362147000,N/A,1452,Yes,,N/A,"['Tough grader', 'Inspirational']",people,people
N/A,average,good,average,1,26301637,0,,average,2,BPS3151,"John is almost always available to help, I don't know of another professor with as many office hours as him. That being said, his exams are brutal for most of his courses. Great guy, but his courses will hurt your grades.",04/14/2016,5.0,5.0,,3,N/A,2.5,2.5,1,No,1460672199000,N/A,1452,Yes,,N/A,['Tough grader'],people,person
Mandatory,good,good,good,8,25964732,0,,awesome,5,BIO3124,"John is very encouraging to his students and genuinely cares and wants all of them to succeed. Even if you re not one of his students, he'll try his best to help you.  Go and see him, he'll make it crystal clear. Note: This is not an easy course though. Final was open-book  hard. You need to know your stuff inside and out to do well.",01/19/2016,4.0,4.0,,5,It's my life,5.0,5.0,1,No,1453226283000,N/A,1452,Yes,,B,"['Tough grader', 'Caring']",people,people
Mandatory,poor,good,poor,1,25952027,14,,awful,1,BIO3524,"Terrible prof, not there for you at all. Exams are super tough.",01/16/2016,5.0,5.0,,1,Really into it,1.0,1.0,1,No,1452976706000,N/A,1452,Yes,,N/A,"['Lots of homework', 'Tough grader']",people,person
Mandatory,poor,good,poor,2,25952026,10,,awful,1,BIO3524,Worst prof I've ever had at the university of Ottawa! He doesn't explain concepts very well and makes his exams impossible. Avoid him at all costs!,01/16/2016,5.0,5.0,,1,Sorta interested,1.0,1.0,1,No,1452976608000,N/A,1452,Yes,,N/A,['Tough grader'],people,people
Mandatory,good,good,good,2,25912764,2,,awesome,4,BIO3124,He is such a great guy but beware; this class is NOT easy. You have really understand the material and be able to apply it when doing his tests and even then its hard to feel like your 100% sure of the answer (at least for me). Study early and ask questions when not sure!,01/10/2016,5.0,5.0,,5,Sorta interested,4.5,4.5,1,No,1452443572000,N/A,1452,Yes,,A,"['Respected', 'Get ready to read', 'Tough grader']",people,people
N/A,average,good,average,6,25892272,1,,good,3,BIO3124,"I loved John as a lecturer, and this was by far the best and most interesting class I have ever taken. However, no matter how hard I tried, I could not get a good mark. I found the exams really confusing, not in terms of subject material, but that I and a lot of other students would not know what he was asking for. He's a great guy, though.",01/06/2016,5.0,5.0,,4,It's my life,3.5,3.5,1,No,1452118141000,N/A,1452,Yes,,C,"['Tough grader', 'Amazing lectures ', 'Hilarious']",person,people
N/A,good,average,good,2,25818930,0,,awesome,5,BIO3124,"Great professor, always willing and available to help. Very clear in his expectations, and gives out opportunities for bonus marks. Course is slightly difficult as there is a big emphasis on actually understanding the material as opposed to purely memorizing.",12/24/2015,3.0,3.0,,5,Really into it,5.0,5.0,1,No,1450956130000,N/A,1452,Yes,,N/A,"['Tough grader', 'EXTRA CREDIT', 'Caring']",people,people
Mandatory,average,good,average,2,25816697,1,,poor,2,BIO3124,Very kind man but not a very good prof. Exams are extremely difficult and full of trick questions.,12/23/2015,5.0,5.0,,2,Low,2.0,2.0,1,No,1450913785000,N/A,1452,Yes,,N/A,"['Lots of homework', 'Tough grader']",person,people
Mandatory,good,good,good,0,25748682,1,,awesome,4,BIO3524,"you can not memorise in this class, you really need to understand the material. Make sure you go to his lectures and understand every detail. John is always ready to help, go see him for any question and he'll even help with the assignments. Be ready to work",12/17/2015,4.0,4.0,,5,It's my life,4.5,4.5,1,No,1450375845000,N/A,1452,Yes,,N/A,"['Tough grader', 'Gives good feedback']",person,people
Mandatory,average,good,average,1,25570190,0,,average,3,BIO3,"Had for microbio. He is a very smart professor and always available for help. Although it would be awesome if there was a textbook assigned (i would buy one even if there isn't) and if you skip class you will be really behind. A LOT of material, very hard to memorize it all! He also doesn't explain in depth in class and leaves you hanging.",12/07/2015,4.0,4.0,,3,Really into it,3.0,3.0,1,Yes,1449482974000,N/A,1452,Yes,,C+,"['Tough grader', 'Lots of homework']",people,person
