attendance,clarityColor,easyColor,helpColor,helpCount,id,notHelpCount,onlineClass,quality,rClarity,rClass,rComments,rDate,rEasy,rEasyString,rErrorMsg,rHelpful,rInterest,rOverall,rOverallString,rStatus,rTextBookUse,rTimestamp,rWouldTakeAgain,sId,takenForCredit,teacher,teacherGrade,teacherRatingTags,unUsefulGrouping,usefulGrouping
Mandatory,average,average,average,0,36673260,0,,poor,2,CML4124,Avoid at all cost!,10/03/2022,2.0,2.0,,2,N/A,2.0,2.0,0,Yes,1664793183000,N/A,0,No,,A-,"['Participation matters', 'Tough grader', 'Get ready to read']",people,people
Mandatory,poor,average,poor,0,36585424,0,,awful,1,CML2302,"I wish I could take another class, the subject is supposed to be interesting. ",08/14/2022,3.0,3.0,,1,N/A,1.0,1.0,0,Yes,1660473001000,N/A,0,No,,B+,"['EXTRA CREDIT', 'Participation matters', 'Clear grading criteria']",people,people
Not Mandatory,average,good,average,0,33347368,0,,poor,2,CML2302,"Her lectures are boring and she tries to cover too much at the expense of clarity. Beware, she's a tough grader. I really wanted to like her class.",05/21/2020,4.0,4.0,,2,N/A,2.0,2.0,1,Yes,1590076069000,No,1452,Yes,,N/A,"['Accessible outside class', 'Get ready to read', 'Tough grader']",people,people
Not Mandatory,good,average,good,3,27925911,8,,good,4,CML2302,"She's a Canadian hero. My condolences  to those who do not feel she is engaging enough on the details of the CBCA. Try to do better, if you can. It's dry. But she's not.  Easy to look at, etc. Plus, a walking tank of info. If you ask her about a related topic of interest, she will give you a number of sources to set your course.(figuratively).",03/20/2017,3.0,3.0,,4,N/A,4.0,4.0,1,Yes,1490047584000,Yes,1452,Yes,,N/A,[],people,people
Mandatory,average,average,average,3,27856162,4,,average,3,CML2302,Not completely satisfied with this class.,02/25/2017,3.0,3.0,,3,N/A,3.0,3.0,1,Yes,1487990717000,No,1452,N/A,,A,"['Get ready to read', 'Accessible outside class', 'Respected']",people,people
Not Mandatory,good,good,good,6,26631166,3,,good,4,CML2302,Knows the UN system very well. A bit abrasive. A bit confrontational and quirky. Does not provide feedback to students at all or in timely fashion. Tough grader. Has interesting pedagogy and doesn't simply lecture. More interested in her research than teaching but overall an effective instructor. Recommended!,05/21/2016,5.0,5.0,,4,N/A,4.0,4.0,1,No,1463866077000,Yes,1452,Yes,,B+,"['Respected', 'Tough grader']",people,people
Mandatory,good,average,good,1,26272530,2,,awesome,5,CML4124,"Course: Transnational Corporations and Human Rights. She is one of the best Profs I've ever had. She is passionate about the subject matter, yet conveys it objectively and from different angles. She is very respectful towards students and takes a real interest in their interests and careers. I would definitely take the course with her again!",04/11/2016,2.0,2.0,,5,N/A,5.0,5.0,1,Yes,1460396108000,N/A,1452,Yes,,A,"['Clear grading criteria', 'Gives good feedback', 'Inspirational']",people,person
Mandatory,good,average,average,4,25259273,0,,good,4,CML2302,"Prof Simons is a great prof, really knowledgeable and approachable. Gives good feedback but doesn't spoon feed. ",10/16/2015,3.0,3.0,,3,Really into it,3.5,3.5,1,Yes,1444985556000,N/A,1452,Yes,,N/A,"['Gives good feedback', 'Caring', 'Respected']",people,people
Not Mandatory,poor,average,poor,7,22915754,10,,awful,1,CML2302,"Absolutely terrible professor.  Just read from the book, is more concerned with looking cool and funny than teaching business law.  Shouldnt be teaching business law, I learned nothing, classes are cringeworthingly bad.",03/16/2014,2.0,2.0,,1,Really into it,1.0,1.0,1,No,1394998958000,N/A,1452,N/A,,A-,[],people,people
