attendance,clarityColor,easyColor,helpColor,helpCount,id,notHelpCount,onlineClass,quality,rClarity,rClass,rComments,rDate,rEasy,rEasyString,rErrorMsg,rHelpful,rInterest,rOverall,rOverallString,rStatus,rTextBookUse,rTimestamp,rWouldTakeAgain,sId,takenForCredit,teacher,teacherGrade,teacherRatingTags,unUsefulGrouping,usefulGrouping
Not Mandatory,good,average,good,0,35635308,0,,awesome,5,ADM2350,"Best Prof for financial management, make sure u get him",12/22/2021,2.0,2.0,,5,N/A,5.0,5.0,1,No,1640207842000,Yes,1452,Yes,,A+,[],people,people
Mandatory,average,good,average,0,35150299,0,online,average,3,ADM2350,Kind prof who's accessible outside of class. Very difficult class to do well in though because the quizzes are only out of 15 questions/marks.,10/24/2021,5.0,5.0,,3,N/A,3.0,3.0,1,No,1635111079000,Yes,1452,Yes,,Not sure yet,"['Respected', 'Lecture heavy', 'Accessible outside class']",people,people
Mandatory,good,good,good,0,34243049,0,,good,4,ADM2350,"Overall a good prof, he really cares about his student and it shows. He teaches the material in a way that makes it somewhat easier to understand. The quizzes and final include a lot more theoretical problems that you would think which sucks since he doesnt really go over those in class. He mainly focuses on calculation problems. Good prof.",01/06/2021,4.0,4.0,,4,N/A,4.0,4.0,1,Yes,1609910840000,Yes,1452,Yes,,Not sure yet,"['Caring', 'Lecture heavy', 'Graded by few things']",people,people
Mandatory,good,average,good,0,34227295,0,online,awesome,5,ADM2350,Very accommodating during a difficult semester and gives many opportunities to do well in the class. Quizzes and finals are exactly like the practice he gives in the slides and dgds.,01/03/2021,3.0,3.0,,5,N/A,5.0,5.0,1,Yes,1609636327000,Yes,1452,Yes,,B,[],people,people
Mandatory,good,poor,good,0,34159387,0,online,awesome,5,ADM2350,"Absolute gem. Professor Moneta gave us best 2/4 midterms for 45% which were really easy if you did practice problems. Group case for 10% was challenging but fair! Exam same as midterms. Super considerate with covid and manages to teach this quantitative class miraculously online! Best prof at telfer. You will actually understand, not regurgitate!",12/20/2020,1.0,1.0,,5,N/A,5.0,5.0,1,No,1608503759000,Yes,1452,Yes,,A,"['Caring', 'Group projects', 'Inspirational']",people,people
Not Mandatory,good,average,good,0,33959325,0,,awesome,5,ADM2350,"Professor Fabio made the online semester so much better. One of the few profs at Telfer who actually cares about his students and genuinely wants them to do well. His lectures are straight up, gives great real-world examples and his quizzes are similar to the practice questions he does. Attend all lectures and dgd's and easy A.",12/05/2020,3.0,3.0,,5,N/A,5.0,5.0,1,Yes,1607194414000,Yes,1452,Yes,,A,"['Caring', 'Gives good feedback', 'Respected']",people,people
N/A,good,average,good,0,33689405,0,online,awesome,5,ADM2350,Professor Moneta is an absolute gem. He is super considerate about his students and how they are able to cope up with the course and takes constant feedback on how he can improve his lectures. Skipping class can make it harder to cope with the course but overall he is a great prof,10/09/2020,3.0,3.0,,5,N/A,5.0,5.0,1,Yes,1602261113000,Yes,1452,Yes,,N/A,"['Respected', 'Lecture heavy', 'Gives good feedback']",people,people
