attendance,clarityColor,easyColor,helpColor,helpCount,id,notHelpCount,onlineClass,quality,rClarity,rClass,rComments,rDate,rEasy,rEasyString,rErrorMsg,rHelpful,rInterest,rOverall,rOverallString,rStatus,rTextBookUse,rTimestamp,rWouldTakeAgain,sId,takenForCredit,teacher,teacherGrade,teacherRatingTags,unUsefulGrouping,usefulGrouping
Not Mandatory,good,average,good,0,36522602,0,online,good,4,SEG2105,"Prof. Badreddin gives pretty interesting lectures and clearly enjoys teaching. The course can be hard due to the term project (which requires you to learn skills in Labs on top of the lectures). But, it was asynchronous online though and that can be really uninspirational so I cannot give a 5 rating.",07/15/2022,2.0,2.0,,4,N/A,4.0,4.0,0,N/A,1657846487000,Yes,0,Yes,,Not sure yet,"['Accessible outside class', 'Group projects', 'Caring']",people,people
Not Mandatory,good,good,good,0,36383844,0,online,awesome,5,SEG3125,"AMAZING PROF. The average by the end of the semester way 9.65 LMAO. I have to say I learned a lot in this class, it surely wasn't easy, but the prof is truely amazing for not making us worry about grades and can purely focus on learning and making our projects. Fair midterm and exam. Had him for SEG2105, can't wait to have him again in the future.",05/20/2022,4.0,4.0,,5,N/A,5.0,5.0,0,N/A,1653080539000,Yes,0,Yes,,A+,"['Caring', 'Amazing lectures ', 'Group projects']",people,people
Not Mandatory,good,average,good,0,35736327,0,online,awesome,5,SEG2105,"best professor i've had. incredibly easy course, i have no idea whether that is from him being really good at teaching or the course being easy",01/11/2022,2.0,2.0,,5,N/A,5.0,5.0,1,No,1641925592000,Yes,1452,Yes,,B+,"['Amazing lectures ', 'Caring', 'Respected']",people,people
Not Mandatory,good,average,good,0,35525251,0,online,awesome,5,SEG2105,"While the course itself can be heavy due to assignments, tests, labs, and a group project, professor Omar grades generously, gives easy assignments, fair tests, and overall is incredibly kind and accessible out of class. Labs and the group project were mostly self study and can be difficult but the TAs and the professor are helpful and accessible.",12/14/2021,3.0,3.0,,5,N/A,5.0,5.0,1,No,1639521386000,Yes,1452,Yes,,Not sure yet,"['Caring', 'So many papers', 'Group projects']",people,people
Not Mandatory,good,poor,good,0,35497472,0,,awesome,5,SEG2105,"Super easy tests. Amazing lectures. Best professor I've ever had. The only tough thing is the group project as you'll have to create an app, but you'll get plenty of time and assistance.",12/13/2021,1.0,1.0,,5,N/A,5.0,5.0,1,Yes,1639417421000,Yes,1452,Yes,,A+,"['Group projects', 'Amazing lectures ', 'Hilarious']",people,people
Not Mandatory,good,average,good,0,35377745,0,online,awesome,5,SEG2105,"Omar is an absolute gem. His lectures are pre-recorded are amazing and his live lectures are an EXPERIENCE. He's very knowledgeable about the industry, he can answer any question, and his humour is top-notch. Assignments / tests are as fair as they get. You are guaranteed to learn and have fun in this course. Thank you Omar for the great semester!!",12/06/2021,2.0,2.0,,5,N/A,5.0,5.0,1,No,1638763822000,Yes,1452,Yes,,A+,"['Caring', 'Accessible outside class', 'Respected']",people,people
Mandatory,good,average,good,1,34146945,0,online,awesome,5,CS3331,"He's teaching at UTEP. In few words, the best professor you will take for CS3331! If you want an A, you will need to work for it. He explains very well, and he is hilarious. Homeworks can be challenging, but he takes the time to help every student who needs help. You will have fun taking this class. My favorite course this semester by the way!",12/19/2020,2.0,2.0,,5,N/A,5.0,5.0,1,No,1608362916000,Yes,1452,Yes,,A,"['Accessible outside class', 'Inspirational', 'Hilarious']",people,person
Mandatory,good,good,good,0,31606757,0,,awesome,5,CS3331,"Expect to code in class. Almost every lecture he will explain a new concept and then you have to code it in class. He does help sometimes, but with many students I am sometimes stuck and can not get help. Make sure you finish those exercises outside of the lecture. Otherwise, he is great. I actually started enjoying to code after this course.",04/16/2019,4.0,4.0,,5,N/A,5.0,5.0,1,No,1555447504000,Yes,1452,Yes,,B,"['Inspirational', 'Amazing lectures ', 'Accessible outside class']",people,people
Mandatory,good,good,good,0,31422823,0,,awesome,5,CS3331,Omar is a great professor. He really made me enjoy CS very much. He explains the reasons why for the things we cover in class. I really wish to take more courses with him.,03/11/2019,4.0,4.0,,5,N/A,5.0,5.0,1,Yes,1552276350000,Yes,1452,Yes,,B,"['Gives good feedback', 'Amazing lectures ', 'Inspirational']",people,people
Mandatory,good,good,good,0,31332308,0,,awesome,5,CS3331,"This professor really really cares. He made want to learn. He always says, if you are not having fun, you are not learning. Great professor.",02/04/2019,4.0,4.0,,5,N/A,5.0,5.0,1,No,1549242068000,Yes,1452,Yes,,B,"['Gives good feedback', 'Accessible outside class', 'Respected']",people,people
Mandatory,good,average,good,0,27849044,0,,awesome,5,CS3331,Excellent prof.,02/22/2017,3.0,3.0,,5,N/A,5.0,5.0,1,Yes,1487782123000,Yes,1452,Yes,,N/A,"['Hilarious', 'Clear grading criteria', 'Caring']",people,people
Mandatory,good,poor,good,0,25422785,1,,awesome,5,CS396,"I did not do well in this course, but Omar helped me out a lot throughout the semester. He encouraged me to come to his office and he patiently went over many parts of the material. I would have definitely fail if it weren't for him. ADVICE: YOU NEED TO WORK HARD FROM DAY ONE. Assignments and midterms are not too difficult, but you must work hard.",11/16/2015,1.0,1.0,,5,Really into it,5.0,5.0,1,Yes,1447689643000,N/A,1452,Yes,,C,"['Inspirational', 'Amazing lectures ', 'Respected']",person,people
Mandatory,good,average,good,0,25201413,0,,awesome,5,PRINCIPLES301,"This is a talented professor who made the course like a story. He used to say, this is a 15-week long story of principles of languages. This course was truly inspirational (if u like math like me). THANK YOU PROFESSOR OMAR SOOO MUCH.. ",09/21/2015,3.0,3.0,,5,It's my life,5.0,5.0,1,Yes,1442864779000,Yes,1452,Yes,,A,"['Lots of homework', 'Inspirational']",people,people
Not Mandatory,good,poor,good,0,24331450,0,,awesome,5,AUTOMETA,"Excellent professor, passionate about teaching and very motivating.",01/26/2015,1.0,1.0,,5,It's my life,5.0,5.0,1,Yes,1422262875000,N/A,1452,Yes,,B,[],people,people
N/A,good,good,good,0,22894347,0,,awesome,5,CS396,Excellent..,03/07/2014,4.0,4.0,,5,It's my life,5.0,5.0,3,Yes,1394211802000,N/A,1452,N/A,,N/A,[],people,people
Not Mandatory,good,average,good,0,22893678,0,,awesome,5,CS396,"Very very good course and very very good professor. I am happy I took this course with him. I totally enjoyed every lecture, and also learned a lot.",03/07/2014,3.0,3.0,,5,It's my life,5.0,5.0,1,Yes,1394193770000,N/A,1452,N/A,,N/A,[],people,people
N/A,good,average,good,0,22893673,0,,awesome,5,CS396,"I took principles of programming with Omar. Excellent professor, I strongly recommend him. However, his midterm was a bit too difficult, but he is also fair with grading.",03/07/2014,3.0,3.0,,5,It's my life,5.0,5.0,1,Yes,1394193644000,N/A,1452,N/A,,N/A,[],people,people
Not Mandatory,good,average,good,0,22892676,0,,awesome,5,CS136,"Short review: Excellent. Detailed review: This professor makes you love the topic, and enjoy learning. He explains WHY we are being taught something from his own experience and from relevant current events. Once you understand why, you become motivated to learn. The brilliance is also in how the relevance is explained.  I STRONGLY recommend him.",03/06/2014,3.0,3.0,,5,It's my life,5.0,5.0,1,Yes,1394147188000,N/A,1452,N/A,,B+,[],people,people
N/A,good,average,good,0,22866128,0,,awesome,5,CS396,"Very happy I took a course with Omar. Here really made me like and enjoy learning. He directly and indirectly makes the material interesting and relevant. His approach is to make you like the topic, understand why it is important, and then teach it. I feel he genuinely cares.. I simply recommend ANY course with him..",02/25/2014,2.0,2.0,,5,It's my life,5.0,5.0,3,Yes,1393338812000,N/A,1452,N/A,,N/A,[],people,people
Not Mandatory,good,average,good,0,22294517,0,,awesome,5,CSI3104,Simply the greatest professor ever. He makes the material easy. He is patient and tries different approaches to teach the material. He is funny too. Lectures are a lot of fut to attend. I never missed a single lecture even though he does not take attendance.,11/11/2013,3.0,3.0,,5,It's my life,5.0,5.0,1,Yes,1384196403000,N/A,1452,N/A,,N/A,[],people,people
N/A,good,average,good,0,22143695,0,,awesome,5,CSI3104,"I wish all professors were like Omar. He make us passionate about the subject of the course. He is fun and I enjoy going to each class. He starts off with something interesting and slowly transitions into the topic. The assignments are some what long, but if you do them, then you are pretty much ready for the exams.",09/27/2013,3.0,3.0,,5,It's my life,5.0,5.0,1,Yes,1380283607000,N/A,1452,N/A,,N/A,[],people,people
N/A,good,average,good,0,22041094,0,,good,4,CSI3104,"Very nice guy, great attitude, funny.  Knowledgable, but sometimes a little bit unprepared to present the material.  Assignments were on the easy side but they did cover the material, exams were fair, if you know the material you'd do fine.  Refreshing to have a prof that doesn't seem to want to trick you or play games.",08/09/2013,2.0,2.0,,4,Sorta interested,4.0,4.0,1,No,1376073453000,N/A,1452,N/A,,N/A,[],people,people
N/A,good,average,good,0,22001146,0,,awesome,5,CSI3104,Excellent teacher!,07/26/2013,2.0,2.0,,5,It's my life,5.0,5.0,1,No,1374878369000,N/A,1452,N/A,,N/A,[],people,people
N/A,good,average,good,0,21963244,0,,awesome,5,CSI3104,Excellent professor. He made me love going to class. I strongly recommend him.,07/12/2013,2.0,2.0,,5,It's my life,5.0,5.0,1,Yes,1373592902000,N/A,1452,N/A,,N/A,[],people,people
N/A,good,average,good,0,21961225,0,,awesome,5,CSI3104,Really excellent prof. He makes the subject relevant and interesting. I enjoyed almost every lecture. He also seems to really care about the students. He encouraged us to focus on learning rather than focusing on the grades. I would definitely recommend this professor.,07/11/2013,2.0,2.0,,5,It's my life,5.0,5.0,1,Yes,1373544975000,N/A,1452,N/A,,N/A,[],people,people
N/A,good,average,good,0,21917085,0,,good,4,CSI3104,"Good, honest fellow. You can tell that he is a new professor, which is good and bad at the same time since he isn't the most experienced in this course (Formal languages) but is willing to answer questions and does not have a strong accent. I recommend him over other professors.",06/23/2013,2.0,2.0,,4,Really into it,4.0,4.0,1,Yes,1372011057000,N/A,1452,N/A,,N/A,[],people,people
N/A,good,average,good,0,21864983,0,,awesome,5,CSI2120,Great professor. He makes the course interesting and I learned  lot in his course. I strongly recommend this professor.,06/05/2013,2.0,2.0,,5,Really into it,5.0,5.0,1,Yes,1370430644000,N/A,1452,N/A,,N/A,[],people,people
N/A,good,poor,good,0,21385049,0,,awesome,4,CSI2120,"A great prof! He starts all his lectures off with something funny or interesting, and then transitions that into the day's lecture. Very funny and engaging. Also worked hard to make sure we don't have to spend money we don't have to (ie. money on textbooks. He contacted the publishers for free textbooks. And we got it! Considerate, funny, engaging!",03/05/2013,1.0,1.0,,5,Low,4.5,4.5,1,No,1362474269000,N/A,1452,N/A,,N/A,[],people,people
