attendance,clarityColor,easyColor,helpColor,helpCount,id,notHelpCount,onlineClass,quality,rClarity,rClass,rComments,rDate,rEasy,rEasyString,rErrorMsg,rHelpful,rInterest,rOverall,rOverallString,rStatus,rTextBookUse,rTimestamp,rWouldTakeAgain,sId,takenForCredit,teacher,teacherGrade,teacherRatingTags,unUsefulGrouping,usefulGrouping
N/A,poor,average,average,0,16721537,0,,average,1,FEM2507,"It was hard to understand her. She was teaching in French (which is NOT her first language and maybe not even her second. However, she is very helpful when you ask questions. She knows her stuff but there is a language barrier. Over all: Great person, mediocre teaching. If the class was taught in English it would have made all the difference!",01/13/2010,2.0,2.0,,5,Sorta interested,3.0,3.0,1,No,1263387908000,N/A,1452,N/A,,N/A,[],people,people
N/A,poor,good,poor,0,16538781,0,,poor,1,FEM2507,"This class is a disaster. She can not speak french to save her life. All she does is read a million sheets of paper. She posts her slides online, but they are very difficult to understand. Very poor in french grammar.Her powerpoints are just an infinate amount of statistics. She is a very nice person, but she shouldnt be teaching people in french",12/12/2009,4.0,4.0,,2,It's my life,1.5,1.5,1,Yes,1260648556000,N/A,1452,N/A,,N/A,[],people,people
N/A,average,good,poor,0,16423494,0,,poor,2,CDN3301,She was really hard to follow sometimes! All she did was read numbers from her endless sheets. She did nothing but read us her lecture notes. Then we watched outdated movies about women's issues! The films she showed were so old and irrelevant! It was hard to concentrate in her class when all she did was read stats from her page!,11/24/2009,4.0,4.0,,1,Sorta interested,1.5,1.5,1,Yes,1259079127000,N/A,1452,N/A,,N/A,[],people,people
N/A,good,good,good,0,14115579,0,,awesome,4,FEMFEM,"She's lovely. Kind and open, and really knows her stuff.",02/23/2008,4.0,4.0,,5,Sorta interested,4.5,4.5,1,Yes,1203805781000,N/A,1452,N/A,,N/A,[],people,people
N/A,average,good,average,0,11570223,0,,poor,2,FEM,Boring Boring Borign lecturer.  Sits in a chair and reads right off her paper.,03/14/2006,4.0,4.0,,2,Meh,2.0,2.0,1,N/A,1142328742000,N/A,1452,N/A,,N/A,[],people,people
N/A,poor,good,poor,0,11390928,0,,awful,1,WOMENSCIENCE,"I walked into this class on the first day and left 45 mins later.  Her expectations for a 2nd yr class are ridiculous.  You had about 4 papers, discussion groups and a presentation.  It was more like a fourth year of graduate level course. She was also a bit arrogant, warning not to plagerize because she was so well read.  What professor isn't&#63;",01/19/2006,5.0,5.0,,1,It's my life,1.0,1.0,1,N/A,1137690994000,N/A,1452,N/A,,N/A,[],people,people
N/A,good,average,good,0,1696039,0,,awesome,4,FEM,she gets so worked up about science! It's unlike anything you'll ever see!,02/07/2004,3.0,3.0,,5,N/A,4.5,4.5,1,N/A,1076153479000,N/A,1452,N/A,,N/A,[],people,people
