attendance,clarityColor,easyColor,helpColor,helpCount,id,notHelpCount,onlineClass,quality,rClarity,rClass,rComments,rDate,rEasy,rEasyString,rErrorMsg,rHelpful,rInterest,rOverall,rOverallString,rStatus,rTextBookUse,rTimestamp,rWouldTakeAgain,sId,takenForCredit,teacher,teacherGrade,teacherRatingTags,unUsefulGrouping,usefulGroupingN/A,poor,good,poor,0,1571458,0,,awful,1,CMN1120,Provides pratically no explanations of terms and speaks as if you are already an expert in the domain.  Not very helpful.  Tests and midterms do not fairly represent what was taught in class.  Boring-bring a pillow.  Not easy.,01/03/2004,4.0,4.0,,1,N/A,1.0,1.0,1,N/A,1073169026000,N/A,1452,N/A,,N/A,[],people,people
N/A,good,average,good,0,1482391,0,,awesome,5,CMN1120,"As a second year student taking a first year class, I have a little more experience than some of the other people who are rating this professor.  The slides are useful as study aides, but to do well in the course, you have to go to class.  Good course!",12/11/2003,3.0,3.0,,5,N/A,5.0,5.0,1,N/A,1071132614000,N/A,1452,N/A,,N/A,[],people,people
N/A,poor,good,average,0,1291113,0,,poor,1,CMN1120,"So boring!  And really, what is with those Powerpoint slides&#63;!!",11/10/2003,4.0,4.0,,3,N/A,2.0,2.0,1,N/A,1068425696000,N/A,1452,N/A,,N/A,[],people,people
N/A,average,average,average,0,1258225,0,,poor,2,CMN1120,"boring lecture. everything on powerpoint, so there is no point of going to class.",11/04/2003,3.0,3.0,,2,N/A,2.0,2.0,1,N/A,1067907025000,N/A,1452,N/A,,N/A,[],people,people
N/A,good,average,good,0,1163518,0,,good,4,CMN1120,No Comments,10/01/2003,2.0,2.0,,4,N/A,4.0,4.0,1,N/A,1065029820000,N/A,1452,N/A,,N/A,[],people,people
N/A,average,good,average,0,998917,0,,poor,2,CMN1102,The reason why University sucks. Hire better professors,06/04/2003,4.0,4.0,,2,N/A,2.0,2.0,1,N/A,1054734412000,N/A,1452,N/A,,N/A,[],people,people
N/A,good,average,good,0,802160,0,,good,4,CMN3130,"Good prof. I like professors that work in the field, they offer a deeper insight into the business of communications.  I just wish he could extend his insights from the public service.",04/08/2003,3.0,3.0,,4,N/A,4.0,4.0,1,N/A,1049762969000,N/A,1452,N/A,,N/A,[],people,people
N/A,good,average,average,0,751953,0,,good,4,CMN3133,No Comments,03/27/2003,3.0,3.0,,3,N/A,3.5,3.5,1,N/A,1048770128000,N/A,1452,N/A,,N/A,[],people,people
N/A,poor,good,poor,0,688259,0,,awful,1,CMN1120,No Comments,03/08/2003,4.0,4.0,,1,N/A,1.0,1.0,1,N/A,1047145217000,N/A,1452,N/A,,N/A,[],people,people
N/A,average,average,good,0,648713,0,,good,3,CMN1120,"He's reasonable, the best way to keep from being bored in his class is to get involved in discussion",02/27/2003,3.0,3.0,,5,N/A,4.0,4.0,1,N/A,1046385761000,N/A,1452,N/A,,N/A,[],people,people
N/A,good,average,average,0,619330,0,,good,4,CMN1120,No Comments,02/23/2003,3.0,3.0,,3,N/A,3.5,3.5,1,N/A,1046014137000,N/A,1452,N/A,,N/A,[],people,people
N/A,average,poor,average,0,487631,0,,average,2,CMN1120,Esay P : He's for me. Boring...but....esay.,01/12/2003,1.0,1.0,,3,N/A,2.5,2.5,1,N/A,1042386607000,N/A,1452,N/A,,N/A,[],people,people
N/A,good,good,good,0,486794,0,,awesome,4,CMN1120,"Fast paced, stimulating class with exposures to different viewpoints.",01/11/2003,4.0,4.0,,5,N/A,4.5,4.5,1,N/A,1042314581000,N/A,1452,N/A,,N/A,[],people,people
N/A,average,good,average,0,403449,0,,average,3,CMN1120,If he only knew what he was talking about...it's a media class watch some tv,12/07/2002,4.0,4.0,,2,N/A,2.5,2.5,1,N/A,1039259117000,N/A,1452,N/A,,N/A,[],people,people
N/A,average,good,average,0,383922,0,,average,3,CMN1150,"entertaining, not very good in one-to-one cmn",12/01/2002,4.0,4.0,,2,N/A,2.5,2.5,1,N/A,1038769573000,N/A,1452,N/A,,N/A,[],people,people
N/A,good,average,good,0,357845,0,,awesome,5,CMN1120,"fairly stimulating, but a bit of an unfair marker.  sorry.",11/20/2002,3.0,3.0,,5,N/A,5.0,5.0,1,N/A,1037752483000,N/A,1452,N/A,,N/A,[],people,people
N/A,poor,good,poor,0,303634,0,,awful,1,CMN3130,"Unclear, evasive, rambles and direction-less. Very pro govt and govt orientated.",10/24/2002,4.0,4.0,,1,N/A,1.0,1.0,1,N/A,1035468541000,N/A,1452,N/A,,N/A,[],people,people
Mandatory,average,average,average,0,302594,0,,average,3,COM,it's Easy-P!! or is he from the Cosby show&#63;,10/23/2002,3.0,3.0,,3,N/A,3.0,3.0,1,N/A,1035410465000,N/A,1452,N/A,,A,[],people,people
N/A,good,good,good,0,286588,0,,awesome,5,CMN3155,"If you came to University to work and learn, he's your man",10/11/2002,4.0,4.0,,5,N/A,5.0,5.0,1,N/A,1034345092000,N/A,1452,N/A,,N/A,[],people,people
Not Mandatory,good,average,average,0,211231,0,,good,4,CMN1120,Difficult course but relevant information to know and excellent teaching style!,05/15/2002,2.0,2.0,,3,N/A,3.5,3.5,1,N/A,1021461270000,N/A,1452,N/A,,A,[],people,people
N/A,average,average,average,0,137778,0,,average,3,1120,he is ok but i think he is a bit too boring,03/16/2002,2.0,2.0,,3,N/A,3.0,3.0,1,N/A,1016278065000,N/A,1452,N/A,,N/A,[],people,people
N/A,poor,average,poor,0,91958,0,,poor,1,CMN3130,"Obviously, he did not PLAN for PLANNING",02/04/2002,3.0,3.0,,2,N/A,1.5,1.5,1,N/A,1012866609000,N/A,1452,N/A,,N/A,[],people,people
N/A,poor,good,poor,0,53816,0,,awful,1,CMN3130,"Boring, unreasonable, arrogant.  Do not take this class",11/02/2001,4.0,4.0,,1,N/A,1.0,1.0,1,N/A,1004712819000,N/A,1452,N/A,,N/A,[],people,people
