attendance,clarityColor,easyColor,helpColor,helpCount,id,notHelpCount,onlineClass,quality,rClarity,rClass,rComments,rDate,rEasy,rEasyString,rErrorMsg,rHelpful,rInterest,rOverall,rOverallString,rStatus,rTextBookUse,rTimestamp,rWouldTakeAgain,sId,takenForCredit,teacher,teacherGrade,teacherRatingTags,unUsefulGrouping,usefulGrouping
Mandatory,poor,good,poor,0,35932972,0,,awful,1,CML2712,All lectures are asynchronous and recycled from the previous year. Complicated topics are covered in minimal detail. Synchronous online content only involves doing practice questions; participation is mandatory. No one in the class really understands how to answer his practice questions. It is awkward and uncomfortable. Avoid.,03/14/2022,5.0,5.0,,1,N/A,1.0,1.0,1,N/A,1647225476000,N/A,0,Yes,,N/A,[],people,people
Mandatory,poor,good,poor,0,34994990,0,,awful,1,CML1108,By far the worse professor I have ever had. His condescending attitude towards students shows how little he really cares.,07/30/2021,5.0,5.0,,1,N/A,1.0,1.0,1,Yes,1627611475000,No,1452,Yes,,N/A,[],people,people
Not Mandatory,poor,good,poor,0,34907863,0,,awful,1,CML1108,Really felt like he didnt care. Agree with previous commenters that his expectations are completely unclear. Would not recommend.,06/11/2021,4.0,4.0,,1,N/A,1.0,1.0,1,Yes,1623417281000,No,1452,Yes,,N/A,[],people,people
Mandatory,poor,good,poor,1,34876090,0,,awful,1,CML2712,"I had this professor for a French Online Course. Easily the worst class I took in my third year of law school. The prof is not clear on his expectations for the students and didn't answer questions adequately. The teacher didn't seem to care about his students/class. If possible, take the mandatory administrative law course with another prof.",05/31/2021,5.0,5.0,,1,N/A,1.0,1.0,1,Yes,1622424402000,No,1452,Yes,,N/A,[],people,person
N/A,poor,good,poor,3,20884071,1,,awful,1,CML1108,"Awful professor.  Snooty attitude.  Went through 65-70 slides each class, couldnt answer questions and completely unclear about expectations for his students.",11/26/2012,5.0,5.0,,1,Sorta interested,1.0,1.0,1,Yes,1353888409000,N/A,1452,N/A,,N/A,[],person,people
