attendance,clarityColor,easyColor,helpColor,helpCount,id,notHelpCount,onlineClass,quality,rClarity,rClass,rComments,rDate,rEasy,rEasyString,rErrorMsg,rHelpful,rInterest,rOverall,rOverallString,rStatus,rTextBookUse,rTimestamp,rWouldTakeAgain,sId,takenForCredit,teacher,teacherGrade,teacherRatingTags,unUsefulGrouping,usefulGrouping
Not Mandatory,good,average,good,0,33439714,1,,awesome,5,MCG4152,best course ever!,06/16/2020,3.0,3.0,,5,N/A,5.0,5.0,1,No,1592311168000,Yes,1452,Yes,,A+,[],person,people
N/A,good,average,good,0,32881648,1,,awesome,5,MCG4152,"if biomedical is your think , this class is the best!",01/31/2020,3.0,3.0,,5,N/A,5.0,5.0,1,No,1580440938000,Yes,1452,Yes,,N/A,[],person,people
Mandatory,good,good,good,0,32199123,0,,good,4,MCG3143,"Learn a lot in this class. She is very nice when you go see her at her office. The course requires that you really understand the material, and the exams reflect this. Inconsistent teaching style, usually passionate, but some days quite boring...",08/27/2019,4.0,4.0,,4,N/A,4.0,4.0,1,No,1566877519000,Yes,1452,Yes,,N/A,"['Caring', 'Lecture heavy']",people,people
Not Mandatory,average,good,average,1,31591809,0,,poor,2,MCG3143,"one of the worst classes I've taken, unorganized, lack of examples, and unclear what will be tested. Nice/smart but just not a great teacher.",04/15/2019,4.0,4.0,,2,N/A,2.0,2.0,1,No,1555290637000,No,1452,Yes,,N/A,[],people,person
Mandatory,average,good,average,1,28649304,0,,poor,2,MCG4152,"She is unusual  to say the least. She has a lot of difficulty transmitting the appropriate material. She teaches the very basic and then asks for the moon on the exams! Very very tough exams, usual average of like 50%. Go to the tutorials or you'll never pass! She is very nice and understanding though. Smart woman just not the best at teaching.",08/30/2017,4.0,4.0,,2,N/A,2.0,2.0,1,No,1504100423000,No,1452,Yes,,N/A,[],people,person
