attendance,clarityColor,easyColor,helpColor,helpCount,id,notHelpCount,onlineClass,quality,rClarity,rClass,rComments,rDate,rEasy,rEasyString,rErrorMsg,rHelpful,rInterest,rOverall,rOverallString,rStatus,rTextBookUse,rTimestamp,rWouldTakeAgain,sId,takenForCredit,teacher,teacherGrade,teacherRatingTags,unUsefulGrouping,usefulGrouping
Mandatory,average,average,average,0,34790886,0,,average,3,ADM4337,"His lectures are really engaging. However, it is ironic that as someone who preaches the importance of being open to change, he is surprisingly not very welcoming of new ideas himself.",05/14/2021,3.0,3.0,,3,N/A,3.0,3.0,1,Yes,1620966547000,No,1452,Yes,,A,"['Amazing lectures ', 'Participation matters', 'Group projects']",people,people
Mandatory,poor,good,poor,0,34532566,0,,awful,1,MBA5265,very frustrating experience. treats subjective and creative topics as if there is a perfect answer. better know exactly what he's thinking or you will lose marks. studying is counter productive because examples given in class (i.e. vision statements) are not representative of what is considered a good answer. so good luck.,04/11/2021,4.0,4.0,,1,N/A,1.0,1.0,1,Yes,1618151508000,No,1452,Yes,,N/A,['Tough grader'],people,people
Not Mandatory,good,average,good,1,31243834,1,,awesome,5,ADM1100,Attend lectures and take notes. Amazing class discussions that practically cover all of exam material. Easy marking for projects.,01/11/2019,2.0,2.0,,5,N/A,5.0,5.0,1,Yes,1547218745000,Yes,1452,Yes,,A,['Amazing lectures '],person,person
Not Mandatory,good,average,good,1,31217009,1,,good,4,ADM1100,"Peter Lloyd is a great prof, even though lectures are 3 hours long, he makes them more interesting by getting the class to do little ice breakers kinda. He also gives great feedback on assignments, and is willing to talk about business ideas outside of class. Class itself is pretty interesting but the assignment essays were long.",01/07/2019,3.0,3.0,,4,N/A,4.0,4.0,1,No,1546894501000,Yes,1452,Yes,,N/A,"['Accessible outside class', 'Gives good feedback']",person,person
N/A,good,average,good,2,31209144,4,online,awesome,5,ADM1100,"Prof Peter Lloyd is one of the best profs Ive ever had. As a 3rd yr student, Ive had a plethora of profs &amp; his teaching style is by far the best. His anecdotal-discussion style is not only informative but actually engaging! Youll look forward to each class-covers exam&amp;test material in class, so youre set! Get ready for great grades &amp; learning!",01/06/2019,3.0,3.0,,5,N/A,5.0,5.0,1,Yes,1546797965000,Yes,1452,Yes,,N/A,"['Inspirational', 'Amazing lectures ', 'Accessible outside class']",people,people
Not Mandatory,good,average,good,3,31206687,0,,awesome,5,ADM1100,"Lectures were long but the professor let us out early sometimes, he cares about the student and is always there to help. It is a very interesting and informative class especially with the professors vast experience in many fields. Assignments (projects) were long and tedious but were marked fairly.",01/06/2019,3.0,3.0,,5,N/A,5.0,5.0,1,Yes,1546733638000,Yes,1452,No,,Not sure yet,"['Group projects', 'Amazing lectures ', 'Caring']",people,people
Mandatory,good,average,good,10,31205356,3,,awesome,5,ADM1100,"Peter Lloyd was an outstanding professor who really cares about his students. He will answer any question you have about the course. The assignments were long but if you put in the effort, he graded them very fairly. I would take Peter for another class in the future!",01/05/2019,2.0,2.0,,5,N/A,5.0,5.0,1,Yes,1546713358000,Yes,1452,Yes,,B+,"['Amazing lectures ', 'Accessible outside class', 'Caring']",people,people
Not Mandatory,poor,good,poor,3,31147844,4,,awful,1,ADM1100,"He is a new prof and doesn't really teach, he just reads the slides and talks about one slide for 50 minutes about his work experience. Wouldn't recommend his class as an elective.",12/24/2018,4.0,4.0,,1,N/A,1.0,1.0,3,No,1545623257000,No,1452,Yes,,Not sure yet,['Tough grader'],people,people
