attendance,clarityColor,easyColor,helpColor,helpCount,id,notHelpCount,onlineClass,quality,rClarity,rClass,rComments,rDate,rEasy,rEasyString,rErrorMsg,rHelpful,rInterest,rOverall,rOverallString,rStatus,rTextBookUse,rTimestamp,rWouldTakeAgain,sId,takenForCredit,teacher,teacherGrade,teacherRatingTags,unUsefulGrouping,usefulGrouping
Not Mandatory,good,good,good,0,28461702,0,,good,4,ECO2142,He is a great teacher and was able to make a really condensed and heavy material extremely clearly in an extremely short period of time.,06/17/2017,4.0,4.0,,4,N/A,4.0,4.0,1,No,1497662535000,Yes,1452,Yes,,B+,[],people,people
N/A,good,average,good,0,28460627,0,,awesome,5,ECO2142,"Coulombe's lectures are the best lectures I've experienced, he's engaging, concise, and great at conveying the subject matter. He makes sure to clearly outline what concepts you need to understand for his exam, and he's always available if you have any questions.",06/16/2017,3.0,3.0,,5,N/A,5.0,5.0,1,Yes,1497632401000,Yes,1452,Yes,,A+,"['Amazing lectures ', 'Caring', 'Clear grading criteria']",people,people
N/A,good,good,good,0,27860821,0,,awesome,5,ECO1501,"I would highly recommend this prof, especially for any French Immersion students! Great lectures with clear content, and engaging enough that it's not hard to pay attention and learn. That's not to say it's a super easy course; it still requires a considerable amount of work, but if you do it, you're golden. Again, absolutely outstanding prof.",02/27/2017,4.0,4.0,,5,N/A,5.0,5.0,1,Yes,1488208378000,Yes,1452,Yes,,A+,"['Respected', 'Amazing lectures ']",people,people
N/A,good,average,good,0,27702978,0,,good,4,ECO1504,Serge est un bon professeur et il explique très bien les concepts. Il n'y a pas de surprises sur les examens; il explique bien d'avance ce qui sera présent.,01/09/2017,3.0,3.0,,4,N/A,4.0,4.0,1,Yes,1483989912000,Yes,1452,Yes,,A+,['Amazing lectures '],people,people
Not Mandatory,average,average,average,1,27496933,1,,poor,2,ECO1504,"Didn't like the teaching  but the class is relatively easy. Read your textbook and do couple exercises and you should be fine. Watch out for true or false on exams, he tries to trick you with double negations",12/14/2016,3.0,3.0,,2,N/A,2.0,2.0,1,Yes,1481741007000,No,1452,Yes,,A-,['Get ready to read'],person,person
Not Mandatory,good,average,good,1,27458338,0,,good,4,ECO1504,"Prof is amazing. His lectures, although they can get a bit repetitive at times, are useful and interesting. Midterms and exam are fair as long as you put in the work and study. Great prof to have for French Immersion students -- easy to understand. 10/10 would recommend.",12/12/2016,3.0,3.0,,4,N/A,4.0,4.0,1,Yes,1481583799000,Yes,1452,Yes,,A,"['Clear grading criteria', 'Respected', 'Amazing lectures ']",people,person
Not Mandatory,good,average,good,2,27335949,0,,awesome,5,ECO1504,"Monsieur Coulombe est un excellent professeur qui explique très bien son cours, il se refaire au livre pour ce qui est des exemples mais l'explique à sa façon ce qui aide beaucoup à la compréhension. Ses exams sont assez long mais très facile si tu as suivis en classe ou lu au moins le livre. Bravo à ce professeur!",12/05/2016,2.0,2.0,,5,N/A,5.0,5.0,1,Yes,1480947649000,Yes,1452,N/A,,A,"['Amazing lectures ', 'Gives good feedback', 'Accessible outside class']",people,people
Not Mandatory,average,good,average,2,27307716,1,,poor,2,ECO1504,"He does not care about his students success. He writes his multiple choices to purposely trick you into choosing the wrong answer. If you do not like multiple choices, dont take his class. If you do like multiple choices, dont take his class either.",12/01/2016,4.0,4.0,,2,N/A,2.0,2.0,1,Yes,1480634370000,No,1452,Yes,,N/A,[],person,people
N/A,good,average,good,0,26923272,0,,awesome,5,ECO3552,"Great prof, lectures were always very engaging.  No course notes/slides/textbook, just handwritten notes on the blackboard to accompany oral lectures. Very good at conveying material, and exams were based on lectures and blackboard notes only.",08/23/2016,3.0,3.0,,5,N/A,5.0,5.0,1,No,1471951831000,Yes,1452,Yes,,A+,"['Hilarious', 'Tough grader']",people,people
Not Mandatory,poor,good,poor,2,25931582,0,,poor,1,ECO1504,"I found his lectures confusing and relied on the textbook. There is minimal work involved, but beware of the multiple choice exams, they are not as easy as they sound.",01/13/2016,4.0,4.0,,2,Meh,1.5,1.5,1,Yes,1452646507000,N/A,1452,Yes,,N/A,[],people,people
Not Mandatory,good,average,good,1,25919121,0,,good,4,ECO1504,Really good teacher. Go to class because he gives examples that are on the tests. Lectures are long but he makes them somewhat interesting. You can tell that he knows what he's talking about and he's there for you if you need help (email).,01/11/2016,2.0,2.0,,4,Really into it,4.0,4.0,1,Yes,1452524537000,Yes,1452,Yes,,A+,"['Inspirational', 'Caring']",people,person
Not Mandatory,good,average,good,0,25917721,0,,awesome,5,ECO1504,"I loved economics. I didn't use the textbook because, for me, the powerpoint and notes in class were enough. I recommend you go to class cuz he gives really great examples in class and very pertinent notes. He gives lots of answer for the mid term and final so go. He is also really passionate about the material he teaches so the lectures are ok.",01/11/2016,2.0,2.0,,4,Really into it,4.5,4.5,1,No,1452515644000,Yes,1452,Yes,,A+,['Clear grading criteria'],people,people
Mandatory,good,poor,good,0,25872258,0,,good,4,ECO1504,"Really easy tests, if you go to class or read the book, you'll get a good grade.",01/04/2016,1.0,1.0,,4,Really into it,4.0,4.0,1,Yes,1451921361000,Yes,1452,Yes,,A+,"['Clear grading criteria', 'Amazing lectures ']",people,people
Not Mandatory,average,good,average,0,25830934,0,,average,2,ECO3552,The prof does not have powerpoint nor follows the textbook. All notes on written in class so if you skip class you are screwed. Hilarious prof connects economics theories and current events. Very knowledgeable although not the most organized or clear notes.,12/27/2015,4.0,4.0,,4,It's my life,3.0,3.0,1,No,1451214581000,N/A,1452,Yes,,B+,"['Tough grader', 'Inspirational']",people,people
Mandatory,good,average,good,0,25768068,0,,awesome,5,ECO1504,Serge is very entertaining and knowledgeable man! He gives good examples and makes microeconomics much funner than it is. He is also clear about what needs to be studied/understood for exams and his exams reflect what you learn very well. I'd recommend him to anyone,12/18/2015,2.0,2.0,,4,It's my life,4.5,4.5,1,Yes,1450480758000,N/A,1452,Yes,,A+,"['Hilarious', 'Get ready to read', 'Amazing lectures ']",people,people
Not Mandatory,average,good,average,2,25237522,0,,poor,2,ECO1504,Terrible. Boring. I fall asleep every class. But he's very knowledgeable,10/08/2015,5.0,5.0,,2,Meh,2.0,2.0,1,Yes,1444312345000,N/A,1452,Yes,,N/A,"['Lecture heavy', 'Get ready to read']",people,people
N/A,good,average,average,0,24729478,0,,good,4,ECO1501,"He's average. All i did was pay attention to the lectures and didn't have to do much readings. But on the other hand, my friend who didn't go to class just read all the chapters and got the same grade as me so basically you don't have to go to class, but it'll help for the exemples he gives in class.",05/03/2015,3.0,3.0,,3,Sorta interested,3.5,3.5,1,No,1430695440000,N/A,1452,Yes,,B,"['Get ready to read', 'Participation matters']",people,people
N/A,good,average,good,0,24144386,0,,awesome,5,ECO3552,Put in the work and you'll do great ,12/19/2014,3.0,3.0,,5,Really into it,5.0,5.0,1,No,1418985018000,N/A,1452,Yes,,N/A,"['Amazing lectures ', 'Inspirational', 'Hilarious']",people,people
N/A,average,average,average,2,24141336,0,,good,3,ECO1504,"Very good professor. He is able to explain properly what needs to be learned and gives good exemples. II found his course interesting and he answers well to questions. To get good grades, read the book and the do the excercises in the book. He is very clear on how the exams will be and what he is expecting. ",12/18/2014,2.0,2.0,,4,Really into it,3.5,3.5,1,Yes,1418946755000,Yes,1452,Yes,,B+,"['Clear grading criteria', 'Hilarious']",people,people
N/A,good,average,average,0,24071949,0,,good,4,ECO1504,"Has dynamic teaching. I was actually kept interested throughout the lectures. However, make sure to not miss a class because the textbook isn't enough to fully understand the subject as he often goes farther and explain the concepts.  ",12/14/2014,3.0,3.0,,3,Really into it,3.5,3.5,1,Yes,1418552381000,Yes,1452,Yes,,N/A,['Amazing lectures '],people,people
Mandatory,good,average,good,0,23908493,0,,awesome,5,ECO3552,Probably the smartest prof I've had since I'm in the university. His lectures are extremely interesting but he expects the students to keep up. Work hard and you will do well. Long assignments but very interesting.,11/30/2014,3.0,3.0,,4,It's my life,4.5,4.5,1,No,1417357912000,N/A,1452,Yes,,A+,"['Respected', 'Tough grader']",people,people
N/A,good,average,good,2,23710475,1,,good,4,ECO1504,Bon prof! Très dynamique!,10/29/2014,2.0,2.0,,4,Really into it,4.0,4.0,1,Yes,1414584895000,Yes,1452,Yes,,A,['Amazing lectures '],person,people
Not Mandatory,good,average,good,0,22888404,0,,awesome,5,ECO1504,He is a great prof who makes class fun.  He speaks clearly and sets out clear expectations of students.  Exams are very fair.  Great prof for students in immersion.,03/05/2014,2.0,2.0,,5,It's my life,5.0,5.0,1,Yes,1394043886000,N/A,1452,N/A,,A-,[],people,people
N/A,good,average,good,1,21836279,0,,awesome,5,ECO2142,"He is better than the book (though you are better served by reading the textbook alongside his notes). He knows his material and is clearly passionate about it. He maintains the bridge between the material and the real world, and expects you, especially in exams, to understand the real world applications of theories and models. FUN CLASS!",05/28/2013,3.0,3.0,,5,Sorta interested,5.0,5.0,1,Yes,1369758610000,N/A,1452,N/A,,N/A,[],people,person
N/A,good,average,average,0,21062873,0,,good,4,ECO1504,"Great prof. Gives good explanations, but the only way you'll do well is if you read the textbook.",12/13/2012,3.0,3.0,,3,Sorta interested,3.5,3.5,1,Yes,1355434183000,N/A,1452,N/A,,N/A,[],people,people
N/A,good,average,good,0,20963681,0,,awesome,5,ECO1502,"Très bon prof! Donne d'excellentes explications! Il sait de quoi il parle, et si jamais tu ne comprends pas quelque chose, le livre est très utile! Ses examens peuvent être un peu difficile, mais si tu t'y prépares bien, aucun problème! :)",12/05/2012,2.0,2.0,,4,Sorta interested,4.5,4.5,1,Yes,1354742462000,N/A,1452,N/A,,N/A,[],people,people
N/A,good,average,good,0,20908928,0,,awesome,5,ECOA,EXCELLENT! best teacher ever!! il explique vrm bien! jle conseil a tout le monde! ses examens sont super facile! j'ai eu A+ dans son cours! J'ai adoré venir a ses cours!,11/29/2012,2.0,2.0,,5,Really into it,5.0,5.0,1,Yes,1354149785000,N/A,1452,N/A,,N/A,[],people,people
N/A,good,average,good,0,20695991,0,,awesome,5,ECO1504,Energetic and doesn't give boring lectures.,10/11/2012,2.0,2.0,,4,It's my life,4.5,4.5,1,Yes,1349996554000,N/A,1452,N/A,,N/A,[],people,people
N/A,average,average,average,1,19713010,0,,average,2,ECO1504,"Ce prof est très dynamique, même s'il a enseigné la microéconomie quand son expertise est la macroéconomie. Il faisait beaucoup d'erreurs dans ses explications alors le manuel est assez important d'avoir. Ces examens sont relativement faciles (80% choix multiples et 20% questions à court développement).",01/11/2012,3.0,3.0,,3,Sorta interested,2.5,2.5,1,Yes,1326310033000,N/A,1452,N/A,,N/A,[],people,person
N/A,good,poor,good,0,19361260,0,,awesome,5,ECO2143,"Great professor.  He explains the material very effectively.  He answers questions in class, and is very passionate about what he teaches. Sadly this course is about Keynes' theories, and the Prof Loves Paul Krugman (leftist).  But whether or not you agree with the theories, they are explained well.  Humor in class is also great.",12/02/2011,1.0,1.0,,4,Really into it,4.5,4.5,1,Yes,1322826831000,N/A,1452,N/A,,N/A,[],people,people
N/A,average,good,average,0,19185329,0,,average,3,ECO2143,"Very smart guy, knows his stuff. Assignments are hard and exams are tough, but marked fairly.",11/08/2011,4.0,4.0,,2,Low,2.5,2.5,1,Yes,1320751675000,N/A,1452,N/A,,N/A,[],people,people
N/A,good,average,good,0,18196262,0,,awesome,4,ECO2142,this guy is the man... great proff,01/30/2011,3.0,3.0,,5,Sorta interested,4.5,4.5,1,Yes,1296424701000,N/A,1452,N/A,,N/A,[],people,people
N/A,good,average,good,0,18028330,0,,awesome,5,ECO2142,"Great prof, makes things clear, and used course content in relation to modern economic events and circumstances particularly affecting the American economy. A very interesting course if you?re interested in what?s happening in the world since the recession.",12/22/2010,3.0,3.0,,4,Really into it,4.5,4.5,1,Yes,1293059420000,N/A,1452,N/A,,N/A,[],people,people
N/A,good,good,good,0,16086623,0,,good,4,ECO3599,thème choisi-dévellopement et croissance économique: Il est très intéressant et comprend bien la matière.  Il faut savoir pratiquement tout dans le manuel pour les intras.  Les questions pratiques dans le manuel aident bcp pour les intras.  J'ai bcp appris dans son cours : ),08/03/2009,4.0,4.0,,4,Really into it,4.0,4.0,1,Yes,1249262742000,N/A,1452,N/A,,N/A,[],people,people
N/A,average,good,poor,3,15390740,1,,poor,2,ECO6120,He is not helpful. Expects us to know most of the stuff before hand.,01/19/2009,5.0,5.0,,1,Really into it,1.5,1.5,1,Yes,1232377538000,N/A,1452,N/A,,N/A,[],person,people
N/A,good,average,good,0,11579363,0,,awesome,4,ECO2543,"L'enthousiasme à l'état brut. Toujours prêt à aider les étudiants, très intéressant à entendre. Peut-être moins clair en anglais, mais en français c'est super.",03/16/2006,3.0,3.0,,5,It's my life,4.5,4.5,1,N/A,1142510674000,N/A,1452,N/A,,N/A,[],people,people
N/A,poor,good,poor,0,10181788,1,,awful,1,ECO6003,No Comments,08/30/2005,5.0,5.0,,1,Meh,1.0,1.0,1,N/A,1125410622000,N/A,1452,N/A,,N/A,[],person,people
N/A,average,good,average,0,10111089,0,,poor,2,ECO,No Comments,08/10/2005,4.0,4.0,,2,Low,2.0,2.0,1,N/A,1123702942000,N/A,1452,N/A,,N/A,[],people,people
N/A,average,good,good,0,3454875,1,,good,3,ECO6130,He's not that bad,03/14/2005,4.0,4.0,,5,It's my life,4.0,4.0,1,N/A,1110816279000,N/A,1452,N/A,,N/A,[],person,people
N/A,average,average,average,0,377925,0,,average,3,ECO2543,No Comments,11/27/2002,2.0,2.0,,2,N/A,2.5,2.5,1,N/A,1038433521000,N/A,1452,N/A,,N/A,[],people,people
N/A,good,average,average,0,172573,0,,good,4,ECO2543,keeps our interests,04/11/2002,2.0,2.0,,3,N/A,3.5,3.5,1,N/A,1018555364000,N/A,1452,N/A,,N/A,[],people,people
