attendance,clarityColor,easyColor,helpColor,helpCount,id,notHelpCount,onlineClass,quality,rClarity,rClass,rComments,rDate,rEasy,rEasyString,rErrorMsg,rHelpful,rInterest,rOverall,rOverallString,rStatus,rTextBookUse,rTimestamp,rWouldTakeAgain,sId,takenForCredit,teacher,teacherGrade,teacherRatingTags,unUsefulGrouping,usefulGrouping
Mandatory,poor,good,poor,0,34429473,0,online,awful,1,HIS3195,"Terrible prof. No slideshows, long, tedious, readings. Had a discussion period for the lectures, and expected students to regurgitate the content of discussions for midterms. I was in a car accident in the middle of the semester and was unable to attend lectures and discussions for a week or two, and couldn't accommodate me at all. DO NOT TAKE.",03/11/2021,5.0,5.0,,1,N/A,1.0,1.0,1,Yes,1615491849000,No,1452,Yes,,N/A,"['Participation matters', 'Get ready to read']",people,people
N/A,good,good,good,0,32226040,0,,good,4,HIS2171,"This class is a lot of work but very interesting. As long as you do the readings and actively listen during lectures, you'll be fine. He wants you to be critical so don't just regurgitate someone else's thoughts when participating in class",09/12/2019,4.0,4.0,,4,N/A,4.0,4.0,1,Yes,1568321527000,Yes,1452,Yes,,A,"['Get ready to read', 'Lecture heavy']",people,people
Mandatory,poor,good,poor,0,31495788,0,,awful,1,DVM2350,"Extremely rude Prof. If you ask a reasonable question, he will look at you as though you are a child. AVOID THIS PROF AT ALL COST.",03/28/2019,4.0,4.0,,1,N/A,1.0,1.0,1,Yes,1553807206000,No,1452,Yes,,N/A,['Tough grader'],people,people
Mandatory,poor,good,poor,1,31385522,0,,awful,1,HIS2171,"Grading of analytical questions in exams is harsh (expects only his analysis from lectures to be regurgitated). Overall, he's a cranky, insufferable guy with a big ego who constantly whines about students' &quot;addiction&quot; to technology or about our general ignorance. His hostile, condescending attitude toward students makes for unpleasant lectures.",02/27/2019,4.0,4.0,,1,N/A,1.0,1.0,1,Yes,1551228974000,No,1452,Yes,,Not sure yet,"['Tough grader', 'Graded by few things']",people,person
N/A,poor,good,poor,2,29822856,0,,awful,1,HIS2171,"He has high expectations of the class - which are all fairly reasonable, despite being strict. However, he is extremely rude to students who don't know the answer to a question, a hard marker, and he does not give outlines for assignments. Avoid at all costs",04/17/2018,5.0,5.0,,1,N/A,1.0,1.0,1,Yes,1523977475000,No,1452,No,,N/A,"['Tough grader', 'Get ready to read']",people,people
Mandatory,good,good,good,3,27135542,3,,awesome,5,DVM2350,"Hard class, harder marker. Read everything, than read more. HOWEVER, kick ass proff and class, he is not interested in you regurgitating the textbook he wants you to have an opinion, think about the material and move beyond silver spoon academia.   Anarchic, left wing, political protester raised in Latin America during IMF restructuring.",11/05/2016,4.0,4.0,,5,N/A,5.0,5.0,1,Yes,1478379589000,Yes,1452,Yes,,A,"['Participation matters', 'Tough grader']",people,people
Mandatory,average,average,average,0,25777071,0,,good,3,HIS2170,"Overall a way better class than I expected. The professor really knows his material. If you want to get a good grade, going to class makes it 10x easier. The readings are also really essential and really informative. It is not a difficult class to pass if you attend lectures and listen to what the professor says! The TA was also excellent.",12/19/2015,3.0,3.0,,4,Really into it,3.5,3.5,1,Yes,1450564633000,Yes,1452,N/A,,A-,[],people,people
Mandatory,good,good,average,0,25586639,0,,good,4,HIS2170,"He obviously knows his stuff and the classes were interesting. He expects a lot from you in your exams, and you will use up all the time available and still might not cover everything he/the TA wants you to. I recommend the course because it was really interesting and I learned a lot, but it is definitely not a class you can coast through. ",12/08/2015,4.0,4.0,,3,Really into it,3.5,3.5,1,Yes,1449572892000,N/A,1452,Yes,,A-,['Get ready to read'],people,people
Not Mandatory,poor,good,poor,1,24975371,1,,poor,1,HIS2171,"He expected way more detail than was possible to fit into the 5 lines you were allowed to use for answers on midterms.  The expectations for the final paper was not clear enough.  As well he is quite rude, and had a bad attitude if any students got a bad mark.  SERIOUSLY, AVOID THIS GUY LIKE THE PLAGUE.   ",06/18/2015,5.0,5.0,,2,Sorta interested,1.5,1.5,1,Yes,1434588535000,N/A,1452,Yes,,N/A,"['Get ready to read', 'Tough grader']",person,person
Not Mandatory,average,good,average,1,24744671,0,,poor,2,HIS2171,"Florez might be a good prof at the graduate level, but was horrible for a 2nd year class. He doesn't teach, he expects you to have done all the readings for every class and then picks on people to answer. Really tough grader (gave some people 12% on 1st midterm). Asks for the ""wider context"" but only gives you 5 lines to answer. Avoid if possible.",05/05/2015,5.0,5.0,,2,Really into it,2.0,2.0,1,Yes,1430838016000,N/A,1452,Yes,,A,"['Tough grader', 'Get ready to read']",people,person
N/A,poor,good,average,1,22427526,0,,average,1,DVM2350,"If you love reading text books take this class! In the discussion groups he called on students to answer and would be very negative if they gave a mediocre answer. Certainly this man knows a lot. But if philosophy isn't your forte then don't bother. One-on-one he is very good, he takes the time to 'splain things. Nice guy, even gave me props once",12/03/2013,4.0,4.0,,4,Sorta interested,2.5,2.5,1,Yes,1386112878000,N/A,1452,N/A,,N/A,[],people,person
N/A,good,average,good,0,20025831,0,,good,4,HISA,He is so smart. Really great prof with amazing ideas.,04/10/2012,3.0,3.0,,4,Really into it,4.0,4.0,1,Yes,1334082077000,N/A,1452,N/A,,N/A,[],people,people
N/A,good,average,good,2,18679217,1,,awesome,5,MDG5195,Dr. Florez is the best professor I have ever had! His class was not easy b/c he did not expect his students to memorize information and repeat it back to him - he actually encouraged us to think and be analytical. I am now working as a development professional and I cannot thank him enough for teaching me about the dynamics of culture and power.,05/29/2011,3.0,3.0,,5,Really into it,5.0,5.0,1,Yes,1306713019000,N/A,1452,N/A,,N/A,[],person,people
N/A,good,average,good,0,17925071,0,,good,4,HIS4363,"Professor Florez is a very interesting man. The class was quite abstract, but once you grasp the concepts it is very interesting. He facilitates some interesting discussions and is always happy to help when you need it! Take his class if you want the opportunity to think about new things!",12/13/2010,3.0,3.0,,4,Really into it,4.0,4.0,1,Yes,1292198464000,N/A,1452,N/A,,N/A,[],people,people
N/A,good,poor,good,3,17049357,0,,good,4,HIS2171,Professor seems all over the place but if you actually listen and pay attention he has soo much to say and is extremely intelligent. midterms were easy and straight forward if you attended classes. Those who did poorly in his class either didn't pay attention or did not attend class. Final essay was also quite easy.,04/23/2010,1.0,1.0,,4,Really into it,4.0,4.0,1,Yes,1272042479000,N/A,1452,N/A,,N/A,[],people,people
N/A,poor,average,poor,1,17033042,0,,awful,1,HIS1110,"Any negative comment does more flattery to this guy than he deserves. What a joke. Not a single thing learned, and his hostile attitude didn't help the situation. Stay away.",04/21/2010,3.0,3.0,,1,Meh,1.0,1.0,1,Yes,1271855878000,N/A,1452,N/A,,N/A,[],people,person
N/A,good,good,good,0,16580495,0,,awesome,4,HIS2391,He is sometimes difficult to understand but the effort is worthwhile because he has a great deal of interesting and important things to say. He taught me a lot about being a good historian.,12/17/2009,4.0,4.0,,5,It's my life,4.5,4.5,1,Yes,1261012100000,N/A,1452,N/A,,N/A,[],people,people
N/A,average,good,good,0,16147763,0,,good,3,HIS3397,"Extremely helpful professor. If you get lost, see him during his office hours. I started out with a disastrous midterm, talked to him, and he explained his marking scheme. I ended up with an A. I really liked him!",08/24/2009,4.0,4.0,,5,Meh,4.0,4.0,1,No,1251141897000,N/A,1452,N/A,,N/A,[],people,people
N/A,average,average,average,0,15657037,0,,good,3,HIS2391,"A little unclear, but an excellent professor.",04/15/2009,2.0,2.0,,4,Meh,3.5,3.5,1,No,1239825038000,N/A,1452,N/A,,N/A,[],people,people
N/A,poor,good,poor,0,15398917,0,,awful,1,HIS2391,"waste of time. hard to understand, all over the place,",01/21/2009,4.0,4.0,,1,Sorta interested,1.0,1.0,1,Yes,1232549093000,N/A,1452,N/A,,N/A,[],people,people
N/A,average,average,average,0,15022223,0,,average,2,HIS1110,"the profs lectures did not relate to the textbook at all, and are boring as heck, the good thing is theres no tests, but a lot of writing, if you stick to what he wansts you sure to get a good mark",11/18/2008,2.0,2.0,,3,It's my life,2.5,2.5,1,No,1227050807000,N/A,1452,N/A,,N/A,[],people,people
N/A,average,average,average,0,14736177,0,,average,3,HIS1110,"Wow, worst class of the year. Though he knows what he's talking about, he does not believe in tests, rather weekly assignments and pop quizzes and several essays. He is very harsh with students as aforementioned, and difficult to understand at first. I would never recommend him to anyone.",08/12/2008,3.0,3.0,,2,Sorta interested,2.5,2.5,1,Yes,1218556089000,N/A,1452,N/A,,N/A,[],people,people
N/A,average,good,average,0,14730348,0,,poor,2,HIS1110,Steer clear! His lectures usually had little to nothing to do with the corresponding material in the textbook and were almost entirely pointless. He admitted he doesn't usually teach undergrad classes and it shows. He treated students very harshly in class when they didn't do anything wrong. I can safely say I learned almost nothing in this class.,08/10/2008,4.0,4.0,,2,Really into it,2.0,2.0,1,Yes,1218345729000,N/A,1452,N/A,,N/A,[],people,people
