attendance,clarityColor,easyColor,helpColor,helpCount,id,notHelpCount,onlineClass,quality,rClarity,rClass,rComments,rDate,rEasy,rEasyString,rErrorMsg,rHelpful,rInterest,rOverall,rOverallString,rStatus,rTextBookUse,rTimestamp,rWouldTakeAgain,sId,takenForCredit,teacher,teacherGrade,teacherRatingTags,unUsefulGrouping,usefulGroupingN/A,average,average,average,0,3029406,0,,poor,2,BIO31243153,I had to switch out of the class because she wasn't teaching course material...  She was doing a LAB course in a LECTURE and it was essentially quite useless info.  She doesn't answer questions (at least not a straightforward one) and her notes are vague.  The midterms were highly specific...,12/15/2004,3.0,3.0,,2,It's my life,2.0,2.0,1,N/A,1103110970000,N/A,1452,N/A,,N/A,[],people,people
N/A,good,average,good,0,2839081,0,,awesome,5,ELEGANT,"She is a fantastic professor, science students just complain alot because most of them have to get into med school, they're babies! I think she's nice and enthusiastic. Students should learn where they went wrong on midterms and try to improve, not complain all the time!",11/26/2004,3.0,3.0,,5,It's my life,5.0,5.0,1,N/A,1101487805000,N/A,1452,N/A,,N/A,[],people,people
Mandatory,good,average,average,0,2648239,0,,good,4,BIO3124,"She does repeat her slides: And her slides are straight from the text book.  The material we cover is easy, but she's REALLY picky on midterms, if you don't have EXACTLY what she wants, she takes of marks like crazy.  Plus, she's REALLY monotone.",11/04/2004,3.0,3.0,,3,Sorta interested,3.5,3.5,1,N/A,1099528165000,N/A,1452,N/A,,C,[],people,people
N/A,poor,average,poor,0,2639587,0,,awful,1,BIO3153,Shes useless her slides say nothing...its just her thoughts...and she never finishes...,11/02/2004,3.0,3.0,,1,Really into it,1.0,1.0,1,N/A,1099437382000,N/A,1452,N/A,,N/A,[],people,people
N/A,poor,average,poor,0,2617458,0,,poor,1,BIO3153,No Comments,10/29/2004,3.0,3.0,,2,Really into it,1.5,1.5,1,N/A,1099069100000,N/A,1452,N/A,,N/A,[],people,people
N/A,poor,good,poor,0,2540524,0,,awful,1,BIO3124,I went to her office asking her a question on the midterm; and she kicked me out :(,10/12/2004,5.0,5.0,,1,Meh,1.0,1.0,1,N/A,1097595153000,N/A,1452,N/A,,N/A,[],people,people
N/A,average,average,poor,0,2518505,0,,poor,2,BIO3124,"Doesn't teach at all, repeats the slide, and is not clear at all.  I taught myself everything in the course.  Probably brilliant, but not good at teaching it!",10/04/2004,2.0,2.0,,1,It's my life,1.5,1.5,1,N/A,1096925778000,N/A,1452,N/A,,N/A,[],people,people
