attendance,clarityColor,easyColor,helpColor,helpCount,id,notHelpCount,onlineClass,quality,rClarity,rClass,rComments,rDate,rEasy,rEasyString,rErrorMsg,rHelpful,rInterest,rOverall,rOverallString,rStatus,rTextBookUse,rTimestamp,rWouldTakeAgain,sId,takenForCredit,teacher,teacherGrade,teacherRatingTags,unUsefulGrouping,usefulGrouping
N/A,average,poor,average,0,25664350,2,,average,3,MAT2384,"Knows the subject very well, but can't properly convey his knowledge through the English language. He's chill though, because he would give us hints and ""study guides"" for the midterms and the final. ",12/12/2015,1.0,1.0,,3,Sorta interested,3.0,3.0,1,Yes,1449954232000,N/A,1452,Yes,,N/A,['Lots of homework'],people,people
Not Mandatory,poor,good,poor,4,25548728,2,,awful,1,MAT1318,"Terrible prof. I stopped going to his class after receiving my midterm grades for which i worked really hard for for a week and even when you go to his office to talk about it, he doesnt give marks for what you deserve. Im more than confident he doesnt speak English and he himself gets stuck on questions he is explaining to us. Just go 2 desjardin ",12/04/2015,4.0,4.0,,1,Really into it,1.0,1.0,1,No,1449235310000,N/A,1452,Yes,,N/A,"['Tough grader', 'Lecture heavy', 'Lots of homework']",people,people
Mandatory,good,poor,good,2,25442148,8,,awesome,5,MAT1339,"Amazing, amazing, amazing, amazing, amazing, amazing, amazing. And super helpful. ",11/18/2015,1.0,1.0,,5,It's my life,5.0,5.0,1,Yes,1447858587000,N/A,1452,Yes,,A+,"['Hilarious', 'Caring']",people,people
Mandatory,good,average,good,4,25411860,5,,good,4,MAT2384,Uladzimir is the biggest beauty in the game! Saucing out midterm hints like a bro allowing his class every opportunity to snipe a hundo-p on the test.,11/14/2015,2.0,2.0,,4,It's my life,4.0,4.0,1,Yes,1447461618000,N/A,1452,Yes,,N/A,"['Inspirational', 'Hilarious', 'Caring']",people,people
Mandatory,average,average,good,3,24525605,19,,good,3,MAT1339,"I hadn't taken any math since I finished high school 7 years ago. I got A's in both classes I took with him. If you didn't do well with this guy you put NO work in. So he has an accent, BOO HOO,  get over it. The guy is super helpful,  do text book practice questions. Key to success do a little work. I wish I could take all my classes with him.",03/31/2015,2.0,2.0,,5,Sorta interested,4.0,4.0,1,Yes,1427810626000,N/A,1452,N/A,,A,"['Gives good feedback', 'Caring', 'Hilarious']",people,people
N/A,poor,good,poor,8,24486661,4,,awful,1,CALCULUS,Terrible,03/22/2015,5.0,5.0,,1,Sorta interested,1.0,1.0,1,No,1427041503000,N/A,1452,Yes,,N/A,['Tough grader'],people,people
N/A,poor,good,poor,27,24242073,11,,poor,1,MAT1318,"Nice guy, but not experienced enough to be a prof. Kinda unfair that the university put him as the only prof available. More than 60% was failing by the final.",01/06/2015,5.0,5.0,,2,Meh,1.5,1.5,1,Yes,1420576208000,N/A,1452,Yes,,N/A,['Tough grader'],people,people
N/A,poor,good,poor,18,24164428,14,,awful,1,MAT1318,One of the most difficult to understand and utterly useful professors I have ever come across. He speaks as much english as a wild boar and cannot explain a thing. Math is hard enough for people taking this course (high school math) and you would think he would never have been hired from an interview. DO NOT TAKE THIS CLASS. OPT OUT FOR ONLINE,12/21/2014,5.0,5.0,,1,Sorta interested,1.0,1.0,1,No,1419201013000,N/A,1452,Yes,,N/A,[],people,people
