attendance,clarityColor,easyColor,helpColor,helpCount,id,notHelpCount,onlineClass,quality,rClarity,rClass,rComments,rDate,rEasy,rEasyString,rErrorMsg,rHelpful,rInterest,rOverall,rOverallString,rStatus,rTextBookUse,rTimestamp,rWouldTakeAgain,sId,takenForCredit,teacher,teacherGrade,teacherRatingTags,unUsefulGrouping,usefulGrouping
Not Mandatory,average,average,average,0,31200255,0,,poor,2,CHG3112,"Dr. Ternan is a very smart person, and you can tell he's interested in the subject. However, he is not great at conveying the material and has trouble with simple computer tasks. His exams aren't too tough, try to find previous years examples.",01/04/2019,2.0,2.0,,2,N/A,2.0,2.0,1,No,1546622497000,No,1452,Yes,,A-,['Accessible outside class'],people,people
N/A,average,average,average,0,30474300,5,,average,3,CHG8191,The worst thing was there's full of mistakes on his handouts and sometimes self-contradictory. You must work carefully on checking these inconsistencies before doing homework or exam. If you correct all the mistakes and revise the handouts you would be safe. I think the age of Professor Ternan is the issue he's not that bad.,08/30/2018,2.0,2.0,,3,N/A,3.0,3.0,1,No,1535651885000,No,1452,Yes,,N/A,"['Hilarious', 'Lots of homework', 'Graded by few things']",people,people
Not Mandatory,poor,average,poor,1,30106000,0,,awful,1,CHG2317,"Buy the lecture notes and textbook, you will need them since all tests including final is open book. The only thing that makes going to class worth it is that you can fix the many mistakes in his lecture notes. The only advice I can offer is to use the TA's office hours to help understand, because you aren't going to get any clarity from Ternan.",05/14/2018,3.0,3.0,,1,N/A,1.0,1.0,1,Yes,1526333484000,No,1452,Yes,,N/A,[],people,person
N/A,poor,average,poor,1,29475066,0,,awful,1,CHG2317,"Honestly, Dr. Ternan isn't the best teacher, but he can be very kind outside of class. I strongly recommend reading the textbook, because it explains things very well. Also, don't panic at a bad mark in his class since he bell curves the exams, and I know lots of people who got extra points when they looked over their exams with him.",01/18/2018,3.0,3.0,,1,N/A,1.0,1.0,1,Yes,1516303878000,No,1452,Yes,,N/A,['Get ready to read'],people,person
Not Mandatory,poor,good,poor,8,29453175,0,,awful,1,CHG2317,"There is nothing that can prepare you for the hell that is this course. His teaching style is horrible, he's more confused than his students. Avoid if you can. The quizzes are open book so try to get your hands on past ones because its often repeated.",01/15/2018,5.0,5.0,,1,N/A,1.0,1.0,1,No,1516009738000,No,1452,Yes,,N/A,[],people,people
Not Mandatory,poor,good,poor,12,29188484,0,,awful,1,CHG2317,"Run. He's oblivious to how bad he is at teaching. He mumbles to himself at the front while sucking on a massive piece of mint that covers his entire mouth. He spends the first 20 minutes of class trying to set up his computer and notes, 30 minutes getting lost in his notes, and the last bit correcting his notes which are half in french.",12/13/2017,5.0,5.0,,1,N/A,1.0,1.0,1,Yes,1513204137000,No,1452,Yes,,N/A,[],people,people
N/A,poor,poor,poor,8,28944102,0,,awful,1,CHG2317,Awful.,11/21/2017,1.0,1.0,,1,N/A,1.0,1.0,1,Yes,1511222642000,No,1452,Yes,,Not sure yet,[],people,people
Not Mandatory,poor,good,poor,6,28719974,0,,awful,1,CHG2317,"He provides a course pack with all the notes, but trust me, these are little to no help. His notes are very messy, as he types out many equations in Microsoft word without even using the equation editor, and there are also a lot of mistakes and left-out information. You are better off just looking through the examples and solutions in the textbook.",10/05/2017,4.0,4.0,,1,N/A,1.0,1.0,1,Yes,1507237423000,No,1452,Yes,,N/A,[],people,people
Not Mandatory,poor,average,poor,11,28703709,0,,awful,1,CHG2317,his lectures are extremely boring. he gets confused by his own lecture notes very often (they are extremely messy and full of mistakes). You're probably better off doing the example questions in the textbook than trying to listen to his lectures. if giving a 0/5 rating was possible I would've done it. Best of luck if u have to take his class :),09/28/2017,3.0,3.0,,1,N/A,1.0,1.0,1,Yes,1506632519000,No,1452,Yes,,N/A,['Get ready to read'],people,people
Not Mandatory,average,average,average,4,27846241,2,,poor,2,CHG2317,"Very bad at explaining things, makes a lot of mistakes  and is just a bad prof in general. However, he was a nice guy and available for appointments and really helpful in his office hours. Also, there were't any surprises on the midterm or final, they were very similar to assignments and quizzes. Altogether, not a good.",02/21/2017,3.0,3.0,,2,N/A,2.0,2.0,1,Yes,1487707616000,No,1452,Yes,,A+,"['Clear grading criteria', 'Accessible outside class', 'Get ready to read']",people,people
Mandatory,poor,good,poor,4,27836329,0,,awful,1,CHG2317,"Easily one of the worst profs  His notes are full of mistakes, which makes open book exams almost impossible. He gets confused when trying to lecture. He also doesn't know how to effectively convey the material, and loves to put random content on the quizzes, exam and midterm.",02/17/2017,4.0,4.0,,1,N/A,1.0,1.0,1,Yes,1487290236000,No,1452,Yes,,B-,"['Test heavy', 'Tough grader', 'Lots of homework']",people,people
Mandatory,poor,good,poor,16,27751510,1,,awful,1,CHG2317,"He is the worst professor i have had. He barely does any examples. He just states theory that he doesnt seem to understand himself. When he does do an example, he makes mistakes which the class has to fill in. He seems to backtrack on every word due to mistakes. Midterm average was 46% which was curved to about 60%.",01/18/2017,5.0,5.0,,1,N/A,1.0,1.0,1,Yes,1484772079000,No,1452,Yes,,C+,"['Tough grader', 'Beware of pop quizzes']",person,people
Mandatory,poor,average,poor,0,26715212,0,,awful,1,CHG2717,"One of the worst prof i've ever had. Barely spoke french, the course notes are full of mistakes. He just writes the same notes on the board. One good thing is you can redo all your homework until you get 10/10. I would not suggest this prof, he made easy material super hard.",06/10/2016,3.0,3.0,,1,N/A,1.0,1.0,1,Yes,1465579274000,No,1452,Yes,,N/A,"['Lots of homework', 'Tough grader']",people,people
Mandatory,good,average,good,0,22878610,25,,awesome,5,CHG1234,Excellent,03/02/2014,2.0,2.0,,5,Sorta interested,5.0,5.0,1,Yes,1393734740000,N/A,1452,N/A,,A-,[],people,people
N/A,average,poor,average,0,22033711,14,,average,3,CHG4359,"He's a good prof, his assignments are key! His exams and midterms are based on the assignments, well actually they are the same as his assignments and the exams are open books/assignments soo...",08/07/2013,1.0,1.0,,3,Really into it,3.0,3.0,1,No,1375891182000,N/A,1452,N/A,,N/A,[],people,people
N/A,average,average,average,0,21672262,13,,average,3,CHG3126,Easy going prof. Assignments are always full marks as you can resubmit them. Exams are the similar with the assignments and examples done in class.,05/04/2013,2.0,2.0,,3,Sorta interested,3.0,3.0,1,No,1367633815000,N/A,1452,N/A,,N/A,[],people,people
