attendance,clarityColor,easyColor,helpColor,helpCount,id,notHelpCount,onlineClass,quality,rClarity,rClass,rComments,rDate,rEasy,rEasyString,rErrorMsg,rHelpful,rInterest,rOverall,rOverallString,rStatus,rTextBookUse,rTimestamp,rWouldTakeAgain,sId,takenForCredit,teacher,teacherGrade,teacherRatingTags,unUsefulGrouping,usefulGrouping
N/A,average,good,average,1,20691254,0,,poor,2,LIT111,"She is very cold, she is very intelligent but she's very hard to relate to. She doesn't speak very clearly and often takes a while to get to the point of what she is saying. She is a very intelligent professor and the course reading is interesting, but I'm not a fan of hers.",10/10/2012,4.0,4.0,,2,Sorta interested,2.0,2.0,1,Yes,1349875782000,N/A,1452,N/A,,N/A,[],people,person
N/A,poor,average,poor,1,19047070,0,,awful,1,ENG1101,"Her class was a bad experience! I did well in her class, but I learned nothing. This woman cannot teach at all.",10/05/2011,3.0,3.0,,1,Sorta interested,1.0,1.0,1,Yes,1317844309000,N/A,1452,N/A,,N/A,[],people,person
N/A,good,average,good,0,12718237,1,,awesome,5,INTRO1100,Amazing but tough!,01/03/2007,2.0,2.0,,4,Low,4.5,4.5,1,Yes,1167862630000,N/A,1452,N/A,,N/A,[],person,people
N/A,good,good,good,0,12265395,1,,awesome,5,INTRO101,"Perceptive, extremely intelligent, but taught at a higher level. Very insightful though.",10/04/2006,4.0,4.0,,4,Low,4.5,4.5,1,Yes,1159959038000,N/A,1452,N/A,,N/A,[],person,people
Not Mandatory,poor,good,poor,1,2560448,0,,awful,1,COMPLIT,I had been her student in India and I found her very bad,10/18/2004,5.0,5.0,,1,Meh,1.0,1.0,3,N/A,1098116101000,N/A,1452,N/A,,N/A,[],people,person
N/A,good,good,good,0,1901714,2,,good,5,ENG1120,"She is very intelligent and insightful though her comments to students are sometimes not very encouraging. Great literature picked out though! People say that she is a tough prof. but this is university, after all.",04/05/2004,4.0,4.0,,3,N/A,4.0,4.0,1,N/A,1081170739000,N/A,1452,N/A,,N/A,[],people,people
Not Mandatory,good,poor,good,0,1805095,1,,awesome,5,ENG1101,Very intelligent and informative Professor.,03/13/2004,1.0,1.0,,5,N/A,5.0,5.0,1,N/A,1079215350000,N/A,1452,N/A,,A+,[],person,people
Mandatory,average,average,poor,1,1803324,0,,poor,2,PROSEFICT,"Boring...same thing every day...She's cold as ice to the students...sooo cold that it's funny...Extremely intelligent, but class is boring",03/12/2004,3.0,3.0,,1,N/A,1.5,1.5,1,N/A,1079134994000,N/A,1452,N/A,,N/A,[],people,person
N/A,poor,poor,poor,1,1794528,0,,awful,1,ENG1100,She has problems with understanding what people are asking about. Very useless and boring class.,03/10/2004,1.0,1.0,,1,N/A,1.0,1.0,3,N/A,1078935342000,N/A,1452,N/A,,N/A,[],people,person
