attendance,clarityColor,easyColor,helpColor,helpCount,id,notHelpCount,onlineClass,quality,rClarity,rClass,rComments,rDate,rEasy,rEasyString,rErrorMsg,rHelpful,rInterest,rOverall,rOverallString,rStatus,rTextBookUse,rTimestamp,rWouldTakeAgain,sId,takenForCredit,teacher,teacherGrade,teacherRatingTags,unUsefulGrouping,usefulGrouping
Not Mandatory,good,average,good,0,35711111,0,online,good,4,ENG1112,Classes moved slowly and we just went through powerpoints on grammar and other english topics but prof Santor was engaging with the class and liked to talk a lot so it was still interesting. Tests relied heavily on class readings and fixing grammar problems. The only assignment was a final report but don&#39;t procrastinate as it can be long...,03/07/2022,2.0,2.0,,4,N/A,4.0,4.0,1,N/A,1646624594000,Yes,1452,Yes,,N/A,"['Participation matters', 'Lecture heavy']",people,people
Mandatory,good,average,good,1,35761963,0,online,awesome,5,ENG1112,"Overall this was a pretty easy class, even though English is my second language and my strong suit is definitely NOT writing. The class was not the most fun but the prof made it as bearable as she could. As a person shes the sweetest and super understanding. Just make sure you do the readings!",01/17/2022,2.0,2.0,,5,N/A,5.0,5.0,1,No,1642437391000,Yes,1452,Yes,,A-,"['Accessible outside class', 'Caring', 'Gives good feedback']",people,person
Mandatory,good,average,good,0,35760443,0,online,awesome,5,ENG1112,Professor Bar-On Santor is a truly amazing professor! She cares about her students and she is very accommodating. If you attend class and do the assigned readings you should have no problem getting a good grade in this class.,01/17/2022,2.0,2.0,,5,N/A,5.0,5.0,1,No,1642379466000,Yes,1452,No,,A+,"['Get ready to read', 'Caring', 'Gives good feedback']",people,people
Not Mandatory,good,poor,good,0,35754809,0,online,awesome,5,ENG1112,"Professor Gefen is the sweetest, kindest, and most caring person you will ever meet. When you share your thoughts on something, she really listens. The tests are easy as long as you do your readings and pay attention in class. If you can, please take this course with her! She is always so accommodating and understanding of everyone's situation.",01/14/2022,1.0,1.0,,5,N/A,5.0,5.0,1,No,1642196268000,Yes,1452,Yes,,A+,"['Accessible outside class', 'Clear grading criteria', 'Caring']",people,people
Mandatory,good,poor,good,0,35739650,0,online,awesome,5,ENG1112,"Not even gonna lie I went to like 2 classes the whole semester, read all of the lecture notes the morning of the tests, and did both report 1 and 2 in a few hours and still ended up with an A-, so needless to say this was the easiest class I've ever taken, as for Gefen she seemed like a good prof i think idk lol",01/12/2022,1.0,1.0,,5,N/A,5.0,5.0,1,No,1641951949000,Yes,1452,Yes,,A-,"['Respected', 'Caring', 'Graded by few things']",people,people
Mandatory,good,average,good,0,35730704,0,online,good,4,ENG1112,"This professor knows how to get the material across clearly. The tests were fair game if you read all the required readings prior to the test. Feedback on tests and the report paper were clear and fair. Take this prof, you won't regret it.",01/10/2022,3.0,3.0,,4,N/A,4.0,4.0,1,No,1641848614000,Yes,1452,Yes,,B,"['Gives good feedback', 'Amazing lectures ', 'Clear grading criteria']",people,people
Mandatory,good,average,good,1,35479074,0,online,good,4,ENG1112,"Professor Santor is a good professor. She is nice and even though the lectures can be boring, I actually learned a lot from them. It's most of the same stuff covered in high school but I actually understand how to apply it now. There is a lot of reading but it is doable. The tests are super easy. I studied the night before and got &gt;90 on all 3.",12/12/2021,2.0,2.0,,4,N/A,4.0,4.0,1,No,1639278489000,Yes,1452,Yes,,INC,"['Get ready to read', 'Gives good feedback']",people,person
Mandatory,good,average,good,1,35261698,0,online,awesome,5,ENG1112,She is honestly a real gem. So sweet and considerate and never gets irritated at students if they ask the same questions again. She's very patient and kind and the class is very straightforward. You'll learn a lot of writing skills that will help you your whole life! Solid elective choice 100% recommend.,11/18/2021,3.0,3.0,,5,N/A,5.0,5.0,1,No,1637195820000,Yes,1452,Yes,,N/A,"['Caring', 'Clear grading criteria', 'Get ready to read']",people,person
Mandatory,good,average,good,0,34832877,0,online,good,4,ENG1131,Nice prof but doesn't always give clear instructions. PPT is over 100 slides (3-4 lectures in one PPT). Wouldn't want prof again bc of the length of the PPT. Had 3 quizzes and 4 writing assignments excluding the exam. You're only tested on what was taught in class. The course is open book. You're being graded on attendance.,05/20/2021,3.0,3.0,,4,N/A,4.0,4.0,1,No,1621535289000,No,1452,Yes,,A,[],people,people
Mandatory,good,average,good,1,34829150,0,online,good,4,ENG1112,"Really nice prof and super accommodating. She offers late submissions w only 1% penalty each weekday. Her lecture notes are thorough and the tests are fairly simple since you can usually find the answers either in dgd or lecture notes. However, she sometimes runs out of time during class and has to cover things asynchronously",05/20/2021,3.0,3.0,,4,N/A,4.0,4.0,1,No,1621476063000,Yes,1452,Yes,,A+,"['Caring', 'Graded by few things']",people,person
Mandatory,good,average,good,1,34644759,0,online,awesome,5,ENG1112,"Professor Santor is great! Although lectures are heavy, she tried her best to do. For reports and tests, the feedback is detailed and helpful. During the pandemic, she understands the time zone difference that international students are facing. Just a reminder, for tests, be sure to read DGD PPTs, handouts, and selected readings from DGD handouts.",04/28/2021,3.0,3.0,,5,N/A,5.0,5.0,1,No,1619614982000,Yes,1452,Yes,,B+,"['Get ready to read', 'Respected', 'Accessible outside class']",people,person
Mandatory,poor,good,poor,0,34354030,0,,awful,1,ENG1112,All the other teachers gave their students such good marks and this filler course somehow brought my average down. Useless,02/10/2021,4.0,4.0,,1,N/A,1.0,1.0,1,No,1612928068000,No,1452,Yes,,B+,[],people,people
Mandatory,good,average,good,1,34279439,0,online,good,4,ENG1112,Professor Bar-On Santor is a great and caring professor. The course content is pretty boring but she tries her best. Review the topics discussed in class and read the readings and you'll do well on the tests. Start your report early and speak to your TA outside of class to know what they are expecting from you in your report.,01/15/2021,3.0,3.0,,4,N/A,4.0,4.0,1,Yes,1610673626000,Yes,1452,Yes,,A+,"['Clear grading criteria', 'Get ready to read', 'Accessible outside class']",people,person
Mandatory,good,average,good,0,34262246,0,online,awesome,5,ENG1112,"She is a very nice professor, and always ready to help her students. She is very easy to get in contact with outside of class through email, and very accommodating to her students especially with tech issues and covid-related struggles. Her grading is fair and her feedback is easy to understand. Really chill lectures and dgds too!! take her class !",01/11/2021,2.0,2.0,,5,N/A,5.0,5.0,1,No,1610376281000,Yes,1452,Yes,,A,"['Respected', 'Accessible outside class', 'Gives good feedback']",people,people
Mandatory,good,average,good,0,34245975,0,online,good,4,ENG1112,Tests are open book (10 MC and 10 short answers) and very straightforward. Make sure you read the assigned readings for the tests. Grading is fair for the tests and the report. Lectures are mandatory (attendance grade) and you'll have to do one discussion starter during a lecture/DGD (participation grade) which is easy! Lectures were very chill.,01/06/2021,3.0,3.0,,4,N/A,4.0,4.0,1,Yes,1609972665000,Yes,1452,Yes,,A,[],people,people
Mandatory,good,poor,good,0,34114499,0,,awesome,5,ENG1112,"She is an AMAZING person! So happy and class is judgement free. The class was overall minimal effort, to do well on tests you just have to take notes and read the course readings which can be done in a few hours. No exam just a final report. I learned so much about writing which I can actually see being very useful for the rest of my life.",12/17/2020,1.0,1.0,,5,N/A,5.0,5.0,1,No,1608177348000,Yes,1452,Yes,,N/A,[],people,people
Mandatory,good,average,good,0,34084888,0,online,good,4,ENG1112,"Loved her. Especially with online classes rn, she is the most understanding and sweetest professors I have ever met! She cares about her student's mental health and is very easy to reach out to and chat with! Overall amazing teacher!",12/15/2020,2.0,2.0,,4,N/A,4.0,4.0,1,Yes,1608059770000,Yes,1452,Yes,,A,"['Respected', 'Get ready to read', 'Gives good feedback']",people,people
Mandatory,good,average,good,1,34042567,0,,good,4,ENG1112,"Gefen is extremely nice and accommodating. I actually learned a lot of material that has definitely improved my writing ability. She gives many different examples similar to her tests, which are pretty easy if you study. The required readings can be very long. She's a decent grader. Overall, the class is boring, but she's a good prof.",12/12/2020,2.0,2.0,,4,N/A,4.0,4.0,1,No,1607750276000,Yes,1452,Yes,,A+,"['Participation matters', 'Get ready to read', 'Caring']",people,person
Mandatory,average,good,average,1,33767434,0,online,poor,2,ENG1112,"Great professor, and very kind. Always smiles and loves what she does. HOWEVER, her tests are beyond reason. She teaches to eliminate vagueness, ambiguity, redundancy, etc. but still manages to write her test questions with all these things. Ridiculous.",11/04/2020,4.0,4.0,,2,N/A,2.0,2.0,1,No,1604460967000,No,1452,Yes,,A-,"['Get ready to read', 'Participation matters']",people,person
Mandatory,good,average,good,0,33568885,0,,good,4,ENG1112,"She is a dedicated and caring professor, she tries to make the lectures engaging. Be prepared to read A LOT.",08/07/2020,3.0,3.0,,4,N/A,4.0,4.0,1,Yes,1596841318000,Yes,1452,Yes,,A,"['Lecture heavy', 'Get ready to read', 'Lots of homework']",people,people
Mandatory,good,average,good,0,33134009,0,,awesome,5,ENG1112,"Professor Gefen, you are truly a gem. One of the best profs I had first year. Hated English in H.S, and dreaded going to the first lecture, but I loved this class! Wasn't a huge fan of the lectures, but the report was really fun to write. I loved how comfortable she makes you feel when sharing your answers, with absolutely no judgement! 10/10 !!",04/27/2020,2.0,2.0,,5,N/A,5.0,5.0,1,Yes,1587945718000,Yes,1452,Yes,,A,"['Gives good feedback', 'Caring', 'Accessible outside class']",people,people
Not Mandatory,good,poor,good,0,33016819,0,,awesome,5,ENG2117,"The class reminded me of book club, we all showed up and got to talk about the text we were reading and our own personal experiences with the themes. She smiles when teaching literally the whole time and it is very evident she loves what she does. Is a very caring prof that wants to see you succeed.",04/03/2020,1.0,1.0,,5,N/A,5.0,5.0,1,Yes,1585938387000,Yes,1452,Yes,,A+,"['Amazing lectures ', 'Gives good feedback', 'Caring']",people,people
Mandatory,good,poor,good,0,32832324,0,,good,4,ENG1112,Very boring class but there is nothing she can do about that. Do the readings and participate in the DGD and you'll get an easy A. Don't worry too much about paying attention in the lectures they're really just a third-grade grammar class. Start your report early and apply the feedback she gives to the first report. Good luck,01/14/2020,1.0,1.0,,4,N/A,4.0,4.0,1,Yes,1578968870000,Yes,1452,Yes,,A,"['Participation matters', 'Get ready to read', 'Graded by few things']",people,people
Mandatory,good,poor,good,1,31791547,0,,good,4,ENG1112,"The class is very easy. Show up, pay attention and start your report early and you're guaranteed an A. The tests are sort of hard because there is a lot of reading required. She's probably the hardest ENG prof but she's still pretty easy.",05/07/2019,1.0,1.0,,4,N/A,4.0,4.0,1,No,1557194332000,Yes,1452,Yes,,A+,"['Graded by few things', 'Get ready to read', 'Caring']",people,person
Mandatory,average,poor,average,0,31749782,0,,average,3,ENG1112,"SUPER BORING CLASS, the lectures were very dry and she made it difficult to want to come to class . Yet, she was a pretty easy marker on the papers and was really good about trying to get you as many marks as she can . Class was super easy just bring work from other classes to work on",05/02/2019,1.0,1.0,,3,N/A,3.0,3.0,1,Yes,1556825922000,No,1452,Yes,,A-,"['Lecture heavy', 'Get ready to read', 'Gives good feedback']",people,people
Mandatory,average,average,average,0,31546183,0,,poor,2,ENG1112,"I don like English class, but she was at least interesting some of the time, I did actually learn stuff in her class",04/07/2019,2.0,2.0,,2,N/A,2.0,2.0,1,No,1554678939000,No,1452,Yes,,A,"['Graded by few things', 'Lecture heavy', 'Accessible outside class']",people,people
Mandatory,good,poor,good,0,31275451,0,,good,4,ENG1112,"It's not hard, but attendance is basically required to know what's happening and to pass the class with good marks.",01/17/2019,1.0,1.0,,4,N/A,4.0,4.0,1,No,1547755409000,Yes,1452,Yes,,N/A,['Get ready to read'],people,people
Mandatory,good,average,good,2,31206016,0,,awesome,5,ENG1112,"An absolute sweetheart. The class itself is easy IF YOU DO THE READINGS (Don't try to skim, that's how she gets you). My only complaint is that the readings themselves were very dull most of the time.",01/05/2019,3.0,3.0,,5,N/A,5.0,5.0,1,Yes,1546722981000,Yes,1452,Yes,,N/A,"['Clear grading criteria', 'Get ready to read', 'Caring']",people,people
Mandatory,good,poor,good,1,30758904,1,,awesome,5,ENG1112,One of my favourite professors. She gets to know her students on a more personal level. Follow along during lectures and DGDs and you'll pass with flying colours!,11/19/2018,1.0,1.0,,5,N/A,5.0,5.0,1,Yes,1542663529000,Yes,1452,Yes,,B+,"['Respected', 'Gives good feedback', 'Get ready to read']",person,person
Mandatory,average,poor,average,1,30397166,0,,average,3,ENG1112,This is probably the easiest course I've ever taken. Just show up to lectures to get the attendance marks and do other work in the back. The midterms are super easy as long as you do all the recommended readings. Is it also really easy to do well on the papers as long as you follow the criteria and talk to your TA.,08/02/2018,1.0,1.0,,3,N/A,3.0,3.0,1,Yes,1533225727000,Yes,1452,Yes,,A+,"['Clear grading criteria', 'Get ready to read']",people,person
Mandatory,average,average,average,1,29822340,0,,average,3,ENG1112,Pretty good prof Extremely nice and always willing to help However there is a lot of content in her class you have to do to in order to do well but the content is no too bad just go to the dgds and READ THE SUGGESTED CONTENT BEFORE THE TEST some questions are very specific so a summary of the book wont cut it most of the time and youll be fine,04/17/2018,3.0,3.0,,3,N/A,3.0,3.0,1,Yes,1523974873000,No,1452,Yes,,N/A,"['Tough grader', 'Participation matters', 'Caring']",people,person
Mandatory,good,average,good,2,29489565,1,,awesome,5,ENG2151,"I love her!!!!!!!!! She was always so understanding and caring. Took the time to know her students by name and is just the biggest sweetheart. I have only had one class with her, but wish I had taken more!!! She made the material accessible for all of her students.",01/22/2018,3.0,3.0,,5,N/A,5.0,5.0,1,Yes,1516653639000,Yes,1452,Yes,,A-,"['Participation matters', 'Accessible outside class', 'Caring']",person,people
Mandatory,good,average,good,0,29455570,0,,awesome,5,ENG1112,"Overall a really great professor. Her lectures can be very dull and boring but it's mostly because it's an English class. She truly cares about her students and makes sure that they all do the best they can in class. I learned a lot in the DGD's and if you can, take the DGD with Nick Slagter. He's one of the best TA's I've ever had.",01/15/2018,2.0,2.0,,5,N/A,5.0,5.0,1,Yes,1516042507000,Yes,1452,Yes,,A-,"['Caring', 'Get ready to read', 'Lecture heavy']",people,people
Mandatory,average,average,average,0,29413375,0,,average,3,ENG1112,"She's really boring and I'm not sure if that's her fault or the course's fault but be ready for a snooze fest. There's an attendance mark so go to class, tests aren't that hard literally just reread powerpoints.",01/08/2018,3.0,3.0,,3,N/A,3.0,3.0,1,Yes,1515429629000,No,1452,Yes,,A+,"['Test heavy', 'Get ready to read']",people,people
Mandatory,average,average,average,1,29268299,0,,average,3,ENG1112,"Gefen is a very nice and caring prof. However, she teaches a very dull course (ENG1112) so it's tough to stay engaged. The lectures feel very long but she does her best to try and be passionate about the material. Overall Gefen is a very good prof who teaches a course that it's hard to really care about.",12/18/2017,3.0,3.0,,3,N/A,3.0,3.0,1,Yes,1513639570000,Yes,1452,Yes,,B+,['Get ready to read'],people,person
Not Mandatory,good,average,good,1,29099171,0,,good,4,ENG1112,"For me I hate this class, but that's not her fault, its just the material. She is a very caring and well prepared prof, but sometimes her lectures got extremely boring. I heard shes one of the better teachers for this course.",12/08/2017,3.0,3.0,,4,N/A,4.0,4.0,1,No,1512746291000,Yes,1452,Yes,,Not sure yet,"['Get ready to read', 'Tough grader', 'Clear grading criteria']",people,person
N/A,good,average,good,1,28851346,0,,awesome,5,ENG1112,Great professor. Normally I don't like English and dreaded having to take one as part of my degree but Gefen was such a good teacher that I enjoyed it. I legitimately improved my writing ability (which was horrendous before) and learned a lot from her class. Probably one of the best profs for this required course.,11/07/2017,3.0,3.0,,5,N/A,5.0,5.0,1,No,1510068717000,Yes,1452,Yes,,A+,['Caring'],people,person
Not Mandatory,good,average,good,0,28015964,0,,awesome,5,ENG1112,"Well laid-out course; truly a kind, caring and genuine professor. (If you are not really interested in improving your language and are instead just looking to complete a mandatory course, perhaps she is not your best choice. Her session requires slightly more work than other sessions.)",04/08/2017,2.0,2.0,,5,N/A,5.0,5.0,1,Yes,1491617155000,Yes,1452,Yes,,A+,"['Graded by few things', 'Clear grading criteria', 'Caring']",people,people
Mandatory,good,average,good,0,27697648,0,,good,4,ENG1112,She gave lots of feedback and support when writing reports. Make sure to attend the lectures frequently and always attend the DGD as they're essential to pass the midterms. Make sure to do the readings before the midterm and you'll be golden.,01/09/2017,2.0,2.0,,4,N/A,4.0,4.0,1,No,1483927483000,Yes,1452,Yes,,N/A,"['Gives good feedback', 'Clear grading criteria']",people,people
Not Mandatory,average,poor,average,2,27412711,1,,poor,2,ENG1112,"Her lectures are incredibly boring & uninspired, but the course is extremely easy so you really don't need to show up for class. Just read through the slides and you'll be covering the material in a much faster paced. I could go through each of her 1h 30min lectures  in 15 mins.",12/09/2016,1.0,1.0,,2,N/A,2.0,2.0,1,Yes,1481304210000,Yes,1452,Yes,,N/A,"['Clear grading criteria', 'Tough grader']",person,people
Not Mandatory,good,poor,good,1,26724705,1,,good,4,ENG1112,Please take her class for Technical report writing. You can easily get a good grade in her class. She has 3ish tests (not midterms) and 2 writing assignments. The second writing assignment is basically fixing all the errors you made in the first assignment and expanding on it.  And her DGDs aren't too bad either.,06/14/2016,1.0,1.0,,4,N/A,4.0,4.0,1,Yes,1465914374000,Yes,1452,Yes,,B,"['Gives good feedback', 'Graded by few things', 'Caring']",person,person
Not Mandatory,average,average,average,0,26370647,0,,average,3,ENG1112,The readings and class in general are incredibly boring. Almost everything is straightforward and her tests are identical to the practice tests. Went to class every week and fell asleep every single time. Not sure why I went so often.,04/25/2016,2.0,2.0,,3,N/A,3.0,3.0,1,No,1461585476000,N/A,1452,Yes,,A-,"['Get ready to read', 'Lecture heavy', 'Clear grading criteria']",people,people
Mandatory,good,average,average,2,25789098,4,,average,4,ENG1112,"We were ""taught"" in this class that criticism should be both constructive and correct, so: -The readings in the class were boring, pedantic and always based on the prof's anti-technology obsession. Please find some more diverse readings -The material should  be taught faster, with no  superfluous nagging to students about electronic distractions",12/21/2015,3.0,3.0,,2,Meh,3.0,3.0,1,No,1450698328000,N/A,1452,N/A,,N/A,['Lecture heavy'],people,people
Not Mandatory,average,good,average,2,25695244,0,,average,3,ENG1112,"Lectures are very boring but she is a kind prof, if you take her class MAKE SURE YOU DONT TAKE THE DGD WITH CORY SAMPSON he is the worst DGD instructor i have ever had.",12/14/2015,5.0,5.0,,2,Low,2.5,2.5,1,Yes,1450133052000,N/A,1452,Yes,,N/A,[],people,people
Not Mandatory,average,good,average,3,25631453,0,,average,2,ENG3356,"We spend a lot of time talking about information that won't be on the exam, and yet examinations are long and specific. (We spent four classes on Frankenstein and did not even reach the part where The Monster is created before the semester ended)",12/10/2015,4.0,4.0,,3,It's my life,2.5,2.5,1,Yes,1449765532000,N/A,1452,Yes,,Not sure yet,"['So many papers', 'Get ready to read']",people,people
N/A,good,good,good,2,25351285,0,,awesome,5,ENG1112,Her class is hard for students who use English as the second language. ,11/05/2015,4.0,4.0,,4,Sorta interested,4.5,4.5,1,Yes,1446733931000,N/A,1452,Yes,,N/A,"['Lecture heavy', 'Get ready to read']",people,people
Not Mandatory,good,average,good,2,24650796,0,,awesome,4,ENG1122,"I really enjoyed this prof! I did find that sometimes she was a little repetitive, but she was very helpful with the assignments and showed that she cared about her students. Would take her class again!",04/22/2015,3.0,3.0,,5,Really into it,4.5,4.5,1,Yes,1429740356000,N/A,1452,Yes,,A,['Caring'],people,people
N/A,average,average,average,2,24381866,0,,average,2,ENG1112,Once you get past the accent and misuse of words she is such a nice lady who truly wants you to do well in the course. Posts all her lecture slides online. DGDs are a must since all tests are done then. You can tell she loves her job.,02/12/2015,2.0,2.0,,4,Low,3.0,3.0,1,Yes,1423775633000,N/A,1452,Yes,,N/A,"['Gives good feedback', 'Lecture heavy']",people,people
N/A,good,average,good,1,24305535,0,,awesome,5,ENG1122,"Professor Bar-On Santor really encouraged me to pursue my studies in English Literature. She knows her stuff, and by the end of the class you'll know it just as well. She gives in-depth summaryanalysis, line per line, and everything she says ends up on the midtermfinal. If you listen, do the readings, and retain what she says, it's an easy A! ",01/19/2015,2.0,2.0,,5,Really into it,5.0,5.0,1,Yes,1421669664000,Yes,1452,Yes,,N/A,['Participation matters'],people,person
Not Mandatory,good,poor,good,3,24288464,0,,good,4,ENG1112,"The prof was very forward about expectations and teaches the course as best as she can. The course itself is really boring and besides the fact that it is compulsory for Engineering students, its a complete waste of time.",01/14/2015,1.0,1.0,,4,Meh,4.0,4.0,1,Yes,1421259737000,N/A,1452,Yes,,B+,['Lecture heavy'],people,people
Not Mandatory,average,good,average,0,24269043,3,,poor,3,ENG1112,"Her lectures are long, boring, and her voice drags on and on. The content of the course itself is extremely dry, making it difficult to attend class. The TA's mark extremely hard and the DGD's are super boring. She has very strict views (hates technology etc..) and she will yell at you if you talk during class.  Avoid if you can!!!!! ",01/11/2015,4.0,4.0,,1,Low,2.0,2.0,1,No,1421006484000,N/A,1452,Yes,,N/A,"['Tough grader', 'Get ready to read', 'Lecture heavy']",people,people
N/A,average,good,poor,0,24012642,1,,poor,2,ENG1112,"PLs avoid her class because you will be writing the stupid report since the beginning of the semester.  Compare to another sections, this is not an ""easy to pass one"". When going to her lectures, you won t get anything except sentence corrections(boring). The TAs are hard markers. My worst class ever.",12/10/2014,5.0,5.0,,1,Meh,1.5,1.5,1,Yes,1418177482000,N/A,1452,Yes,,Not sure yet,"['Lecture heavy', 'Tough grader', 'So many papers']",person,people
Not Mandatory,poor,good,average,2,23809602,2,,poor,1,ENG1112,"Lectures are not worth going to. This course teaches you how to write sentences, something a 10 year old child in elementary school can do. She is against technology. DGDs are boring. This course fails miserably to educate you in writing and is a complete waste of time. If you value your life DO NOT TAKE THIS COURSE. ",11/13/2014,5.0,5.0,,3,Meh,2.0,2.0,1,No,1415903776000,N/A,1452,N/A,,A+,"['Lecture heavy', 'Get ready to read', 'So many papers']",people,people
Not Mandatory,good,average,average,1,23792251,1,,good,4,ENG1122,"She speaks to her students, and she provides fantastic feedback on midterms which allows you to learn where you went wrong and improve drastically.",11/11/2014,3.0,3.0,,3,It's my life,3.5,3.5,1,Yes,1415745909000,N/A,1452,Yes,,A-,"['So many papers', 'Get ready to read', 'Amazing lectures ']",person,person
