attendance,clarityColor,easyColor,helpColor,helpCount,id,notHelpCount,onlineClass,quality,rClarity,rClass,rComments,rDate,rEasy,rEasyString,rErrorMsg,rHelpful,rInterest,rOverall,rOverallString,rStatus,rTextBookUse,rTimestamp,rWouldTakeAgain,sId,takenForCredit,teacher,teacherGrade,teacherRatingTags,unUsefulGrouping,usefulGrouping
Not Mandatory,poor,good,poor,0,26210050,0,,awful,1,SOC2309,One of the worst Professors I've had at uOttawa. She is a horrible lecturer she assigns random articles chapters of books to read with no guideline as to how this relates to anything we are studying. Her exams are overly long especially for a mid-term she even had to give the entire class a 5% mark boost because people could finish the test AVOID!,03/31/2016,5.0,5.0,,1,N/A,1.0,1.0,1,No,1459426842000,N/A,1452,Yes,,C,"['Get ready to read', 'Tough grader']",people,people
N/A,average,good,average,0,19545888,0,,poor,2,SOC2309,Great prof in general. No powerpoints.Lots of readings... most of the exam questions are related to the readings.,12/16/2011,4.0,4.0,,2,Low,2.0,2.0,1,Yes,1324071005000,N/A,1452,N/A,,N/A,[],people,people
N/A,poor,good,poor,0,18913309,0,,awful,1,SOC2309,Professor does not explain the significance of the readings she assigns. Awful lecturer with no teaching aids whatsoever. Exams/tests are extremely specific and students are not allocated sufficient time to finish. Without a doubt the worst experience I have ever had at university. AVOID AT ALL COSTS.,08/13/2011,5.0,5.0,,1,Sorta interested,1.0,1.0,1,Yes,1313252495000,N/A,1452,N/A,,N/A,[],people,people
N/A,poor,good,poor,0,18812616,0,,awful,1,SOCA,"she is terrible, so mean and makes life harder for students. makes her rules unbearable. doesn't care about her students. goes all over the place. ohh boy she talks way to much",07/12/2011,5.0,5.0,,1,Meh,1.0,1.0,1,Yes,1310494713000,N/A,1452,N/A,,N/A,[],people,people
N/A,average,good,average,1,18032167,0,,average,3,SOC3106,"SHES ALRIGHT, SHE DOESNT USE ANY POWER POINTS THOUGH SO IT GETS HARD TO FOLLOW HER. CAUSE ALL SHE DOES IT TALK AND TALK ABOUT THE WEBER DUDE. KINDA GOES ALL OVER PLACE SOMETIMES CAUSE SHE JUST STANDS THERE AND TEACHES, WOULD BE HELPFUL IF SHE PUT SOME SLIDES UP. OVERALL GOOD PROF, SHE VERY FAIR AND DOES NOT SCREW THE STUDENTS OVER",12/23/2010,4.0,4.0,,3,Meh,3.0,3.0,1,Yes,1293112729000,N/A,1452,N/A,,N/A,[],people,person
N/A,good,average,average,0,17315199,0,,average,4,SCO2309,she is good,06/08/2010,3.0,3.0,,1,Really into it,2.5,2.5,1,No,1276010624000,N/A,1452,N/A,,N/A,[],people,people
