attendance,clarityColor,easyColor,helpColor,helpCount,id,notHelpCount,onlineClass,quality,rClarity,rClass,rComments,rDate,rEasy,rEasyString,rErrorMsg,rHelpful,rInterest,rOverall,rOverallString,rStatus,rTextBookUse,rTimestamp,rWouldTakeAgain,sId,takenForCredit,teacher,teacherGrade,teacherRatingTags,unUsefulGrouping,usefulGroupingNot Mandatory,good,average,good,0,22637789,0,,awesome,5,PSY2110,"Cool prof! Was my fav class during that semester. Loved the material, his jokes, slides, everything! Wish I can have him for another psychology class in the future! Keep up with the readings and pay attention in class and you're set!",12/21/2013,2.0,2.0,,5,It's my life,5.0,5.0,1,Yes,1387667767000,N/A,1452,N/A,,A-,[],people,people
N/A,good,average,good,0,21073216,0,,awesome,4,PSY2106,"Great Prof! Works super hard to get you to understand. His slides are incredible! The book is a must as it helps you understand the material in greater detail and great questions to practice! Hes loves to help his students do well, so go to class, go to the DGD and see him in office hours and you will pass! :D",12/14/2012,3.0,3.0,,5,It's my life,4.5,4.5,1,Yes,1355502931000,N/A,1452,N/A,,N/A,[],people,people
N/A,good,average,good,0,20873890,0,,awesome,5,PSY2106,"Great professor. I was scared going into the class because I was horrible at Math in high school but sure enough, I'm going into the final exam with a high 80!  He's very clear and tries his hardest to make sure everyone understands. His midterms are tough but fair. I would recommend him to anyone and he posts things online but class is beneficial",11/21/2012,3.0,3.0,,5,Meh,5.0,5.0,1,Yes,1353514264000,N/A,1452,N/A,,N/A,[],people,people
N/A,good,average,good,0,20579013,0,,awesome,5,PSY1101,"Best prof i had for that semester! Very interesting, gives more information than the textbook. Also, his multiple questions can be funny. Recommend him!!!!",08/16/2012,2.0,2.0,,5,It's my life,5.0,5.0,1,Yes,1345076820000,N/A,1452,N/A,,N/A,[],people,people
N/A,good,poor,good,0,20017045,0,,awesome,5,PSY1101,"Was repeating this course to boost my GPA - took 1102 with him a hundred years ago. Still a really nice guy! Very clear, very helpful if you have questions that are even outside of course material. Didn't have much breathing room to personalize the course but still threw in some interesting stuff here and there! :) I recommend him.",04/09/2012,1.0,1.0,,5,It's my life,5.0,5.0,1,Yes,1333978150000,N/A,1452,N/A,,N/A,[],people,people
N/A,good,poor,good,0,19916633,0,,awesome,5,PSY1101,"Capstick is great. Although he adheres to the textbook quite a bit he still throws in some extra information for those who want to know the details. Great professor. And yes, totally has the look of the guy from American history x !",03/16/2012,1.0,1.0,,5,It's my life,5.0,5.0,1,Yes,1331890406000,N/A,1452,N/A,,N/A,[],people,people
N/A,good,poor,good,0,19817551,0,,awesome,5,PSY1101,"He really makes the class as interesting as possible. Not necessary to attend class, everything is in the book.  He looks like Edward Norton from American History X ;)",02/10/2012,1.0,1.0,,5,It's my life,5.0,5.0,1,Yes,1328900913000,N/A,1452,N/A,,N/A,[],people,people
